மேலும், இந்திய இராணுவ படையினரின் தாக்குதலினால் இரண்டு பாகிஸ்தானிய பொதுமக்கள் கொல்லப்பட்டனர் என்றும், மேலும் எட்டு பேர் காயமடைந்தனர் என்றும் ஒரு பாகிஸ்தான் இராணுவ செய்தித் தொடர்பாளர் அறிவித்தார்.
நாளிதழ் சமூக ஜனநாயகக் கட்சி (SPD) தலைவர் மார்டீன் சூல்ஸை ஒரு "பரிதாபகரமானவர்" என்று குறிப்பிட்டதுடன், SPD இன் தற்போதைய வெளியுறவு அமைச்சர் சிக்மார் காப்ரியேல் குறித்து “போட்டி, பகுதிவெற்றி, தோல்வி” என்று ஒரு கட்டுரைக்கு தலைப்பிட்டது.
இந்த மோதல்களைத் தூண்டிவிட்டு வரும் அரசியல் பிரச்சினைகள் குறித்த ஒரு பகுப்பாய்வை ஒருவர் தேடினால் பிரயோசனமற்றதாகத்தான் இருக்கும்.
இதற்கு ஒரு சாதாரணமான காரணம் உள்ளது.
“ஐரோப்பா மீது இன்னும் பலமாக ஒருமுனைப்பட" வேண்டுமென விரும்புகிறார்கள்.
இந்த சவால்கள் முக்கியமாக இராணுவத்துறையில் இருப்பதாக பார்க்கப்படுகிறது.
எழுத்தாளர்கள், “இராணுவ பலத்தின் முக்கியத்துவம் தொடர்ந்து தீவிரமடைந்து வருவது குறித்தும், எல்லா பாதுகாப்பு விடயங்களிலும் ஐரோப்பியர்கள் அமெரிக்காவை சார்ந்திருப்பதைக் குறித்தும்" குறைமதிப்பீடு செய்வதாக அவர்களை குற்றஞ்சாட்டுகிறார்கள்.
எழுத்தாளர்களால் ஒரு நப்பாசையாக எடுத்துக் கொள்ளப்படுகிறது.
அதில் அவர், அதில் உள்ளடங்கிய எல்லா விளைவுகளுடன், வெளிப்படையாகவே தன்னை அட்லாண்டிக்வாதத்திற்கு பின்னான காலத்தவர்களின் முகாமில் நிறுத்திக் கொள்கிறார்.
அமெரிக்காவின் பாத்திரத்தை "ஒரு பாதுகாப்பிற்குரியதாக சுயமாகவே எம்மை நோக்கிய தன்மை "உடையத்" தொடங்கி உள்ளது.
இராணுவவாதம் மற்றும் வல்லரசு கொள்கைகளது புதுப்பிப்பே, கிறிஸ்துவ ஜனநாயக ஒன்றியம், கிறிஸ்துவ சமூக ஒன்றியம் மற்றும் சமூக ஜனநாயகக் கட்சிக்கு இடையே ஒப்புக் கொள்ளப்பட்ட கூட்டணி உடன்படிக்கையின் மூலக்கருவை உருவாக்குகிறது.
“உலகிற்கான சமாதானம், சுதந்திரம் மற்றும் பாதுகாப்பிற்கு ஜேர்மனியின் கடமைப்பாடு" என்ற 20 பக்கங்கள் கொண்ட அத்தியாயம், மேற்கு பால்கன்களில் இருந்து, ரஷ்யா, உக்ரேன், ஆப்கானிஸ்தான், துருக்கி, மத்திய கிழக்கு, ஆபிரிக்கா, இலத்தீன் அமெரிக்கா மற்றும் ஆசியா வரையில் எண்ணற்ற நாடுகள், பிராந்தியங்கள் மற்றும் கண்டங்களை மீண்டுமொரு ஜேர்மன் ஏகாதிபத்தியத்தின் மேலாதிக்க மண்டலங்களாக குறிப்பிடுகிறது.
மத்திய பாதுகாப்பு கொள்கை பயிலகம், முனீச் பாதுகாப்பு கருத்தரங்கம், வெளியுறவு விவகாரங்களுக்கான ஜேர்மன் பயிலகம் மற்றும் வெளியுறவுகளுக்கான ஜேர்மன் கவுன்சில் ஆகியவை இத்தகைய அமைப்புகளில் உள்ளடங்குகின்றன.
2015 ஆம் ஆண்டில், சிறிசேன, ஸ்ரீ.ல.சு.க. இல் இருந்த ஜனாதிபதி இராஜபக்ஷவுடன் முறித்துக் கொண்டு, விக்கிரமசிங்கவுடன் கூட்டுச் சேர்ந்து அந்த ஆண்டு ஜனாதிபதி தேர்தலில் போட்டியிடுவதற்காக வெளியேறினார்.
இந்த நகர்வு, முன்னாள் ஜனாதிபதி சந்திரிகா குமாரதுங்கவுடன் ஒத்துழைத்து, வாஷிங்டனால் திட்டமிடப்பட்ட ஒரு ஆட்சி மாற்ற நடவடிக்கையின் பகுதியாக இருந்தது.
சிறிசேன-விக்கிரமசிங்க அரசாங்கத்தின் ஜனநாயக-விரோத குணாம்சத்தைப் பற்றிய சோசலிச சமத்துவக் கட்சியின் எச்சரிக்கைகளை ஜே.வி.பி. கடுமையாக எதிர்த்தது.
ஜே.வி.பி. 1966ல் ஸ்தாபிக்கப்பட்ட போது, கிராமப்புற இளைஞர் சந்ததியினரை பிழையாக வழிநடத்த, மாவோவாத மற்றும் காஸ்ட்ரோவாத குட்டி முதலாளித்துவ போலி மருந்தை ஜே.வி.பி. பயன்படுத்தியது.
1980களில் ஜனாதிபதி ஜே.ஆர். ஜயவர்த்தன திறந்த சந்தை கொள்கைக்கு மாறியதற்குகு எதிரான தொழிலாள வர்க்கத்தின் பொது வேலைநிறுத்தத்தை அடிபணியச் செய்வதில் கட்சி முக்கிய பங்கைக் கொண்டிருந்தது.
1980களின் பிற்பகுதியில் அது எதிர்க்கட்சி குழுக்களுக்கும், பத்திரிகையாளர்களுக்கும், தொழிலாள வர்க்க அமைப்புக்களுக்கும் மற்றும் தமிழர்களுக்கும் எதிராக ஒரு கொடூரமான பிரச்சாரத்தை முன்னெடுத்தது.
குமாரதுங்க தனது இரண்டாவது பதவிக் காலத்தில் பாராளுமன்ற பெரும்பான்மையை இழக்கும் நிலையை எதிர்கொண்டபோது, ஜே.வி.பி. அவரது அரசாங்கத்திற்கு தேவையான வாக்குகளை வழங்கியதோடு அவரது அமைச்சரவைக்குள்ளும் நுழைநது கொண்டது.
2005 ஜனாதிபதித் தேர்தலில், ஜே.வி.பி. இராஜபக்ஷவின் வெற்றியை உத்தரவாதப்படுத்தி அவருடன் ஒரு உடன்படிக்கைக்குச் சென்றது.
அதன் மூலம் யுத்தத்தை தீவிரமாக்கவும் ஜனநாயக உரிமைகள் மீதான பெரும் தாக்குதல்களை முன்னெடுக்கவும் வழி அமைத்துக் கொடுத்தது.
இன்று, 2008 இல் வெடித்த நிதிய நெருக்கடியினால் ஏற்பட்டுள்ள உலகளாவிய முதலாளித்துவ நெருக்கடிக்கு மத்தியில், முதலாளித்துவ ஜனநாயகம் பொறிந்து கொட்டிக்கொண்டிருக்கின்றது.
கொழும்பில் காணப்படும் கொந்தளிப்பு நிலைமை, இந்த சர்வதேச போக்கின் ஒரு கூர்மையான வெளிப்பாடு ஆகும்.
உத்தியோகபூர்வ பாராளுமன்ற வழிமுறைகளுக்கு எதிராக, தொழிலாளர்கள், தெற்காசிய சோசலிச குடியரசுகளின் ஒரு ஐக்கியப்பட்ட ஒன்றியத்தின் ஒரு பகுதியாக, சோசலிசக் கொள்கைகளை நடைமுறைப்படுத்த ஒரு தொழிலாளர்கள் மற்றும் விவசாயிகளின் அரசாங்கத்தை ஸ்தாபிப்பதற்கு, நடவடிக்கைக் குழுக்கள் உட்பட தமது சொந்த வர்க்க அமைப்புக்களை கட்டியெழுப்ப வேண்டும்.
ஒரு பக்கத்தில், இரண்டாம் உலகப் போரின் சமயத்து பிரான்சின் நாஜி ஒத்துழைப்புவாத ஆட்சியின் வழிவந்த தேசியமுன்னணியைச் சேர்ந்த மரின் லு பென் நிற்கிறார்.
சொந்த நாட்டில் ஒரு பாசிச போலிஸ் சர்வாதிகாரத்தை அமைப்பதற்கும், புலம்பெயர்வை தடைசெய்வதற்கும், பாரிய சோதனைகளை நடத்துவதற்கும் மற்றும் பிரெஞ்சுக் குழந்தைகளாக இல்லாவிட்டால் அவர்கள் இலவசமாக கல்வி கற்பதை நிறுத்துவதற்கும் அவர் சோசலிஸ்ட் கட்சியின் அவசரகால நிலையையும் பாரிய மின்னணு வேவு எந்திரத்தையும் பயன்படுத்திக் கொள்வார்.
ஜேர்மனியினதும், அமெரிக்காவில் ஜனநாயகக் கட்சியினதும் ஒரு கூட்டாளியான மக்ரோன், சிரியா, வடகொரியா மற்றும் ரஷ்யாவுக்கு எதிரான நேட்டோவின் போர் முனைப்புக்கு -இது அணுஆயுத சக்திகளுக்கு இடையிலான போருக்கு தூண்டிவிட அச்சுறுத்துகிறது-
சொந்த நாட்டில் அவர் அவசரகாலநிலையை தொடர்ந்து பராமரிக்கவும், பொது சுகாதார பராமரிப்பு மற்றும் ஓய்வூதியங்கள் உள்ளிட இருபதாம் நூற்றாண்டில் ஐரோப்பிய தொழிலாளர்கள் பல தலைமுறை காலமான போராட்டங்களின் மூலமாக பெற்றெடுத்த ஒப்பந்தங்கள் மற்றும் சமூக உரிமைகளை கிழித்தெறிவதற்கும் அவசரகால நிலையையும் அதனுடன் PS இன் வெறுப்புக்குரிய தொழிலாளர் சட்டத்தையும் பயன்படுத்துவதற்கும் நோக்கம் கொண்டுள்ளார்.
எந்த வேட்பாளர் வென்றாலும், நிதி மூலதனத்தின் நலன்களை பிரதிநிதித்துவம் செய்கின்றதும், நாட்டிற்குள் வர்க்கப் போர் மற்றும் எல்லைகளுக்கு வெளியே ஏகாதிபத்தியப் போர் ஆகியவற்றின் ஒரு வேலைத்திட்டத்திற்கு அர்ப்பணித்து கொண்டதுமான ஒரு அரசாங்கத்தாலேயே பிரான்ஸ் ஆளப்படுவதாய் இருக்கும்.
2008 வோல் ஸ்டீரீட் பொறிவுக்குப் பின்னர் கட்டவிழ்ந்திருந்த சமூக மற்றும் பொருளாதார பொறிவைத் தவிர்த்த வேறு எதனையும் அறிந்திராத இளைஞர்கள் மத்தியில், ஐயத்திற்கிடமில்லாத ஒரு புரட்சிகர மனோநிலை பெருகிக் கொண்டிருக்கிறது.
இந்த நிலைப்பாடானாது, தனிநபர்கள் வாக்களிக்காது விடுவதற்கான அழைப்பில் இருந்து முற்றிலும் வேறுபட்டதாகும்.
சென்றமுறை 2002 இல் ஜோன்-மரி லு பென்னுக்கும் ஜாக் சிராக்குக்கும் இடையில் இறுதிச்சுற்று நடைபெற்ற போது FN ஐ தடுத்துநிறுத்துவதாகச் சொல்லி ஒரு வலது-சாரி அரசியல்வாதியின் பின்னால் PS உடன் இணைந்த “அதி இடது” கட்சிகளாக சொல்லப்படுபவை உள்ளிட்ட ஒட்டுமொத்த அரசியல் ஸ்தாபகமும் அணிவகுத்ததில் இருந்தே பிரான்சில் தொழிலாளர்கள் பலரும் இந்த முடிவுக்கு வந்து விட்டனர்.
இந்த தேர்தல் மற்றும் அதனை உருவாக்கிய அரசியல் அமைப்புமுறை ஆகியவற்றின் ஒட்டுமொத்த பிற்போக்குத்தனமான கட்டமைப்பையும் நிராகரிப்பது அவசியமாகும்.
ஜோன் லூக் மெலோன்சோனின் அடிபணியா பிரான்ஸ் (UF) இயக்கம் மற்றும் புதிய முதலாளித்துவ-எதிர்ப்புக் கட்சி (NPA)  போன்ற சக்திகள், “குறைந்த தீமை” வாதத்திற்கு தம்மை தகவமைத்துக் கொண்டு மக்ரோனுக்கு எதிராக இடதுபக்கத்தில் இருந்து எழுகின்ற புரட்சிகரமான எதிர்ப்பை தடுத்துநிறுத்துவதில் வெற்றிகாண்கிற மட்டத்திற்கு அவை FN ஐ வலுப்படுத்துவதை மட்டுமே செய்துகொண்டிருக்கின்றன என PES எச்சரிக்கிறது.
அவர் 20 சதவீத வாக்குகளைப் பெற்றிருந்தார்.
அவ்வாறிருந்தும், மக்ரோனை ஆதரித்தால் தனது வாக்காளர்களிடையே தான் மதிப்பைத் தொலைக்க நேரும் என்று அஞ்சி மக்ரோனை வெளிப்படையாக ஆதரிக்க அவர் மறுக்கின்ற அதேநேரத்தில், மக்ரோன் மற்றும் லு பென் இருவருக்கும் எதிரான தொழிலாள வர்க்கத்தின் அணிதிரட்டலைத் தடுப்பதற்காக தன்னால் இயன்ற அத்தனையையும் அவர் செய்து கொண்டிருக்கிறார்.
பிரெஞ்சு அரசியல் ஸ்தாபகத்தின் முற்றுமுதலான முட்டுச் சந்தானது, போர் மற்றும் சர்வாதிகாரம் என்ற அதலபாதாளத்திற்குள் மூழ்கிக் கொண்டிருக்கின்ற உலக முதலாளித்துவ அமைப்புமுறையின் ஒரு மரண நெருக்கடியில் வேரூன்றியிருக்கிறது.
அக்டோபர் புரட்சியின் இந்த நூறாவது ஆண்டில், 1917 இல் லெனின் மற்றும் ட்ரொட்ஸ்கியின் போல்ஷிவிக் கட்சியால் முன்வைக்கப்பட்ட சமரசமற்ற சோசலிச மற்றும் சர்வதேசிய வேலைத்திட்டம் மற்றும் ICFI ஆல் பாதுகாக்கப்பட்ட ட்ரொட்ஸ்கிச பாரம்பரியம் ஆகியவற்றின் பிரதிநிதியாக சோசலிச சமத்துவக் கட்சி (PES) தன்னை முன்நிறுத்திக் கொள்கிறது.
ஜூலை 18, 2012 அன்று மாருதி சுசூகி நிறுவன தொழிற்சாலை தளம் ஒன்றில் நிறுவனத்தால் தூண்டிவிடப்பட்ட கைகலப் .
ஒரு மூத்த வழக்கறிஞரும், மாருதி சுசூகி தொழிலாளர்களின் முன்னணி வழக்கறிஞர்களில் ஒருவருமான ரெபேக்கா ஜோனை செய்தியாளர் குழு சந்தித்தது.
முடிந்தவரை அதிகளவு தொழிலாளர்களைச் சுற்றிவளைத்து பிடிப்பதில் மட்டுமே அவர்கள் ஆர்வமாக இருந்தனர்”
நீங்கள் ஒரு போராட்டத்தின் முன்னணியில் இருந்தால், நீங்கள் அறியப்பட்ட முகங்கள் ஆவீர்கள்.
அவர்களின் பெயர்கள் நன்கு அறியப்பட்டவையாக இருந்தன.
அவர்களின் விதியை, நீதிமன்றம் விடுவிக்கவேண்டி இருந்த அந்த 117 பேருடன் அவர் வேறுபடுத்திக் காட்டினார்.
“(மேலாளர் அவனிஷ் தேவ்) தப்பித்து செல்லமுடியாத அளவிற்கு அவர் கால்களில் தாக்கப்பட்டிருந்தார் என்பதே வாதித் தரப்பின் முக்கிய வழக்காக இருந்தது.
நெருப்பைப் பற்றவைத்தது யாரென்று வாதித் தரப்பினரால் நிரூபிக்க முடியாது என்பதை எவரும் நிராகரிக்க முடியாதென நான் சவால் விடுகிறேன் என்று நீதிமன்றத்தில் நான் வாதிட்டேன்.
பின்னர், தொழிலாளர்கள் கதவு உத்திரங்களையும், அதிர்ச்சியூட்டும் எந்திரங்களையும் ஆயுதங்களாகப் பிரயோகித்ததாக வாதித் தரப்பு கூறியதாக பொலிஸின் முதல் தகவல் அறிக்கையில் (First Information Report - FIR) கூறப்பட்டிருந்ததுடன் அது வெளிப்படையான முரண்பாட்டைக் கொண்டிருந்தது.
எனவே, கம்புகளும், இரும்புத் தடிகளும் தான் பயன்படுத்தப்பட்டிருந்ததாக FIR ல் திட்டவட்டமாக கூறியிருந்தாலும், வாதித் தரப்பு மிகவும் வசதியாக அதை கதவு உத்திரங்கள் மற்றும் அதிர்ச்சியூட்டும் எந்திரங்கள் என்று மாற்றியது”
நீதிமன்றத்தில், ஜோன் விளக்கியதுபோல, “பொலிஸூம், வாதித் தரப்பும் அவர்களது அசல் கூற்றின்படி குண்டாந்தடிகள் ( .
பொய்களையும், தவறான கூற்றுக்களையுமே வாதித் தரப்பு அடிப்படையாக கொண்டிருந்ததை காட்டிய மற்றொரு சம்பவமாக இது இருந்தது.
மலிவுகூலி உழைப்பு வேலையிட நிலைமைகள் மீதான எதிர்ப்பை மாருதி சுசூகி தொழிலாளர்களின் போராட்டம் தூண்டியது.
மேலே படத்தில், அக்டோபர் 2011 ல் மானேசர் தொழிலாளர்களுக்கு ஆதரவாக சுசூகி பவர்ட்ரெய்ன் தொழிலாளர்கள் அனுதாப வேலைநிறுத்தத்தில் ஈடுபட்டது.
