இதன் போது அரசியலமைப்புச் சபை தொடர்பில் கருத்துத் தெரிவித்த சபை முதல்வர் அமைச்சர் லக்ஷ்மன் கிரியெல்ல; 18ஆவது அரசியலமைப்பு முன்னாள் ஜனாதிபதி மஹிந்த ராஜபக்ஷவின் கீழ்தான் செயற்பட்டது.
18ஆ வது அரசியலமைப்புத் திருத்தத்தை மஹிந்த ராஜபக்ஷ தமக்கேற்ற விதத்திலே செயற்படுத்தினார்.
இவர் மட்டக்களப்பு படுவான்கரைப் பிரதேசத்தின் கொக்கட்டிச்சோலைப் பிரதேசத்திலுள்ள முனைக்காடு எனும் கிராமத்தைச் சேர்ந்தவராவார்.
அங்கு தண்ணீர்த் தாங்கி நிரப்ப வந்தர்களிடம் விசாரித்தபோது அவர் நாவலடியில் நிற்பதாகச் சொன்னார்கள்.
உள்நாட்டு யுத்தம் தீவிரம் அடைந்திருந்தமையால் அவரது உடலை இலங்கை கொண்டு வருவதில் பல சிரமங்கள் காணப்பட்டன.
இதனால் உறவினர்கள் அவரது உடலை 25 வருடங்களுக்கு பாதுகாக்க நிறுவனம் ஒன்றிடம் ஒப்படைத்தனர்.
இவ்வாறான நிலையில் தற்போது 25 வருடங்கள் கடந்த நிலையில் அவரது சடலத்தை பெற்று உறவினர்கள் இலங்கை கொண்டு வந்துள்ளனர்.
போட்டி ஆரம்பித்து 3ஆவது நிமிடத்தில் இந்திய முன்கள வீரர் மூலம் உதைத்த பந்தை இலங்கை கோல் காப்பாளர் சுஜான் பெரேரா தடுக்கும்பொழுது பந்து முன்னேற, அதனை இலங்கை பின்கள வீரர்கள் அங்கிருந்து வெளியேற்றினர்.
11ஆவது நிமிடத்தில் இலங்கை அணியின் மோசமான பந்துப் பரிமாற்றத்தின்போது மத்திய களத்தில் இருந்து பந்தைப் பெற்ற இந்திய வீரர்கள் இலங்கை அணியின் பெனால்டி எல்லை வரை அதனைக் கொண்டு சென்று கோல் நோக்கி உதைத்தனர்.
மீண்டும் 16ஆவது நிமிடத்தில் இந்திய வீரர்கள் மத்திய களத்தில் இருந்து பெற்ற ப்ரீ கிக் உதையை கோலுக்கு அண்மையில் இருந்து சுஜான் பிடித்தார்.
போட்டியின் 35ஆவது நிமிடத்தில் ஆட்டத்தின் நேரத்தை வீணடித்த குற்றத்திற்காக கோல் காப்பாளர் சுஜான் பெரேராவுக்கு மஞ்சள் அட்டை காண்பிக்கப்பட்டது.
பந்து எதிர்பாராத விதத்தில் சுஜான் பெரேராவின் தலைக்கு மேலாக வந்து கோலின் ஒரு பக்க மூலையினால் வலைக்குள் சென்றது.
54ஆவது நிமிடத்தில் மத்திய களத்தில் இருந்து வழங்கப்பட்ட பந்தை கவிந்து இஷான் பெற்று முன்னேறி, மீண்டும் அசிகுர் ரஹ்மானுக்கு வழங்க அவர் கோல் நோக்கி உதைந்தார்.
எனினும் இந்திய கோல் காப்பாளர் அதனை சிறப்பாகப் பற்றிக்கொண்டார்.
மாகாண ஆளுநர் அலுவலகம் முன்பாக இவர்கள் போராட்டம் நடாத்தினர்.மாகாண சபையின் எதிர் கட்சித் தலைவர் ரா.மு.ரத்நாயக, எம்.சச்சிதாநந்தன்,கே.ருத்திர தீபம் உள்ளிட்ட ஐ.தே.க.மாகாண சபை உறுப்பினர்கள் இதில் பங்கேற்றிருந்தனர்.மாகாண சபை அமர்வு நேற்று (10) இடம் பெற்றபோது சபை நடவடிக்கைகளை பகிஷ்கரித்து இவர்கள் சத்தியாக்கிரயத்தில் ஈடுபட்ட்டனர்.
தி.மு.க தலைவர் கருணாநிதியின் குடும்ப அரசியலை மறைந்த முதல்வர்கள் எம்.ஜி. ஆர். - ஜெயலலிதா ஆகியோர் எதிர்த்து போராடினர்.
இது தொண்டர்கள் மத்தியில் அதிருப்தியை ஏற்படுத்தி உள்ளது.
வேலுார் மாவட்ட நிர்வாகிகள் மற்றும் நகர, ஒன்றிய செயலர்கள் முழு ஒத்துழைப்பு அளிக்காததால் விரைவில் அவரும் பன்னீர் அணிக்கு தாவலாம் என தெரிகிறது.
இந்த நிலையில் மீண்டும் கனகதுர்கா தனது வீட்டுக்குச் சென்ற போது அது பூட்டப்பட்டிருந்தது.
அவரது கணவரை அழைத்து விசாரித்தனர்.
அவர் வீட்டின் சாவி தொலைந்துவிட்டதாகக் கூறிவிட்டார்.
ஆனால் தமிழகத்தைப் பொறுத்தவரை இந்தத் தேர்தலுக்கு முன்னால் அ.தி.மு.க - அ.ம.மு.க இணைப்புக்கு வாய்ப்புள்ளதா என்பதே தலைப்பு செய்தியாக அனல் பறந்து கொண்டிருக்கிறது.
ஜெயலலிதா இருந்தவரை அவர் சொல்வதே கட்சியில் சட்டம் வேதம் எல்லாமுமாக இருந்தது.
ஓ.பி.எஸ் ஓரமாக நின்றுகொண்டு வேடிக்கை பார்த்துக்கொண்டிருக்கிறார்.
அவரை மீண்டும் கட்சிக்குள் கொண்டு வந்தால் எல்லோரையும் வழிக்குக் கொண்டுவந்து, பி.ஜே.பியையும் சமாளிப்பார் என்கிற ரீதியில் சமூக ஊடகங்கள் வழியாகச் சில விஷயங்கள் பகிரப்படுகின்றன.
அப்படியிருக்கையில் அவர் மீண்டும் கட்சிக்குள் வருவதை எடப்பாடி பழனிசாமி எக்காரணத்துக்காகவும் எதிர்க்க மாட்டார் என அறிவிக்கப்படுகிறது.
17 தொடுகை வில்லைகள் நீல நிறமான அடர்த்தியான பாகங்களாக தடிப்பத்துடன் இருப்பது கண்டுபிடிக்கப்பட்டுள்ளதோடு, மேலும் சோதனை இட்டபோது இன்னும் 10 தொடுகை வில்லைகள் இருப்பது கண்டறியப்பட்டுள்ளது.
அந்த பெண் எந்த ஒரு அசெளகரியமும் இன்றி கடந்த 35 ஆண்டுகளாக அகற்றப்படாத தொடுகை வில்லைகளை அணிந்திருப்பதாக ஊடகங்கள் குறிப்பிட்டுள்ளன.
தனது வலது கண்ணின் பார்வை மங்கலடைந்து வருவது குறித்து மருத்துவர்களிடம் முறையிட்டதை அடுத்தே இது கண்டுபிடிக்கப்பட்டுள்ளது.
இது அதிக நிறை கொண்டது.
பகல்போசன இடைவெளியின் பின்னர் 1.30 க்கு 3 ஆவது அமர்வு நடைபெற்றது.
இந்தப் போட்டித் தொடருக்கு தொடர்ச்சியாக எமது அர்ப்பணிப்பின் போஷாக்காக வழங்குகிறது.
அரசியல் கட்சிகளின் கூட்டணி பேச்சுவார்த்தை இறுதிக்கட்டத்தை அடைந்துள்ளது.
திமுக கூட்டணியில் காங்கிரசுக்கு 10 தொகுதிகளும், விடுதலை சிறுத்தைகள் கட்சி, இந்திய கம்யூனிஸ்ட், மார்க்சிஸ்ட் கம்யூனிஸ்ட் ஆகிய கட்சிகளுக்கு தலா 2 தொகுதிகளும் இந்திய யூனியன் முஸ்லிம் லீக், கொங்குநாடு மக்கள் தேசியக் கட்சி மற்றும் இந்திய ஜனநாயக கட்சிக்கு தலா ஒரு தொகுதியும் ஒதுக்கப்பட்டது.
பெற்றோர் ஒரு கூட்டுப் பண்ணை ஒன்றில் பணியாற்றியவர்கள்.
கடும் பயிற்சிக்குப் பின்னர் ககாரின், கெர்மன் டீட்டோவ் ஆகிய இருவரும் விண்வெளிப் பயணத்திற்குத் தெரிவானார்கள்.
ககாரின் தனது சகாக்களுக்குள் அனைவறாலும் பொதுவாக விரும்பப்பட்டவராக இருந்தார்.
அப்போது 20 விண்வெளி வீரர்களிடமும் ஒரு கேள்வி கேட்கப்பட்டது.
கோல்கீப்பர்ராக விளையாடுவதற்கு அவர் விருப்பம் தெரிவித்தார் ... விளையாட்டுக்கள் விண்வெளி வீரர்களின் வாழ்வில் ஒரு அங்கமாகிவிட்டன என்று நான் சொன்னது தவறு இல்லை என்று நான் நினைக்கிறேன்.
வஸ்தோக் 1 விண்வெளிப் பயணத்திற்குப் பிறகு லண்டன் மற்றும் மான்செஸ்டரிற்கு சென்றார் அதற்கு அடுத்த மூன்று மாதங்களுக்குப் பிறகு அவர் ஐக்கிய இராச்சியத்திற்கு விஜயம் செய்தார்.
2011 ஆம் ஆண்டில் இந்த நாள் ஐக்கிய நாடுகள் சபையின் மனிதன் விண்வெளி விமானத்தில் பயணம் செயத சர்வதேச தினமாக அறிவிக்கப்பட்டது.
1969 ஆம் ஆண்டில் நட்சத்திர நகரத்தில் உள்ள விண்வெளி வீரர்களின் பயிற்சி மையம் ககாரின் பெயரால் பெயரிடப்பட்டது.
விமானப்படை அகாடமி (கழகம்) 1968 ஆம் ஆண்டில் ககாரின் விமானப்படை அகாடமி என மறுபெயரிடப்பட்டது.
தாங்கள் தரையிறங்கும் இடத்தில் விட்டுச் சென்றனர்.
இதில் யூரி ககாரின் 14வது நபராக பட்டியலிடப்பட்டார்.
2011 ஆம் ஆண்டில் கலைஞர் மற்றும் விண்வெளி வீரர்ரான அலெக்ஸ்சி லியோனோவ் ஆல் செய்யப்பட்ட சிற்பம் ஹூஸ்டனுக்கு பல்வேறு ரஷ்ய அமைப்புகளால் வழங்கப்பட்டது.
கல்வெட்டின் தொடக்கத்தில் ஒன்றின் மீது ஒன்றாய் இரண்டு குறியீடுகள் உள்ளன.
கிட்டத்தட்ட எல்லாத் தனிப்பெயர்களுக்கு முன்பும் இடைவெளி இருக்கிறது.
புத்தகோசரும், சாணக்கியரும்கூட ரூபா என்ற சொல்லை இதே பொருளில் புழங்கியிருக்கிறார்கள்.
பொதுவாக மனித இரையகக் குடற்பாதை என்பது வாயில் தொடங்கி .
அமைலேசு என்ற நொதியம் உண்ணும் உணவின் மீது முதலாவது வினையைத் தொடங்குகிறது.
இதைத்தவிர பிரதான உமிழ்நீர் சுரப்பிகளால் இலிப்பேசு என்ற சமிபாட்டு நொதியும் சுரக்கப்படுகிறது.
இரைப்பையினுள் இருக்கும் பதார்த்தங்களால், உணவு மேலதிக சமிபாட்டுக்கு உட்படுகிறது.
en:Ileum .
Introduction to Calendars .
இப்பிரிவு மக்கள் தொகை 2012 இல் 36456 ஆகக் காணப்பட்டது.
மனைவியாக இவரை இராமாயணம் சித்தரிக்கிறது.
பூமியில் இருந்து கிடைத்ததால் .
வெற்றியுடன் நாண் ஏற்றுபவருக்கு சீதையை திருமணம் செய்து வைப்பதாக அறிவித்தார்.
இந்த சுயம்வரத்தில் இராமர் உட்பட பல ராஜகுமாரர்கள் கலந்து கொண்டனர்.
அப்போது சீதை கர்ப்பவதியாகவும் இருந்தாள்.
பிறகு பூமியை பிளந்து அதனுள்ளே ஐக்கியமானாள்.
சீதை பற்றிய செய்தி ஒன்றைச் சங்கப்பாடல் தெரிவிக்கிறது.
விரற்செறி மரபின செவித்தொடக்குநரும், .
குறித்த சந்தர்ப்பத்தில் , சிறிய கத்தியொன்றால் 6 முறை இவ்வாறு தாக்கியுள்ளதாக விசாரணையில் தெரியவந்துள்ளது.
பலவந்தமாக காணாமல் போவதில் இருந்து பாதுகாப்பு வழங்குவதற்கான சர்வதேச சாசன சட்டமூலம் பிற்போடப்பட்டமைக்கு தமிழ்த் தேசியக் கூட்டமைப்பு கண்டனம் வெளியிட்டுள்ளது.
தமது கோரிக்கைகள் தொடர்பில் இன்றைய தினம் கலந்துரையாடலுக்கு அழைப்பு விடுக்கப்படவில்லை என இலங்கை மின்சார சபை ஒன்றிணைந்த தொழிற்சங்க கூட்டமைப்பு தெரிவித்துள்ளது.
செனேவிரத்னவுடன், தொழிற்சங்கத்தினர் பேச்சுவார்த்தை நடத்தியபோதும், அது வெற்றியளிக்கவில்லை என்பது குறிப்பிடத்தக்கது.
தனது பேஸ்புக் கணக்கில் அவர் இந்த பதிவை வெளியிட்டுள்ளார்.
அண்மையில் இலங்கைக் கடற்பரப்பிற்கு அருகில் விபத்துக்குள்ளான படகொன்றில் இருந்து 30 ரோஹிங்ய அகதிகள் மீட்கப்பட்டனர்.
கிரிபத்கொடயிலுள்ள மணிக்கூட்டு கோபுரத்துக்கு அருகில் பிக்குகள் யாசகத்தில் ஈடுபட்டுள்ளனர்.
தமது கோரிக்கைகளுக்கு தீர்வு கிடைக்காமையினால் மின்சார சேவை பணியாளர்கள் இன்று ஏழாவது நாளாகவும் சேவைப் புறக்கணிப்பில் ஈடுபட்டுள்ளனர்.
ஐக்கிய நாடுகள் மனித உரிமைகள் ஆணையாளர் செய்ட் ராட் அல் ஹுஸைனை ஜனாதிபதி மைத்திரிபால சிறிசேன எதிர்வரும் வெள்ளிக்கிழமை சந்திக்கவுள்ளார்.
இதையடுத்து, உலகின் முக்கிய நாடுகளின் தலைவர்களையும் அவர் சந்திக்க உள்ளார்.
இந்தச் சந்திப்பு இலங்கைக்கு மிகவும் முக்கியமானதாக அமையவிருப்பதாக சர்வதேச ஊடகங்கள் தெரிவிக்கின்றன.
ஜெனீவா பிரேரணை அமுலாக்கம் மற்றும் மறுசீரமைப்பு போன்ற விடயங்களில் இலங்கை அரசாங்கம் பெரும் தாமதத்தை வெளிப்படுத்தி வருகிறது.
ரோஹிங்கிய முஸ்லிம்கள் விவகாரம் தொடர்பில் சர்வதேச ரீதியாக முன்வைக்கப்படும் குற்றச்சாட்டுகளுக்கு தாம் அஞ்சப்போவதில்லை என ஆங் சான் சூகி அறிவித்துள்ளார்.
16 ஆயிரம் பேர் ஐக்கிய நாடுகள் அகதிகள் முகவரகத்தில் பதிவுசெய்துள்ளனர்.
நாட்டின் அனைத்து பாகங்களிலும் சமாதானத்தையும், ஸ்திரத்தன்மையையும், சட்டத்தின் ஆட்சியையும் நிலைநாட்டுவது தமது நோக்கம் என அவர் கூறியுள்ளார்.
உள்ளுராட்சி மன்ற தேர்தலை அடுத்த வருடம் ஜனவரி மாதத்தில் நடத்த கட்சி தலைவர்கள் இணக்கம் வெளியிட்டுள்ளனர்.
நாடாளுமன்றத்தில் சிறப்புரையொன்றை ஆற்றிய பின்னர் அவர் இவ்வாறு எதிர்க்கட்சி ஆசனத்தில் அமர்ந்துள்ளார்.
மாலபே தனியார் மருத்தவ கல்லூரியை ரத்துச் செய்யுமாறு வேண்டி இந்த இறை வழிபாடு மேற்கொள்ளப்பட்டதாக அந்த சங்கத்தின் நிறைவேற்று குழுவின் உறுப்பினர் வசந்த அல்விஸ் ஹிரு செய்திச் சேவைக்கு தெரிவித்தார்.
மரியா சூறாவளியின் வழித்தடத்தில் முதலாவதாக அமைந்துள்ள டொமினிகா தீவில் மணிக்கு 260 கிலோமீட்டர் வேகத்தில் பலத்த சூறாவளி காற்று வீசுகிறது.
குறித்த சூறாவலியில் தமது, வீட்டுக் கூரையும் தூக்கி எறியப்பட்டதாக டொமினிக்கா தீவுகளின் பிரதமர் ரூஸ்வெல்ட் ஸ்கெரிட், தமது  முகப்புத்தக பதிவொன்றில் தகவல் வெளியிட்டுள்ளார்.
சூறாவளியின் தாக்கத்தால் தானும் கருணையை எதிர்பார்த்து இருப்பதாகவும் அவர் குறிப்பிட்டுள்ளார்.
இதனை அடுத்து கரிபியன் தீவுக்கூட்டங்களில் உள்ள ஃப்ரென்ச் தீவுகள், கோடெலோப் போன்ற பகுதிகளுக்கும், போர்டோ ரிகோ, டொமினிகா, சென் கிட்ஸ் மற்றும் நெவிஸ் போன்ற தீவுகளுக்கும் அமெரிக்க, பிரிடிஸ் வேர்ஜின் தீவுகளுக்கும் கடும் எச்சரிக்கை விடுக்கப்பட்டுள்ளது.
வேதன முரண்பாடுகள் உள்ளிட்ட பல்வேறு பிரச்சினைகள் தொடர்பில் அதிகாரிகளின் உரிய பதில் கிடைக்காததால் இந்த பணிப்புறக்கணிப்பை மேற்கொள்ளவுள்ளதாக அந்த கூட்டமைப்பு தெரிவித்துள்ளது.
வவுனியாவில் இரு வேறு விபத்தில் இருவர் படுகாயமடைந்துள்ளனர் .
இவ்விபத்து தொடர்பான மேலதிக விசாரணையினை நெடுங்கணி பொலிசாரால் மேற்கொள்ளப்படுகிறது.
