இதனிடையே, எதிர்கட்சித் தலைவர் குவைடோ தம்மையே ஜனாதிபதியாக அறிவித்துக் கொண்டதையும் அமெரிக்கா ஆதரவளித்தமை குறிப்பிடத்தக்கது.
ஞானசார தேரர் வெளியிட்ட கருத்தால் தனக்கு அபகீர்த்தி ஏற்பட்டுள்ளதாக கூறி அமைச்சர் ரிஷாட் பதியூதீன், 500 மில்லியன் ரூபாய் இழப்பீடு கோரி தாக்கல் செய்த வழக்கின் விசாரணைக்காக ஞானசார தேரர் இன்று நீதிமன்றில் முன்னிலையாகியிருந்தார்.
நீர்வழங்கல் மற்றும் வடிகாலமைப்பு சபை இதனை தெரிவித்துள்ளது.
அத்துடன், மாகந்துரே மதூஷூக்கு எதிராக சுமத்தப்பட்டுள்ள பாரிய குற்றச்சாட்டுக்கள் தொடர்பான விசாரணைகளும் தற்போது ஆரம்பிக்கப்பட்டுள்ளதாகவும், குற்றப்புலனாய்வு திணைக்களத்தின் உயர் அதிகாரி ஒருவர் எமது செய்தி பிரிவிடம் குறிப்பிட்டுள்ளார்.
கைது செய்யப்பட்ட சிலர் வழங்கிய தகவலுக்கு அமையவே அவை மீட்கப்பட்டுள்ளன.
அவரது இந்த திடீர் விஜயம் திட்டமிடாத ஒன்று என சர்வதேச ஊடகங்கள் தெரிவித்துள்ளன.
அமெரிக்க விமானப்படைக்கு சொந்தமான விமானத்தில் அவர் ஈராக் தலைநகர் பக்தாத்தை சென்றடைந்தார்.
இந்த விஜயத்தின் போது அவர் ஈராக் பிரதமர் அடில் அப்துல்-மஹ்தியை சந்தித்ததாகவும் கூறப்படுகிறது.
முகத்தை மூடியவாறு உந்துருளியில் வந்த இனந்தெரியாத இருவர், துப்பாக்கியை காட்டி அச்சுறுத்தி நேற்றைய தினம் இந்த கொள்ளையில் ஈடுபட்டுள்ளதாக காவல்துறை ஊடகப் பேச்சாளர் அலுவலகம் தெரிவித்துள்ளது.
நேற்று மாலை இந்த மோதல் சம்பவம் இடம்பெற்றுள்ளது.
ரிதீகமயில் உள்ள அரசாங்கத்தின் வாடி வீடுகளில் பாகிஸ்தான் ஏதிலிகளை தங்க வைக்க தென்மாகாண முதலமைச்சர் நடவடிக்கை எடுத்துள்ளதாக குற்றம் சுமத்தி இந்த நிர்வாக முடக்கல் போராட்டம் முன்னெடுக்கப்படுகிறது.
காவல்துறை வாகனத்தை இலக்கு வைத்து இடம்பெற்ற இந்த குண்டு தாக்குதலில் ஆறு பேர் உயிரிழந்துள்ளதாக சர்வதேச செய்திகள் தெரிவிக்கின்றன.
உயிர்த்த ஞாயிறு தினத்தில் கொச்சிக்கடை தேவாலயத்தில் மேற்கொள்ளப்பட்ட தாக்குதலில் தனது இரண்டு பிள்ளைகள் உயிரிழந்ததாக தெரிவித்து ஒருவரினால் தாக்கல் செய்யப்பட்ட மனு இன்று விசாரணைக்கு எடுத்துக்கொள்ளப்பட்டபோதே இந்த உத்தரவு பிறப்பிக்கப்பட்டுள்ளது.
இந்த நிலையில், உயர்நீதிமன்றம் குறித்த உத்தரவைப் பிறப்பித்துள்ளது.
அதனை தொடர்ந்து காவற்துறை விசேட அதிரடிப்படையினர் வந்த குறித்த நபரை வௌியே எடுத்துள்ளனர்.
இதனால் 1500 இற்கும் மேற்பட்டோர் வேலை வாய்ப்பை இழந்துள்ளதாக அவர் சுட்டிக்காட்டியுள்ளார்.
இதுதவிர, 33 ஆசனங்களை கொண்ட 53 சொகுசு ரக பேருந்துகளை கொள்வனவு செய்யவும் அமைச்சரவை அனுமதி வழங்கியுள்ளது.
டால்ஸ்டாய்கள் ரஷ்யாவில் பெயர்பெற்ற பழைய பிரபுத்துவ குடும்பத்தைச் சேர்ந்தவர்கள்.
அவரது சமகாலத்தவர்கள் அவருக்கு உயர்ந்த மரியாதை செலுத்தினார்கள்.
அன்டோன் செக்கோவ் அவர்கள், டால்ஸ்டாய் சந்திப்பதற்கு அடிக்கடி வருகை தருவதுண்டு, அன்டோன் அவர்கள் டால்ஸ்டாயைப் இவ்வாறு போற்றுகிறார், "இலக்கியம் டால்ஸ்டாய் போன்றோர் வைத்திருக்கும் போது, ஒரு எழுத்தாளராக இருப்பதற்கு எளிதானது, இனிமையானது; நீங்கள் எதையாவது சாதித்துவிட்டீர்கள் அல்லது இன்னமும் எதையும் சாதிக்கவில்லை என்று தெரிந்தாலும் கூட, அது வேறு விதமாக இருக்கலாம், ஏனெனில் டால்ஸ்டாய் எல்லோருக்காகவும் சாதிக்கிறார்.
ஏனெனில் இலக்கியத்தில் முதலீடு செய்யப்படும் அனைத்து நம்பிக்கைகளையும் அபிலாஷைகளையும் அவர் நியாயப்படுத்துகிறார்.
"19 ஆம் நூற்றாண்டு பிரிட்டிஷ் கவிஞர் மற்றும் விமர்சகர் மத்தேயு அர்னால்ட்" டால்ஸ்டாய் எழுதிய ஒரு நாவலானது கலையின் வேலை அல்ல, மாறாக வாழ்க்கையின் ஒரு சிரு பகுதி" என்று கருதுகிறார்.
பின்னாளில் விமர்சகர்கள் மற்றும் நாவலாசிரியர்கள் டால்ஸ்டாயின் கலைக்கு தாங்களே அத்தாட்சிகளாய் இருந்திருக்கின்றனர்.
டால்ஸ்டாயின் ஆரம்பகால படைப்புகள், சுயசரிதை நாவல்கள் ஆகும்.
பின்னாளில் டால்ஸ்டாய் இந்த நாவல்களை உணர்ச்சி ரீதியாக உள்ளது என்று நிராகரித்தபோதிலும், டால்ஸ்டாயின் சொந்த வாழ்க்கையின் ஒரு பெரும் மாற்றம் வெளிப்பட்டது.
எழுதப்பட்ட நாவல்களிலே மிகப் பெரிய நாவல்களில் ஒன்று, அதன் வியத்தகு அகலத்திற்கும் ஒற்றுமைக்கும் குறிப்பிடத்தக்கது.
இந்தக் கதையானது குடும்ப வாழ்க்கையிலிருந்து தொடங்கி நெப்போலியனின் தலைமையகத்திற்கும், ரஷ்யாவின் அலெக்ஸாண்டர் I நீதிமன்றத்திற்கும், ஆஸ்டெர்லிட்ஸ் மற்றும் போரோடினோ போர்க்களத்திற்குள்ளும் நகர்கிறது.
டால்ஸ்டாய் யதார்த்தமான பள்ளியின் ஒரு நாவலாசிரியர் என்று ஒருவர் கருதினால்,அவருடைய அந்த நாவலானது பத்தொன்பதாம் நூற்றாண்டில் வாழ்ந்த சமுதாய மற்றும் அரசியல் விவகாரங்களை ஆய்வு செய்வதற்காக வடிவமைக்கப்பட்ட கட்டமைப்பாகும் என்ற இந்தப் பார்வை அல்லது கருத்து ஆச்சரியமிக்கதாக இருக்காது.
போர் மற்றும் அமைதி (உண்மையில் இது டால்ஸ்டாயின் ஒரு கவிதை காவியம் என்று நம்பினார் ) எனவே இதற்கு நாவல் தகுதி இல்லை என்றும் நினைத்தார்.
நாவல்கள் மிகப்பெரிய பாரட்டுக்களைப் பெற்றபோதும் டால்ஸ்டாய் அந்தப் பாராட்டுகளை நிராகரித்தார் மேலும் பின்னாளில் அந்த நாவல்கள் வாழ்க்கையின் உண்மையான யதார்த்தத்தைக் காட்டவில்லை என்றும் கூறினார்.
டால்ஸ்டாய் தனது அனுபவத்தை இப்படி கூறுகிறார் "இந்தக் கோடை எனக்கு என்ன தந்தது என்று உங்களுக்குத் தெரியுமா? அது ஸ்கோபனேஹெவரைத் தந்தது.
மேலும் ஆன்மீகப் பாதையும் நல்ல மகிழ்ச்சியையும் தந்தது மற்றும்  இதுமட்டுமில்லாமல் இந்தக் கோடையில் எந்த ஒரு மாணவனும் இது போன்ற அனுபவத்தையும் ஆன்மீக ஞான்த்தையும் கோடையில் பெற்றதில்லை என்றும் விவரிக்கிறார்".
அது இவ்வாறு விளக்குகிறார், முழுமையாக சுய மறுப்பில் இருந்து வரும் எந்தவொரு செயலும் ஒரு ஒப்பீட்டளவில் ஒன்றும் இல்லை, அச்சம் கொள்ளக்கூடாது என்பதை விளக்கினார்.
1884 ஆம் ஆண்டில், டால்ஸ்டாய் "என்ன நான் நம்புகிறேன்" என்ற புத்தகத்தை எழுதினார், இதில் அவர் தன்னுடைய கிறிஸ்தவ நம்பிக்கைகளை வெளிப்படையாக ஒப்புக்கொண்டார்.
அந்த இரவிலேயே அவர் இறந்ததாக அறியப்படுகிறது .
அவரது மரணம் இரகசியம் நிறைந்ததாக கருதப்படுகிறது.
அவரது மனைவியின் பொறாமையான வசவுகளிலிருந்து தப்பிக்கும் ஒரு முயற்சியாக, எவருக்கும் சொல்லிக்கொள்ளாமல் அவர் இரகசியமாக வெளியேறியதாக கருதப்படுகிறது.
Encyclopædia Britannica Ultimate Reference Suite .
நவீன ஆராய்ச்சி முடிவுகளின்படி கதிரவன் புவியை முழுவதுமாக விழுங்கி விடவே வாய்ப்புகள் அதிகம் இருப்பதாக தெரிகிறது.
பால்வெளி மையத்தில் இருந்து நோக்கினால் கதிரவனின் சுழற்சி வேகம் தோராயமாக 251 km/s ஆகும்.
இந்த வேகத்தில் கதிரவ அமைப்பு 1 ஒளியாண்டு தொலைவு வரை பயணிக்க 1,190 ஆண்டுகள் ஆகும்.
இந்த ஆய்வுக்கலங்கள் புவியைப் போல கதிரவனை ஒரு குறிப்பிட தொலைவில் சுற்றி வந்து முதன்முறையாகக் கதிரவக் காற்று மற்றும் கதிரவ காந்தப் புலம் ஆகியவற்றை விரிவாக அளவீடுகள் செய்தன.
இருந்துகொண்டு கதிரவனின் நிலையான காட்சியை பல அலைநீளங்களில் வழங்கியுள்ளது.
அவற்றில் பெரும்பாலும் கதிரவனுக்கு அருகில் செல்வதால் எரியும் வகையைச் சேர்ந்த சிறிய வால்வெள்ளிகள் ஆகும்.
கதிரவ காற்றின் ஒரு மாதிரியை எடுத்து வர நாசாவால் அனுப்பப்பட்ட .
, 100 கிலோ எடை கொண்ட .
என்ற விண்கலத்தை 2021ஆம் ஆண்டளவில் அனுப்பவிருக்கிறது.
, மற்றும் நெப்டியூன் சுற்றுப்பாதைக்கு அப்பால் இருக்கும் பெரிய அளவிலான பனிப் பொருட்கள் ஆகியவை உள்ளன.
இந்த கட்டுரையில் உள்ள அனைத்து எண்களும் குறுகிய ஒப்பளவுகள் ஆகும்.
Eclipse 99: Frequently Asked Questions .
Solar System Exploration: Planets: Sun: Facts & Figures .
Density of the Sun .
"The origin and evolution of the solar system".
இவன் இலங்கையின் வரலாற்று முக்கியத்துவம் வாய்ந்த .
இடிமின்னல் தொடர்பில் பொதுமக்களை அவதானத்துடன் செயற்படுமாறும் வளிமண்டளவியல் திணைக்களம் தெரிவித்துள்ளது.
இத்துறையில் நிபுணத்துவம் பெற்றவர்களினால் விரிவுரைகள் நடத்தப்படவுள்ளது.
பயங்கரவாதப் பிடியில் இருந்து இலங்கையை மீட்ட வெற்றியின் அடையாளச் சின்னமாக சரித்திர பிரசித்தி பெற்ற அநுராதபுர புனித பூமியில் அமைக்கப்பட்டுவரும் சந்தஹிருசேயவில் பாரம்பரிய புதையலிடும் நிகழ்வு இன்று (12) ஜனாதிபதி மஹிந்த ராஜபக்ஷ தலைமையில் நடைபெற்றது.
சுங்க வசதிக்கான ஒப்பந்தங்கள் பற்றிய முன்னேற்பாட்டுச் சுற்றறிக்கை எம்மால் சமர்பிக்கப்பட்டுள்ளது.
ஒப்பந்தங்களை மேற்கொள்ள முடியும் எனவும் அவர் மேலும் குறிப்பிட்டுள்ளார்.
மேலும் அமைச்சர் ரிஷாட் பதுறுதீனுக்கு இந்திய அரசு கடமைப்பட்டுள்ளதாக தெரிவித்த அவர், இவ்விரு நாடுகளுக்கிடையிலான வர்த்தக உடன்பாட்டு ஒப்பந்தம் இவ்வருட இறுதிக்குள் நடைமுறைக்கு வரும் எனவும் குறிப்பிட்டுள்ளார்.
மத்திய மாகாண அமைச்சர் சரத் ஏக்கநாயக்க, கண்டி நகரசபை முதல்வர் மஹேந்திர ரத்வத்தை ஆகியோர் உட்பட முக்கியஸ்தர்கள் இந்த நிகழ்வுகளில் கலநதுகொண்டனர்.
எமது கலாசாரத்திற்கு பாதிப்பு ஏற்படும் வகையில் அல்லது மனித பண்புகளுக்கு பாதிப்பும் ஏற்படும் வகையில் அல்லது எமக்கே உரித்தான மரபுகளுக்கு பாதிப்பு ஏற்படும் வகையில் செயற்பாடுகள் இடம்பெற்றால் நான் அது தொடர்பில் பேசுவேன்.
யாருடைய உள்ளம் பாதிக்கப்பட்டாலும் நான் அதற்கு எதிராக பேசுவேன்.
எமது கலாசாரம் நம்பிக்கைகளை வளர்க்கும் முகமாகவும் அறநெறி பாடசாலை கல்வி அபிவிருத்தியை பேணுமுகமாகவும் அனைத்து சாத்தியமான வழிவகைகளையும் அரசாங்கம் செய்ய தயாராகவுள்ளது.
தேசிய ஐக்கியத்திற்காகவும் நல்லிணக்கத்திற்காகவும் தாம் பல ஆண்டுகளாக அர்ப்பணிப்புடன் செயற்பட்டுவருவதாக கொழும்பு பண்டாரநாயக்க சர்வதேச மாநாட்டு மண்டபத்தில் நேற்று இடம்பெற்ற தேசிய ஐக்கியம் மற்றும் நல்லிணக்க செயலகத்தினால் நடத்தப்பட்ட தலைமைத்துவ பயிற்சி செயலமர்வின் நிறைவு விழாவில் கலந்துகொண்டு உரையாற்றும் போதே ஜனாதிபதி இவ்வாறு தெரிவித்தார்.
தேசிய நல்லிணக்கத்தையும் சமாதானத்தையும் கட்டியெழுப்பும் அரசாங்கத்தின் நிகழ்ச்சித்திட்டங்கள் குறுகிய அரசியல் தேவைகளுக்காக செயற்படும் சந்தர்ப்பவாதிகளுக்காக அல்ல நாளை பிறக்கவிருக்கும் தலைமுறைக்கானதாகும் என்று ஜனாதிபதி மைத்ரிபால சிறிசேன குறிப்பிட்டார்.
பகைமை, குரோதங்கள் மற்றும் தனக்கு மட்டுமே மட்டுப்படுத்தப்பட்ட தனிப்பட்ட நிகழ்ச்சி நிரல்களுக்கு ஏற்ப அதிகாரத்தை இலக்குவைத்து செயற்படும் சிலர் இன்று நாட்டில் முன்னெடுக்கப்பட்டுவரும் நல்லிணக்க நிகழ்ச்சித்திட்டங்களை விளங்கிக்கொள்ளாத வகையில் செயட்பட்டுவருகின்றனர்.
இதற்காக தெரிவுசெய்யப்பட்டுள்ள பாடசாலை விபரங்களையும் பரீட்சை திணைக்களம் வெளியிட்டுள்ளது.
எதிர்கால மின்சார சவால்களை எதிர் கொள்ளவும் குறைந்த செலவில் மின்சார உற்பத்தியை மேற்கொள்ளவும் இதன் மூலம் வாய்ப்பு ஏற்படுவதாக இருப்பதாக மின்சக்தி எரிசக்தி அமைச்சு தெரிவிக்கின்றது.
நுரைச்சோலை முதலாம் இரண்டாம் கட்டங்களினூடாக 600 மெகா வோர்ட் மின்சாரம் உற்பத்தி செய்யப்படுகிறது.
நுரைச்சோலையினூடாக மாதாந்தம் 540 மில்லியன் அலகுகள் மின்சாரம் உற்பத்தி செய்யப்படுவதாகவும் அமைச்சு கூறியது.இந்த வருட இறுதிக்குள் அனைவருக்கும் மின்சார வசதியை வழங்கவும் அமைச்சு திட்டமிடப்பட்டுள்ளது.
ஜனாதிபதி மைத்திரிபால சிறிசேன ஜனாதிபதி பதவியை பொறுப்பேற்றுக் கொண்ட பின்னர் முதலாவதாக பயணம் செய்த நாடு இந்தியா என்பது குறிப்பிடத்தக்கது.
மேலும் இதன்போது, நாட்டின் நலன்கருதி அனைவரும் ஒத்துழைப்பு வழங்குமாறும் கேட்டுக்கொண்டார்.
இந்தியாவிலிருந்து மாதகல் துறைமுகம் ஊடாக கஞ்சா கடத்தி அதனை கொழும்புக்கு கொண்டுசெல்லும் நடவடிக்கையில்; கும்பல் ஒன்று ஈடுபட்டுவருவதாக பொலிஸாருக்கு தகவல் கிடைத்தது.
