முல்லைத்தீவு நீராவியடியில் நடந்த சம்பவத்திற்கு நீதி நிலைநாட்டப்பட வேண்டும் எனவும், இல்லையேல் அந்த நீதி நிலைநாட்டப்படும் வரை இந்த நாடு போராட்டத்தை சந்திக்கும் எனவும் தமிழ்த் தேசியக் கூட்டமைப்பின் பங்காளிக்கட்சிகளில் ஒன்றான ரெலோ அமைப்பு எச்சரிக்கை விடுத்துள்ளது.
இது தமிழர்கள் மீதான அடக்குமுறையின் உச்சமாகும்.
எண்ணிக்கையில் சிறுபான்மை என்பதால் பெரும்பான்மையின் அடாவடித்தனங்களுக்கு அடங்கிப் போக வேண்டும் என்ற செய்தி அப்பட்டமாக வெளிப்படுத்தப்பட்டு இருக்கின்றது.
இதேவேளை, நீதிமன்ற உத்தரவை மீறி செயற்பட்ட பொதுபலசேனாவின் பொதுசெயலாளர் கலகொட அத்தே ஞானசார தேரருக்கு எதிராக நீதிமன்ற அவமதிப்பு குற்றத்தை பதிவு செய்யுமாறு, தாம் காவற்துறைக்கு அறிவுறுத்தி இருப்பதாக அமைச்சர் மனோகணேசன் எமது செய்தி சேவையிடம் தெரிவித்தார்.
அதேநேரம் அதிவேக வீதியின் வெலிப்பன வெளியேறும் பகுதியில் ஏற்பட்டுள்ள வெள்ளம் ஏற்பட்டுள்ள நிலையில், கொட்டாவையிலிருந்து மத்துகமை நோக்கி தடையின்றி பயணிக்க முடியும் என வீதி அபிவிருத்தி அதிகாரசபை தெரிவித்துள்ளது.
நாட்டின் பெரும்பாலான பகுதிகளில் மழை அல்லது இடியுடன் கூடிய மழை தொடரவுள்ளது.
மேல் வடமேல், வடக்க, ஊவா, கிழக்கு மாகாணங்களில் 100 மில்லிமீற்றர் அளவில் மழை பெய்யக்கூடும் என்ற, வளிமண்டலவியல் திணைக்களத்தின் அறிக்கை ஒன்றில் தெரிவிக்கப்பட்டுள்ளது.
இதேவேளை, களுத்துறை, காலி, இரத்தினபுரி, கேகாலை மற்றும் மாத்தறை ஆகிய மாவட்டங்களுக்கு விடுக்கப்பட்டிருந்த மண்சரிவு எச்சரிக்கை மேலும் நீடிக்கப்பட்டுள்ளது.
எதிர்வரும் 2 மாதங்களுக்கு மழை தொடர்வதற்கான சாத்தியம் நிலவுவதன் காரணமாக, அதற்கான முன்னேற்பாடுகளை மேற்கொள்ளுமாறும் ஜனாதிபதி இதன்போது சம்பந்தப்பட்ட அதிகாரிகளுக்கு அறிவுறுத்தியதாகவும் ஜனாதிபதி ஊடகப் பிரிவு குறிப்பிட்டுள்ளது.
இதில் ஐக்கிய தேசிய முன்னணியின் தலைவர்களும் கலந்துக் கொள்வார்கள் என்று தெரிவிக்கப்பட்டுள்ளது.
அதேநேரம், இன்று இரவு 7 மணிக்கு அமைச்சர் ரஞ்சித் மத்தும பண்டாரவின் இல்லத்தில், ஐக்கிய தேசிய கட்சியின் நாடாளுமன்ற உறுப்பினர்கள் சிலர் ஒன்று கூடி கலந்துரையாடவுள்ளனர்.
இது தொடர்பில் அமைச்சர் கருத்து வெளியிடுகையில், குறித்த மூன்று நாடுகளின் தலைவர்களும் அமெரிக்காவுக்கு ஏற்றாற்போல செயற்பட்டு வருவதாக குறிப்பிட்டார்.
பாடசாலை ஆசிரியர் ஒருவரால் இனரீதியான கருத்துக்கள் வெளியிடப்பட்டதாக தெரிவித்து, இந்த போராட்டங்கள் நடத்தப்படுகின்றன.
கடந்த ஆகஸ்ட் மாதமும் இந்த நகரில் இரண்டு வாரங்களுக்கு மேலாக ஆர்ப்பாட்டங்கள் நடைபெற்றிருந்தமை குறிப்பிடத்தக்கது.
வானத்தின் நிறம் இங்கு மாறியதற்கு ‘ரேலே ஸ்கேட்டரிங்’ என்ற இயற்கை தோற்ற நிகழ்வு காரணம் என பேரிடர் நிர்வாகத்திற்கான இந்தோனேசியாவின் தேசிய வாரியத்தின் தகவல்துறைத் தலைவர் ஆகுஸ் விபோவோ சோயெட் தெரிவித்தார்.
இந்நிலையில் இந்த ஆண்டில் மாத்திரம் இதுவரையான காலப்பகுதியில் 34,000 கிலோகிராம் பீடி சுற்றும் இலைகள் மீட்கப்பட்டுள்ளதாக கடற்படையினர் தெரிவித்துள்ளனர்.
அதன்படி, அவசர தேவை, மீட்பு நடவடிக்கை மற்றும் நிவாரணம் வழங்குதல் போன்ற விடயங்களை செய்து வரும் இந்த குழுக்களின் மூலமாக இதுவரையில் 417 பேர் பாதுகாப்பான இடங்களில் தங்கவைக்கப்பட்டுள்ளனர்.
மனுதாரர்கள் இடைக்கால தடை உத்தரவை கோரியுள்ளதன் காரணமாக குறித்த மனுவை மூன்று நீதியரசர்கள் கொண்ட குழு முன் பரிசீலிக்க மேற்கூறிய இரு நீதியரசர்களும் தீர்மானித்தனர்.
பாதிக்கப்பட்டவர்களில் 3 ஆயிரத்து 488 பேர் 16 இடைத்தங்கல் முகாம்களில் தங்க வைக்கப்பட்டுள்ளதாக அனர்த்த முகாமைத்துவ மையம் தெரிவித்துள்ளது.
அத்துடன் அசாதாரண வானிலையால் 22 வீடுகள் முற்றாக பாதிக்கப்பட்டுள்ளதுடன், 282 வீடுகள் பகுதி அளவில் பாதிக்கப்பட்டுள்ளதாக தெரிவிக்க்பபடுகிறது.
இதற்கிடையில் கிங் கங்கை பெருக்கெடுத்ததன் காரணமாக, பத்தேகம பிரதேசத்தில் 100 வீடுகள் வரையில் நீர் சூழ்நிலையில் காணப்படுகின்றன.
வெளிநாட்டு பயணங்களை மேற்கொள்கின்ற பயணிகள், கட்டுநாயக்க விமான நிலையத்திற்கு மூன்று மணித்தியாலங்களுக்கு முன்னதாக வருகை தருமாறு அறிவிக்கப்பட்டுள்ளது.
அவன்ட்கார்ட் நிறுவனத்தின் தலைவர் நிஸ்ஸங்க சேனாதிபதியுடன், தில்ருக்ஷி டயஸ் தொலைபேசியில் உரையாற்றிய குரல்பதிவு ஒன்று அண்மையில் வெளியாகி இருந்தது.
கொழும்பில் இன்று நடைபெற்ற கூட்டுறவு சங்க அதிகாரிகளின் மாநாட்டில் உரையாற்றும் போது அவர் இதனைக் கூறியுள்ளார்.
அரசியல் ரீதியாக பழிவாங்கும் நோக்கிலேயே அரசாங்கம் போலியான வழக்குகளை பதிவு செய்திருந்தமை அவரது கூற்றின் மூலம் தெரியவந்துள்ளது.
பத்தரமுல்லை-நெலும் மாவத்தையில் அமைந்துள்ள கட்சியின் தலைமை காரியாலயத்தில் வைத்து ஊடகங்களுக்கு கருத்து வெளியிடும் போதே அவர் இவ்வாறு குறிப்பிட்டார்.
தினம் முல்லைத்தீவில் ஆர்ப்பாட்டப் பேரணி ஒன்றும் இடம்பெற்றிருந்தது.
இதில் சட்டத்தரணிகள், அரசியல் மற்றும் சிவில் சமுக அமைப்புகளுடன் பொதுமக்களும் கலந்து கொண்டிருந்தனர்.
அவர் விடுத்துள்ள அறிக்கை ஒன்றில் அவர் இந்த விடயத்தைக் கூறியுள்ளார்.
தேரர்களுக்கு சட்டத்தின் மூலமான நீதிமன்ற அதிகாரத்தை விட ஒரு அதிகாரம் வழங்கப்பட்டுள்ளதா? என்று நான் கேள்வியெழுப்ப விரும்புகின்றேன் என்றும் குறிப்பிட்டார்.
எனினும் உடனடியாக நாடாளுமன்றம் கூட்டப்பட வேண்டும் என்று உயர் நீதிமன்றம் உத்தரவிட்டுள்ளது.
இன்று கொழும்பில் இடம்பெற்ற ஊடகவியலாளர் சந்திப்பில் வைத்தே அவர் இவ்வாறு குறிப்பிட்டார்.
அதேநேரம் கடும் மழை காரணமாக நீரில் மூழ்கிய தாழ்நில பிரதேசங்களின் தற்போது நீர் வழிந்தோடுவதாக எமது செய்தியாளர்கள் தெரிவித்துள்ளனர்.
அசாதாரண காலநிலை காரணமாக இதுவரையில் ஒருவர் உயிரிழந்திருப்பதுடன், ஒருவர் காணாமல் போயுள்ளதாக அனர்த்த முகாமைத்துவ மையம் தெரிவித்துள்ளது.
குறித்த வீட்டில் வைக்கப்பட்டிருந்த பல பெறுமதியான பொருட்களும் தீயில் எரியுண்டதாக தெரிவிக்கப்படுகிறது.
இதனை மறைத்து வைத்தவர்கள் யார் என்று அறிவதற்கான விசாரணைகள் மேற்கொள்ளப்பட்டு வருவதாக காவற்துறையினர் தெரிவித்துள்ளனர்.
பழவகைகள் மற்றும் காய்கரிகளை உட்கொள்வதற்கு முன்னர் அவற்றை நன்கு சுத்தப்படுத்திக் கொள்ள வேண்டும்.
உட்கொள்கின்ற உணவில் ஈக்கள் மொய்ப்பதை தடுக்குமாறும் அறிவுறுத்தப்பட்டுள்ளது.
இதற்கிடையில் ஐக்கிய தேசிய கட்சியின் தலைவர் ரணில் விக்ரமசிங்கவின் தலைமையில் நேற்று அலரிமாளிகையில் முக்கிய சந்திப்பு ஒன்று இடம்பெற்றிருந்தது.
அமைச்சர்களான லக்ஷ்மன் கிரியல்ல, ரவி கருணாநாயக்க, நவீன் திஸாநாயக்க, கபீர் ஹசீம் உள்ளிட்டவர்கள் இதில் கலந்துக் கொண்டிருந்தனர்.
இதேவேளை, ஐக்கிய தேசிய முன்னணியின் பங்காளி கட்சிகளது தலைவர்கள் இன்றைய தினம் அமைச்சர் சஜித் பிரேமதாசவை சந்திக்கவுள்ளனர்.
அதேநேரம் இன்று மாலை பிரதமர் ரணில் விக்ரமசிங்கவுடன் ஐக்கிய தேசிய முன்னணியின் பங்காளிக் கட்சி தலைவர்கள் சந்திப்பை நடத்தவுள்ளனர்.
நில்வளா கங்கை பெருக்கெடுத்ததன் காரணமாக மாத்தறை மாவட்டத்தின் தாழ்நில பகுதிகள் தொடர்ந்தும் நீரில் மூழ்கியுள்ளன.
இதேவேளை, களுத்துறை, காலி, கேகாலை, காலி, ரத்தினபுரி மற்றும் மாத்தறை மாவட்டங்களுக்கு விடுக்கப்பட்ட மண்சரிவு அபாய எச்சரிக்கை தொடர்ந்தும் நீடிக்கப்பட்டுள்ளது.
அத்துடன் வெள்ளிக்கிழமை வரையில் பணிப்புறக்கணிப்பில் ஈடுபடவிருப்பதாக வடமாகாண சட்டத்தரணிகள் அறிவித்திருப்பதுடன், கிழக்கிலும் பெரும்பாலான சட்டத்தரணிகள் நேற்றைய தினம் பணிப்புறக்கணிப்பை மேற்கொண்டிருந்தனர்.
டொனால்ட் ட்ரம்பிற்கு எதிரான குற்றவியல் பிரேரணைக்கு ஜனநாயக கட்சியில் ஆதரவு அதிகம் இருப்பதாக கூறப்படுகிறது.
காயமடைந்தவர்களின் ஒருவரின் நிலை கவலைக்கிடமாக இருப்பதாகவும் அவர் மேலதிக சிகிச்சைகளுக்காக களுபோவில போதனா மருத்துவமனைக்கு மாற்றப்பட்டுள்ளதாகவும் தெரிவிக்கப்பட்டுள்ளது.
மேலும், மக்களின் வாழ்க்கை வழமைக்கு திரும்ப வேண்டுமெனில், சம்பவம் தொடர்பில் உரிய தரப்பினரும், அரசாங்கமும் உடனடியாக நடவடிக்கை எடுக்க வேண்டுமெனவும் அவர் கேட்டுக்கொண்டுள்ளார்.
மலேசியாவின் கோலாலம்பூர் விமான நிலையத்திலிருந்து எயார் ஏஷியா ஏ.கே.047 விமானமானது நேற்று இரவு கட்டுநாயக்க சர்வதேச விமான நிலையத்தை வந்தடைந்தது.
இந்திய வளிமண்டளவியல் திணைக்களம் இந்த எச்சரிக்கையினை விடுத்துள்ளது.
எதிர்வரும் 6 மணித்தியாலங்களுக்கு இந்த சூறாவளி நிலை கொண்டிருக்கும் என அந்த திணைக்களம் குறிப்பிட்டுள்ளது.
பொலன்னறுவை கமன்கடுவ பகுதியில் இடம்பெற்ற நிகழ்வொன்றில் கலந்து கொண்டு உரையாற்றிய போதே அவர் இதனை குறிப்பிட்டுள்ளார்.
இல்லையெனின் நாடு பாரிய பிரச்சினைகளுக்கு முகங்கொடுக்க நேரிடும் என்றும் அவர் குறிப்பிட்டுள்ளார்.
இந்த பணிப்புறக்கணிப்பு தொடர்பில் முல்லைத்தீவு மாவட்ட சட்டத்தரணிகள் சங்க செயலாளர் சே.கங்காதரன் தகவல் தருகிறார்.
எதிர்வரும் நொவம்பர் மாதம் 16 ஆம் திகதி இடம்பெறவுள்ள ஜனாதிபதி தேர்தலுக்காக இதுவரை 6 அரசியல் கட்சிகள் கட்டுப்பணங்களை செலுத்தியுள்ளன.
எனினும் விஜேதாச ராஜபக்ஸ, துனேஸ் கன்கந்த, எ.ஸ்.பி.நாவின்ன, அசோக ப்ரியரத்ன மற்றும் ஆனந்த அளுத்கமகே ஆகிய நாடாளுமன்ற உறுப்பினர்களின் ஐக்கிய தேசிய கட்சியின் உறுப்புரிமை நீக்கப்பட்டுள்ளதாக இன்றைய தேசிய பத்திரிகைகளில் செய்திகள் வெளியாகியிருந்தன.
அக்கட்சியின் பொதுச் செயலாளர் அமைச்சர் அகில விராஜ் காரியவசத்தால் குறித்த தீர்மானம் அந்த நாடாளுமன்ற உறுப்பினர்களுக்கு அனுப்பி வைக்கப்பட்டுள்ளதாக அந்த செய்திகள் மேலும் தெரிவிக்கின்றன.
வீட்டின் பின்புறத்தில் உள்ள தென்னை மரத்திலிருந்து, குறித்த பெண் மீது தேங்காய் ஒன்று வீழ்ந்துள்ளதாக காவல்துறையினர் குறிப்பிட்டுள்ளனர்.
இன்று மதியம் இடம்பெற்ற இந்தச் விபத்தில்; 3 ஆண்களும், 2 பெண்களும் காயமடைந்துள்ளதாக என காவல்துறையினர் தெரிவித்துள்ளனர்.
இந்த நிலையில், கஞ்சிபானை இம்ரானை பார்ப்பதற்காக அவரின் தந்தை, சகோதரர் மற்றும் உறவினர்கள் 4 பேர் ஆகியோர் அண்மையில் பூஸா சிறைச்சாலைக்கு சென்றிருந்தனர்.
கைதானவர் மன்னாரை சேர்ந்தவர் என காவற்துறையினர் தெரிவித்துள்ளனர்.
தொடருந்து நிலைய அதிபர்கள், கட்டுப்பாட்டாளர்கள், ஒழுங்கமைப்பாளர்கள், பணிப்பாளர்கள் மற்றும் இயந்திர சாரதிகள் ஆகியோர் இந்தப் போராட்டத்தில் ஈடுபட உள்ளனர்.
இதேவேளை, குறித்த சம்பவத்துக்கு எதிர்ப்பு தெரிவித்து, வட மாகாண சட்டத்தரணிகள் இன்றைய தினமும் பணிப்புறக்கணிப்பு போராட்டத்தை முன்னெடுத்தனர்.
ஆரம்பத்தில் இது சிம்பியன் லிமிட்டடு (Symbian Ltd.) மூலமாக உருவாக்கப்பட்டது.
சிம்பியன் இயக்குமுறைமையில் இயங்கும் ஸ்மார்ட்போன் சாதனங்களின் விற்பனைகள் 46.9% ஆக இருந்தது.
இதன் மூலம் உலகின் மிகவும் பிரபலமான மொபைல் இயக்கமுறைமையாக சிம்பியன் உருவாகியது.
சிம்பியன் இயக்கமுறைமையானது மூன்று அமைப்புகள் வடிவமைப்புக் கோட்பாடுகளை மனதிற்கொண்டு உருவாக்கப்பட்டது: .
design) பின்பற்றுகின்றன: மாடல்-வியூ-கன்ட்ரோலர் (MVC). .
வரையறுப்பிகள் (Descriptors) மற்றும் அடுக்கக அழிப்பு (Clean up stack) போன்ற சிம்பியன்-பிரேத்யேகமுடைய நிரலாக்க வழக்குகள் மூலமாக நிரூபிக்கப்படும் பாதுகாப்பான மூலங்களாக இவை வலிமையானவைகளாக உள்ளன.
வட்டு அளவை மிச்சப்படுத்துவதற்கு இதேபோன்ற நுட்பங்களே பயன்படுத்தப்படுகின்றன (எனினும் சிம்பியன் சாதனங்களின் வட்டுக்கள் வழக்கமாக பிளாஷ் மெமரியாகவே உள்ளன).
ஆக்டிவ் ஆப்ஜெட் என அழைக்கப்படும் நிரலாக்க வழக்கின் மூலமாக இது பெறப்படுகிறது.
இது சிம்பியன் EKA2 போன்களை சிறியதாகவும், விலை மலிவானதாகவும் மற்றும் அதன் முந்தைய மாடல்களைக் காட்டிலும் மிகவும் ஆற்றல்மிக்கதாகவும் ஆக்கியது .
