இதனால் பொலிஸாரை வேறு பணிகளுக்கு ஈடுபடுத்த முடியாத நிலை ஏற்பட்டுள்ளதாகவும், மாநிலத்தின் அமைதிக்கு பங்கம் ஏற்பட்டுள்ளதாகவும் இந்தியாவின் முன்னாள் பிரதமரும், மதச்சார்பற்ற ஜனதா தளம் கட்சியின் தலைவருமான தேவ கவுடா குறிப்பிட்டுள்ளார்.
இரு மாநிலங்களினதும் வானிலை வேறென்பதால், ஜெயலலிதாவின் உடல்நிலையை கருத்திற்கொண்டு இந்தத் தீர்மானம் எடுக்கப்படலாம் என மத்திய இணை அமைச்சரை மேற்கோள்காட்டி இந்திய ஊடகங்கள் செய்தி வெளியிட்டுள்ளன.
ஜெயலலிதா ஜெயராமை விடுதலை செய்வதன் மூலமே, தமிழகத்தில் அமைதியான சூழ்நிலையை நிலைநாட்ட முடியுமெனவும் மதுரை ஆதீனம் சுட்டிக்காட்டியுள்ளதாக தி ஹிந்து செய்தி வெளியிட்டுள்ளது.
ஜனாதிபதி செயலகத்தில் நடைபெற்ற இந்தக் கலந்துரையாடலில் மாநகர அபிவிருத்தித் திட்ட வரைவு ஜனாதிபதியிடம் ஒப்படைக்கப்பட்டது.
எனினும் இந்த தீர்மானத்தினால் அந்நாட்டிலுள்ள பல தூதரகங்கள் பல்வேறு சிக்கலை எதிர்நோக்கியதாக அந்நாட்டின் ஊடகங்கள் சுட்டிக்காட்டியுள்ளன.
ஐரோப்பிய ஒன்றியத்தைச் சேர்ந்த ஆறு நாடுகளின் தூதுவர்களும் இராஜதந்திரிகள் பலரும் இதில் கலந்து கொண்டனர்.
நாட்டின் தற்போதைய நிலைமை தொடர்பில் அவர்கள் இதன்போது கேட்டறிந்து கொண்டனர்.
1.20 மணியளவில் கோலாலம்பூர் கட்டுப்பாட்டு அறை ரேடாரில் இருந்து விமானம் மறைந்தது.
அதன்பின்னர் காலை 8.11ற்கு பிரிட்டனின் இன்மர்சாட் தனியார் செயற்கைக்கோளில் விமானத்தின் சிக்னல் கிடைத்துள்ளது.
இதனிடையே பிரிட்டன் விமான விபத்து விசாரணை பிரிவுடன் இணைந்து இன்மர்சாட் செயற்கைக்கோள் நிறுவன பொறியியலாளர்கள் மாயமான விமானத்தை கண்டுபிடிக்கும் முயற்சியில் இறங்கினர்.
எனவே எரிபொருள் தீர்ந்து விமானம் கடலில் வீழ்ந்திருக்கும் என முடிவு செய்யப்பட்டுள்ளது.
பெய்ஜிங் விமானம் கடலில் விழுந்ததற்கான ஆதாரம் எங்கே என்று பயணிகளின் உறவினர்கள் கேள்வி எழுப்பியுள்ளனர்.
வெறும் செயற்கைக்கோள் படங்களை வைத்து எந்த முடிவுக்கும் வர முடியாது என்று அவர் ஆவேசத்துடன் கூறினார்.
அதன்மூலம் தற்போது தேடுதல் பணி நடைபெற்று வருகிறது.
மலேசிய விமானம் வியட்நாம் எல்லையில் பறந்தபோது விமானி அல்லது பயணிகளில் யாரோ ஒருவரால் திட்டமிட்டு திசை திருப்பப்பட்டுள்ளது.
சம்பவம் தொடர்பில் இதுவரை எவரும் கைது செய்யப்படவில்லை என பொலிஸ் ஊடகப் பேச்சாளர் அலுவலகம் தெரிவித்துள்ளது.
சம்பவம் தொடர்பில்  பசறை பொலிஸார் மேலதிக விசாரணைகளை ஆரம்பித்துள்ளனர்.
இந்த Yakutia பகுதியினை சேர்ந்த பவேல் என்ற நபர் Tirekhtyakh ஆற்றின் கரையிலிருந்து பனி ஓநாயின் தலை ஒன்றினை கண்டெடுத்தார்.
ஜப்பான் மற்றும் ஸ்வீடன் நாட்டின் ஆராச்சியாளர்கள் ஓநாயின் தலையின் மாதிரிகளை ஆராய்ந்ததில் அது சுமார் 40 ஆயிரம் ஆண்டுகளுக்கு முந்தைய பனி ஒநாயின் தலை என கண்டுபிடித்துள்ளனர்.
பேரணியில் கலந்துகொண்டவர்கள் பண்டாரவளை நகர் சுற்றுவட்டத்தில் ஆர்ப்பாட்டத்திலும் ஈடுபட்டனர் .
இதேவேளை உலக உணவு தினத்தை முன்னிட்டு பெருந்தோட்ட சமூக காணி உரிமைக்கான மக்கள் இயக்கம் தலவாக்கலையில் விழப்புணர்வு பேரணியொன்றை ஏற்பாடு செய்திருந்தது.
தலைவரின் மரணம் தொடர்பில் பொறுப்பு கூற வேண்டியது ஶ்ரீலங்கா முஸ்லிம் காங்கிரஸின் தலைமைத்துவத்தின் பொறுப்பு எனவும் அவர் மேலும் தெரிவித்துள்ளார்.
பக்தியுணர்வு மேலிட பக்தர்கள் திருவடத்தை பிடித்து இழுத்தும், பறவைக்காவடி, தூக்குக்காவடி ஆகியவற்றை எடுத்தும் தீச்சட்டிகளையும் ஏந்தியும் சிதறு தேங்காய்களை உடைத்தும் தமது நேர்த்திக்கடன்களை செலுத்தினர்.
ரயில் சேவையை அத்தியாவசிய சேவையாக்குவதற்கான வர்த்தமானியில் போக்குவரத்து அமைச்சர் கைச்சாத்திட்டுள்ளார்.
எடுக்கவுள்ளதாக உள்நாட்டலுவல்கள் மற்றும் மாகாண சபைகள் உள்ளூராட்சி அமைச்சு தெரிவித்துள்ளது.
பிரேஸிலின் முன்னாள் ஜனாதிபதி லூய்ஸ் இனாசியோ லூலா த சில்வாவின் (Luiz Inácio Lula da Silva) பிணை கோரிக்கை அந்நாட்டு நீதிமன்றத்தினால் நிராகரிக்கப்பட்டுள்ளது.
மலைப்பாங்கான இடத்தில் அந்த ரயில் தடம் புரண்டு பள்ளத்தில் வீழ்ந்துள்ளது.
26 பேர் படுகாயமடைந்துள்ளனர்.
மலைப்பாங்கான இடம் என்பதால் மீட்புப் பணிகள் மிக மெதுவாக இடம்பெற்று வருவதாக அதிகாரிகள் தெரிவித்துள்ளனர்.
ஏறாவூர் சந்தி​வெளி களப்புப் பகுதியில் மீன் பிடியில் ஈடுபட்டுக் கொண்டிருந்த இருவர் மின்னல் தாக்கியதில் உயிரிழந்துள்ளனர்.
இந்த இரண்டு உயிரிழ்ப்புக்களுடன் இந்த வருடத்தில் மின்னல் தாக்கத்தினால் உயிரிழந்தோரின் எண்ணிக்கை 24 ஆக அதிகரித்துள்ளதாக வளிமண்டலவியல் திணைக்களம் தெரிவித்துள்ளது.
இதேவேளை கேகாலை மாவட்டத்தின் யட்டியாந்தோட்டை பிரதேச சபைக்கு உட்பட்ட சுமார் 10 குடும்பத்தை சேர்ந்தவர்கள் முகாம்களில் தங்க வைக்கப்பட்டுள்ளனர்.
இந்த அனர்த்தத்தினால் 3 வீடுகள் வௌ்ளத்தில் மூழ்கியதாக எமது பிராந்திய செய்தியாளர் கூறினார்.
8 ஆவது தேசத்துக்கு மகுடம் தேசிய அபிவிருத்தி கண்காட்சியை நேற்று அங்குரார்ப்பணம் செய்து வைத்து உரையாற்றியபோதே ஜனாதிபதி இந்த கருத்தினை கூறினார்.
இதனால் நாட்டிற்கே நட்டம் ஏற்படுகின்றது.இது இலயலுமையற்ற அரசாங்கம் அல்ல.
இதன் போது ஜனாதிபதி மஹிந்த ராஜபக்ஸ பதாதையை திரைநீக்கம் செய்து 8 ஆவது தேசத்திற்கு மகுடம் அபிவிருத்தி கண்காட்சியை திறந்து வைத்தார்.
மேல் நீதிமன்ற அரசதரப்பு சட்டத்தரணி நிஷாந்த் நாகரட்ணம் ஆகியோர் இந்த வழக்கில் ஆஜராகினர்.
கொலை சம்பவம் இடம்பெறுவதற்கு ஒன்றரை மாதத்திற்கு முன்னதாக ஒரு சந்தர்ப்பத்தில் மாணவி வித்தியா தனது பாதணியைக் கழற்றி சந்தேகநபரை நோக்கி எறிந்ததாக ஐந்தாம் சாட்சியாளர் குறிப்பிட்டுள்ளார்.
தென் மேற்கு பருவக்காற்றால் ஜூன், ஜூலை, ஆகஸ்ட் ஆகிய மாதங்களில் தென் இந்தியா மழை பொழிவை அடையும், ஆனால் தமிழகம் வட கிழக்கு பருவக்காற்றால் அதிக மழை பொழிவை பெறும்.
(ஆங்கிலம்: New York City; .
நியூயார்க்கு நகரம் ஐக்கிய அமெரிக்காவிலேயே மக்களடர்த்தி மிக்க இடமாகும் .
1624ல் வணிக துறைமுகமாக உருவாக்கப்பட்டது.
உலகின் பல உயரமான கட்டடங்கள் இந்நகரில் உள்ளன.
2005ல் எடுக்கப்பட்ட கணக்கின் படி ஏறக்குறைய 170 மொழிகள் இங்கு பேசப்படுகின்றன மற்றும் 36% மக்கள் ஐக்கிய அமெரிக்காவுக்கு வெளியில் பிறந்தவர்கள் .
1524ஆண்டு ஐரோப்பிய கண்டுபிடிப்புக்கு முன் இப்பகுதியில் 5,000 லெனபி அமெரிக்க பூர்வகுடிகள் வசித்து வந்தனர் .
இவர்கள் மேன்காட்டனின் தென்முனையை நியூ ஆம்ஸ்டர்டாம் என அழைந்தனர்.
ஆங்கிலேயர்களின் ஆட்சியின் கீழ் நியூயார்க்கு நகரம் சிறப்புமிக்க வணிக துறைமுகமாக வளர்ந்தது.
1660ல் கீழ் மேன்காட்டன் அப்போது இது நியூ ஆம்ஸ்டர்டாம் என அறியப்பட்டது .
அமெரிக்க உள்நாட்டுப்போரின் போது இங்கு பல தொடர் சமர்கள் நிகழ்ந்தன.
1783ல் இராணுவ ஆக்கரமிப்பு முடியும் வரை இது பிரித்தானிய ஆதரவு அகதிகளுக்கு உரிய சிறந்த இடமாக திகழ்ந்தது.
ஐக்கிய அமெரிக்காவின் மக்கள் உரிமை சட்டமும் வரைவு செய்யப்பட்டது.
1790ல் நியூயார்க்கு நகரம் ஐக்கிய அமெரிக்காவின் பெரிய நகராக உருவெடுத்தது.
1811ல் ஆணையரின் திட்டம் என்ற வளர்ச்சி கருத்துருவின் படி மேன்காட்டனில் உள்ள அனைத்து தெருக்களும் இணைக்கப்பட்டது.
நகர அரசியல் அயர்லாந்து குடியேற்றவாசிகளால் ஆதரிக்கப்பட்டது .
பொதுநல எண்ணம் கொண்ட சில தலைவர்கள் பொது பூங்கா அமைக்க வேண்டுமென அரசாங்கத்தை தொடர்ந்து கோரினார்கள்.
அதன் விளைவாக 1857ல் பொது பூங்கா அமைக்கப்பட்டது.
1840ல் நியூயார்க்கு நகரின் கருப்பின மக்கள் தொகை 16000ஆக இருந்தது .
மக்கள் வாழ்ந்தனர், இது நகரின் மக்கள் தொகையில் கால் பாகமாகும் .
அமெரிக்க உள்நாட்டு போரின் (1861–1865) போது இராணுவத்திற்கு குடும்பத்திலிருந்து ஒருவர் கட்டாயமாக சேரவேண்டும் என்ற சட்டத்தினால் 1863ல் பெரும் கலவரம் நடந்தது.
அதை வெல்ல அலெக்ஸாண்டர் கடுமையாக போராட வேண்டி இருந்தது.
அதேபோல ஜெருசலேம் அலெக்ஸாண்டரிடம் போரிடாமலேயே பணிந்து சரணடைந்தது.
கி.மு.332-ல் அலெக்ஸாண்டர் எகிப்தில் நுழைந்தார்.
அங்கு அலெக்ஸாண்டரை விடுதலையளிக்க வந்த ஒரு போராளியாக தான் மதித்தனர்.
அங்கு அவர் தன்னை பிரபஞ்சத்தின் தலைவராக உணர்ந்தார்.
இதற்கு பின்பு தான் அலெக்ஸாண்டர் அடிக்கடி கடவுள் சியுசு-அம்மோன்-ஐ தனது தந்தையாக சுட்டிக்காட்டினார்.
அதுவே இவரது மறைவிற்கு பிறகு டோலேமைக் சாம்ராஜ்யத்தின் தலைமையாக பிற்காலத்தில் இருந்தது.
அந்த போரிலும் போர்க்களத்திலிருந்து டாரியஸ் மீண்டும் புறமுதுகிட்டு ஓடினார்.
இந்த முறை அலெக்ஸாண்டர் டாரியஸை அரபெல்லா மலைத்தொடர் வரை துரத்திசென்றார்.
கைப்பற்றிய பொழுது டாரியஸ் அந்த போரிலிருந்து தப்பித்து எக்பட்டானா மலைத்தொடர்களை கடந்து ஓடினார்.
பாபிலோனில் இருந்து அசீமேனிட்-ன் தலைநகரங்களில் ஒன்றான அலெக்ஸாண்டர் சூசா-விற்கு சென்றார்.
அலெக்ஸாண்டரே தானே தலைமையேற்று அந்த பயணத்திற்கான படைப்பிரிவுகளை தேர்ந்தெடுத்தார்.
அலெக்ஸாண்டர் பேர்ஸ்போலிஸ் நகரில் ஐந்து மாதங்கள் தங்கினார்.
அங்கு அவர் தங்கியிருந்த பொழுது கிழக்கு சேர்சேஷ் மாளிகையும் அந்த நகரும் தீ விபத்தில் சாம்பலான பின்ம்பு அங்கிருந்து வெளியேறினார்.
டாரியஸ் இறந்த வேளையில் அசீமேனிட் அரியணைக்கு தனது பெயரை சூட்டியிருந்தான்.
ஒருவர் மீது ஒருவர் அலெக்ஸாண்டரிடம் இதை புகராகவே அளித்திருந்தனர்.
அவர் வென்ற நாடுகளில் பலவற்றை அலெக்ஸாண்டரே விரும்பி திரும்ப போகட்டும் என்று விட்டிருந்தார்.
இந்த வேளையில் அவருடன் இருந்த பல வீரர்கள் மிகுந்த சோர்வில் இருந்தனர்.
ஸ்பிடமெனிஸ்-ஸின் மரணத்திற்கு பின்பும், ரோக்ஷனா (பாக்டரியான் இனத்தின் ரோஷனக்) உடனான மரணத்தினாலும் அலெக்ஸாண்டர் இந்திய துணைக்கண்டத்தின் பக்கம் கவனம் செலுத்தினார்.
) நாட்டின் குழுக்களின் தலைவரும் முன்னாள் ஆளுநருமானவரின் அழைப்பின் பெயரில் அலெக்ஸாண்டர் அங்கு பயணித்தார்.
கி.மு.327/326-ஆம் ஆண்டின் குளிர்காலங்களில் அலெக்ஸாண்டர் தானே தலைமையேற்று அந்த மலைவாசி குழுக்களுடன் போர் புரிந்தார்.
மற்றும் புநர் சமவெளியில் அஸ்ஸாகேநோயி போன்றோரிடம் சண்டையிட்டார்.
அரசும் வங்காளத்தின் கங்கரிடை அரசும் அலெக்ஸாண்டரின் மாபெரும் படைகள் அடுத்தது கிழக்கு நோக்கி தங்களை தான் குறிவைக்கும் என்று பயந்தன.
அதே சமயம் லட்சிய வேட்கை தணிந்து சோர்ந்திருந்த மாசீடோனிய படையினர் அங்கேயே தங்கினர்.
ஆனால் அவரது தளபதி கொயேநூஸ் அலெக்ஸாண்டருடன் வாக்குவாதம் செய்து அவரது எண்ணத்தை மாற்றினார்.
நமது படை வீரர்கள் தங்களது பெற்றோரையும், மனைவியரையும், குழந்தைகளையும் விட்டு பிரிந்து வந்து பல வருடங்கள் ஆகிறதென்றும், அவர்களுக்கு வாழ்வில் மிச்சமுள்ள நாட்களை அமைதியாக செலவிட அனுமதிக்க வேண்டுமென்றும்.
அனைவரையும் தாயகம் திரும்ப அனுமதிக்க வேண்டுமென்றும் .
ஒருவழியாக அலெக்ஸாண்டர் தெற்கு நோக்கி திரும்ப சம்மதித்தார்.
கடந்து வழியில் மல்லி மலைவாழ் (தற்போதைய முல்தான்) மக்களையும் மேலும் சில இந்திய பழங்குடியினரையும் எதிர்கொண்டார்.
(தற்போதைய தெற்கு ஈரான்) அனுப்பிவைத்தார்.
மீதமுள்ள படையினரை தானே தலைமை ஏற்று தெற்கு நோக்கி கடுமையான கேட்ரோசியன் பாலை நிலம் வழியாக வழிநடத்தி பாரசீகம் சென்றார்.
மேலும் இவர் க்ராடேருஸ் தலைமையில் வாலிபம் கடந்த பலவீனமான வீரனாக மாசீடோன்-க்கு திரும்புவதாக அறிவித்தார்.
இவரது படையினர் அந்த கூற்றை தவறாக புரிந்துகொண்டு ஒபிஸ் நகரில் கழகத்தில் ஈடுபட்டனர்.
அலெக்ஸாண்டரும் மன்னித்தார்.
எக்பட்டானா-விற்கு திரும்பிய பின்பு அலெக்ஸாண்டர் பாரசீகத்தின் கருவூலத்தை மீட்டெடுத்தார்.
அவர் உடல்நலமின்றி இறந்தாலும் நஞ்சூட்டப்பட்டு கொல்லப்பட்டதாகவும் சான்றுகள் இருந்தமையால் அலெக்ஸாண்டர் மிகவும் மனம் வெதும்பினார்.
அலெக்ஸாண்டர் ஹெபெஷனின் மரணத்தினால் குலைந்து போனார்.
ஹெபெஷனின் மரணம் அலெக்ஸாண்டரை தனது அந்திம காலத்திற்கு இட்டுசென்றது.
