சென்னை கடற்கரையை அண்மித்த ராயப்பேட்டை, திருவல்லிக்கேணி, ஐஸ்ஹவுஸ், பட்டினப்பாக்கம் போன்ற பகுதிகளில் வன்செயல்கள் நடப்பதாக தகவல்கள் கூறுகின்றன.
ஒரு காவல் நிலையத்தின் அருகே வன்முறையாளர்கள் தீ வைத்தனர்.
தீயணைப்புப் படையினர் அத்தீயை அணைக்க முயன்றுவருகிறார்கள்.
ஓரிரு இடங்களில் போலிசார் கட்டுக்கடங்க மறுக்கும் கூட்டத்தினர் மீது தடியடி நடத்தினர் என்று செய்திகள் கூறுகின்றன.
எனினும் இந்திய அரசாங்க வட்டார தகவல்களை மேற்கொள் காட்டி அந்த நாட்டு ஊடங்கள், இவ்வாறான எந்தவொரு ஒப்பந்தம் தொடர்பாக இந்திய அரசாங்கம் ஆயத்தமாக இல்லை என செய்திகள் வெளியிட்டுள்ளன.
கொழும்பு விசாகா கல்லூரில் இடம்பெற்ற நிகழ்வொன்றில் வைத்து அவர் இதனைக் கூறியுள்ளார்.
மாணவர்கள் சிறந்த ஒரு எதிர்காலத்தை நோக்கி பயணிக்க வேண்டிய காலத்தை நெருங்கியுள்ளனர்.
இந் நிகழ்வில் உயர் அதிகாரிகள் படையினர் மற்றும் பலர் கலந்து கொண்டனர்.
7 ஆவது இலங்கை இலேசாயுத காலாட் படையணியின் ஏற்பாட்டில் இரண்டாவது தடவையாகவும் கிளிநொச்சி பரவிபஞ்சன்விளையாட்டு மைதானத்தில் 35 காலபந்தாட்ட கழகங்களின் பங்குபற்றுதலுடன் கடந்த வியாழக்கிழமை (28) ஆம் திகதி முன்னாள் 57 ஆவது படைப்பிரிவின் படைத்தளபதியும் தற்போதய கிளிநொச்சி பாதுகாப்பு படைத் தளபதியுமான மேஜர் ஜெனரல் விஜித ரவிப்பிரிய அவர்களின் வழிகாட்டுதலினூடாக இடம்பெற்றது.
முன்னாள் மஹாதேவ அஷ்ரமயவின் பொறுப்பாளர் காலஞ்சென்ற திரு. ராஜநாயகம் அவர்களின் நினைவாக சிரிலங்கா மொபிடல் அணுசரனையுன் நடாத்தப்பட்டஇப்போட்டிக்கானதங்களது விண்ணப்பங்களைஆர்வமுள்ள 35 கால்பந்தாட்ட கழகங்கள் அனுப்பி போட்டியில் கலந்துகொண்டனர் .
571 ஆவது படைத் தளபதி கேணல் நஜீவ எதிரிசிங்க, மஹாதேவ அஷ்ரமய தலைவர் திரு. பொண்ணம்பலம் நித்தியநாதன், சிரிலங்கா மொபிடல் நிறுவன திரு. சுகத் அபேசிங்க உள்ளிட்ட பலர் இப்போட்டியின் ஆரம்ப நிகழ்வின்போது கலந்துகொண்டனர் .
ஆனால் மிகவும் சன நெரிசலான இடங்களில் மற்றும் பொது கூட்டமான இடங்களில் அவர்களின் நகர்வு தொடர்பாக  பின்னர் கொழும்பு ஐக்கிய அமெரிக்க தூதரக தூதுவரினால் தெளிவுபடுத்தப்பட்டுள்ளன.
அதனைத் தொடந்து பாதுகாப்பு அமைச்சின் செயலாளரவர்கள் ஊடக சந்திப்பை மேற்கொண்டு மேலும் தெரிவிக்கையில், நாங்கள் பாதுகாப்பு தொடர்பாக பலவாறான கோணங்களில் கலந்துரையாடினோம்.
யாழ் பிரதேசத்தில் வசிக்கும் பின் தங்கிய குடும்பத்தைச் சேர்ந்த பாடசாலை  மாணவர்கள் 22 பேருக்கு யாழ் பாதுகாப்பு படைத் தளபதி மேஜர் ஜெனரல் தர்ஷன ஹெட்டியாரச்சி அவர்கள் துவிச்சக்கர வண்டிகள் (16) ஆம் திகதி ஞாயிற்றுக் கிழமை வழங்கி வைத்தார்.
பின்னர் தலைமையகத்திற்கு வருகை தந்த படைத் தளபதி தலைமையக வளாகத்தினுள் மரநடுகைகள் மேற்கொண்டு படையினர் மத்தியில் உரையையும் நிகழ்த்தினார்.
NBTF  இன் வல்லுநர்களால் பரிந்துரைக்கப்பட்ட வழிகாட்டுதல்களில் பொருத்தமான சாத்தியக்கூறு ஆய்வுகள் நடத்தியபின்னர், அரசாங்கம் மற்றும் பிற அரசு நிறுவனத்தினால் நியமிக்கப்பட்டபடி அனைத்து அபிவிருத்திக் கருத்திட்டங்களும் எதிர்காலத்தில் ஒத்துழைப்பை வழங்கும்.
அதன் பின்பு   பௌத்த மத ஆசிர்வாத பூஜைகள் இடம்பெற்றது.
அதனை தொடர்ந்து பொறியியல்  படையணியின்  படைத் தளபதி மேஜர் ஜெனரல் ஹெட்டியாராச்சி  அவர்கள் படையினர் மத்தியில் உரையை நிகழ்த்தினார்.
விழாவின் முடிவில், NBTF மற்றும் அதன் பணி வெற்றிகரமான நிறுவலுக்கு அறிவிக்கப்பட்டது, அது இராணுவ தளபதிக்கு முன் வைக்கப்பட்டது.
வவுனியா சர்வதேச செஞ்சிலுவைச் சங்க கிளையின் பிரதானியான மார்க் சவுபா அவர்கள் (7) ஆம் திகதி சனிக் கிழமை கிளிநொச்சி பாதுகாப்பு படைத் தளபதியான மேஜர் ஜெனரல் நிஷ்சங்க ரணவன அவர்களை சந்தித்து  கலந்துரையாடலை மேற்கொண்டார்.
ஹேனானிகலையில்  அமைந்துள்ள இலங்கை இராணுவ தேசிய பாதுகாப்பு பயிற்சி நிலையத்தில் 543  இராணுவ பயிலுணர்கள்  பயிற்சிகளை  நிறைவு செல்லும் நிகழ்வு டிசம்பர் 29 ஆம் திகதி இடம்பெற்றது.
இந்த நிகழ்வில் மேலும் இராணுவ சிரேஷ்ட அதிகாரிகள், இராணுவ பயிலுணர்களின் உறவினர்கள் மற்றும் பெற்றோர்கள் இணைந்து கொண்டனர்.
பின்னர் சமய அனுஷ்டான ஆசிர்வாதங்களின் பின்பு தனது புதிய பதவியை உத்தியோகபூர்வமாக கையொப்பமிட்டு பொறுப்பேற்றார்.
பின்னர் புதிய கட்டளை தளபதி அவர்கள் தலைமையக வளாகத்தினுள் மரநடுகை மேற்கொள்ளப்பட்டு அதனை தொடர்ந்து படையினர் மத்தியில் உரையும் நிகழ்த்தினார்.
கடற்படையினால் புல்மோட்டையில் மேற்கொண்ட சோதனை நடவடிக்கைகளின் போது 5 சொட் கன், 59 துப்பாக்கி தோட்டாக்கள், சந்தேகத்திற்கிடமான வீடியோ   கெஷட்டுகள், 4 டெட்டனேட்டர்கள் கைப்பற்றப்பற்றதாக கடற்படை பேச்சாளர் லெப்டினன்ட் கொமாண்டர் இசுரு சூரியபண்டார அவர்கள் தெரிவித்தார்.
வருகையின் முடிவில், ‘அபிமன்சலா 1’ இன் அன்றைய பார்வையாளர் மற்றும் அங்கத்தவர்களுடன்  சுருக்கமாக உரையாடினார், அதைத் தொடர்ந்து தேநீர் விருந்துபசாரத்திலும் கலந்துகொண்டு  பார்வையாளர்களின் புத்தகத்தில் பாராட்டு கருத்துக்களை கையொப்பமிட்டார்.
இந்த நிகழ்விற்கு பிரதம அதிதியாக இராணுவ தளபதி லெப்டினன்ட் ஜெனரல் சவேந்திர சில்வா அவர்கள் வருகை தந்தார்.
இந்த நிகழ்வில் பீரங்கிப் படையணியின் சிரேஷ்ட அதிகாரிகள், ஓய்வு பெற்ற இராணுவ உயரதிகாரிகள் மற்றும் படையினர்கள்  இணைந்திருந்தனர்.
இந் நிகழ்வில் பலவாறான உயர் அதிகாரிகள் ஸ்டாப் அதிகாரிகள் பணிப்பாளர்கள் மற்றும் படையினர் போன்றௌர் கலந்து கொண்டனர்.
அந்த வகையில் மத்திய பாதுகாப்பு படைத் தலைமையகத்தின் தளபதியான மேஜர் ஜெனரல் ருக்மல் டயஸ் அவர்களி;ன் வழிகாட்;டலின் கீழ் 12ஆவது படைப் பிரிவின் கட்டளை அதிகாரியவர்களின் க்ண்காணிப்பின் கீழ் கிட்டத் தட்ட 30ற்கும் மேற்பட்ட படையினர் இப் பணிகளை மேற்கொண்டனர்.
அன்றய தினமே (6) மொனராகலை பிரதேசத்தில் நல்லிரவு தீடிரென ஏற்பட்ட தீயைக் கட்டுப்படுத்தும் பணிகளிலும் படையினர் ஈடுபட்டுள்ளனர்.
இந்த பாலர்  பாடசாலை கட்டுமான பணிகள் 21 ஆவது படைப் பிரிவின் படைத் தளபதி மேஜர் ஜெனரல் ருவன் டீ சில்வா அவர்களது தலைமையில் இடம்பெற்றன.
பாலர் பாடசாலை திறப்பு விழா நிகழ்விற்கு 21 ஆவது படைப் பிரிவின் படைத் தளபதி மேஜர் ஜெனரல் ருவன் டீ சில்வா, வவுனியா பிரதேச செயலாளர்  எம்.எஸ் ஜானக, ஆரம்பகால குழந்தை பருவ அபிவிருத்தி அதிகாரசபை பணிப்பாளர் எம்.எஸ் திருமதி சம்பா டி விதானபதிரன மற்றும் கிராம வாசிகள் இணைந்து கொண்டனர்.
இராணுவ பொது சேவைப் படையணி தலைமையக கேட்போர் கூடத்தில் ‘அரசு விலைமனுக்களுக்கான அழைப்பு நடைமுறை மற்றும் இராணுவ ஏல ஆவணம்’ தொடர்பான ஒரு நாள் கருத்தரங்கு இம் மாதம் (26) ஆம் திகதி இடம்பெற்றது.
உபகரண மாஸ்டர் ஜெனரல் மேஜர்  ஜெனரல் H.G.I வித்தியானந்த மற்றும் மாஸ்டர் ஜெனரல் போர்கருவி மேஜர்  ஜெனரல் H.R.K.P பீரிஸ், இராணுவ லொஜஸ்டிக் கல்லூரியின் கட்டளை தளபதி பிரிகேடியர் W.G.D வன்னியாரச்சி மற்றும் கிழக்கு பாதுகாப்பு படைத் தலைமையகத்தின் நிர்வாக உபகரண பிரதானி பிரிகேடியர் M.R வன்னியாரச்சி அவர்களது பங்களிப்புடன் இந்த கருத்தரங்கு இடம்பெற்றன.
திருகோணமலை லொஜஸ்டிக் கல்லூரியின் பூரண ஏற்பாட்டில் இந்த கருத்தரங்குகள் ஒழுங்கு செய்யப்பட்டிருந்தன.
மேலும் பலாலி விமான நிலையத்திற்கு வருகை தந்த அமைச்சரவர்களை யாழ்ப்பாணப் பாதுகாப்பு படைத் தளபதியவர்கள் வரவேற்றார்.
அந்த வகையில் இந் நிகழ்விற்கு வருகை தந்த சுகாதாரா அமைச்சரை வடக்கு ஆளுனர் வரவேற்றதோடு வைத்தியசாலைப் பணிப்பாளர்கள் ,பாராளுமன்ற உறுப்பினர்கள் மற்றும் யாழ்ப்பாணப் பாதுகாப்புப் படைத் தளபதியான தளபதியான மேஜர் ஜெனரல் தர்ஷன ஹெட்டியாராச்சி போன்றௌரும் பங்கேற்றனர்.
மாதுறு ஓயா பிரதேசத்தில் காணப்படும் இராணுவ பயிற்றுவிப்பு பாடசாலை மற்றும் விசேட படையணி பயிற்றுவிப்பு பாடசாலையின் 150 இராணுவப் படையினர் ஒருமித்து பொலன்நறுவை வைத்தியசாலையில் காணப்படும் இரத்த தட்டுப்பாட்டை பூர்த்தி செய்யூம் நோக்கில் இரத்ததான நிகழ்வானது மாதுறு ஓயாவின் இராணுவூ பயிற்றுவிப்பு பாடசாலையில் இப் படைத் தலைமையக தளபதியான மேஜர் ஜெனரல் எச் ஜே செனவிரத்தின அவர்களின் கண்காணிப்பில் கடந்த செவ்வாய்க் கிழமை (27) இடம் பெற்றது.
இந்த நிகழ்விற்கு பிரதம அதிதியாக வணக்கத்திற்குரிய ஆயர் நோயல் இமானுவேல் அவர்களும், அதிதியாக கிழக்கு பாதுகாப்பு படைத் தளபதி மேஜர் ஜெனரல் அநுர ஜயசேகர அவர்களும் கலந்து சிறப்பித்தனர்.
இறுதியில் படைத் தளபதி படையினர் மத்தியில் உரையும் நிகழ்த்தினார்.
இலங்கை இராணுவத்தைச் சேர்ந்த படைக் கலச் சிறப்பணி, மின்சார பொறியியலாளர் படையணி மற்றும் இராணுவ மகளீர் படையணியைச் சேர்ந்த வீராங்கனைகள் இந்த நிகழ்வில் பங்கேற்றுக் கொண்டனர்.
அங்கு சென்ற இராணுவ தளபதியை இராணுவ விளையாட்டு பணியகத்தின் பணிப்பாளர் மேஜர் ஜெனரல் அநுர சுத்தசிங்க அவர்கள் வரவேற்றார்.
இந்த சமூக திட்டம் மத்திய பாதுகாப்பு படைத் தளபதி மேஜர் ஜெனரல் ருக்மள் டயஸ் அவர்களின் வழிக்காட்டலின் கீழ் இடம்பெற்றது.
அதனை தொடர்ந்து இருவருக்கும் இடையில் நினைவு சின்னங்கள் பரிமாறப்பட்டது.
இந்த நிகழ்விற்கு பிரதம  அதிதியாக 57 ஆவது படைப் பிரிவின் படைத் தளபதி மேஜர் ஜெனரல் ரவிப்பிரிய அவர்கள் வருகை தந்தார்.
இந்த போட்டிகள் இரண்டு  கட்டத்தின் கீழ் இடம்பெற்றது.
இந்த நிகழ்விற்கு 563, 611 ஆவது படைத் தலைமையகத்தின் படைத் தளபதிகள், இராணுவ சிரேஷ்ட அதிகாரிகள் மற்றும் கிராம வாசிகள்  இணைந்திருந்தனர்.
2019 க்கான விஜயபாகு காலாட் படையணியின் சுப்பர் குரோஸ் விளையாட்டு போட்டிக்கான பத்திரிகையாளர் சந்திப்பு  (09) ஆம் திகதி  வெள்ளிக்கிழமை  கலதாரி ஹோட்டலில்  விஜயபாகு காலாட் படையணியின் கட்டளை தளபதி  மேஜர் ஜெனரல் டி.எம்.டி.சி.டி குணவர்தன தலைமையில்  நடைபெற்றது.
அதன்படி ஓகஸ்ட் 25 ஆம் திகதி போயகனையில் நடைப்பெற இருக்கும் 17 ஆவது சுப்பர் குரோஸ் விளையாட்டு போட்டியானது விஜயபாகு காலாட் படையணியின் 13 அம்சங்கள் உள்ளடக்கி பார்வையாளர்களை உற்சாகப்படுத்தும்.
என்று அறிவிக்கப்பட்டுள்ளதுடன், இவ் வருடம் இந்த போட்டியில்  தாய்லாந்தில் இருந்து இரண்டு ரைடர்ஸ் மற்றும் ஜப்பானில் இருந்து ஒருவர் ஏற்கனவே விண்ணப்பித்துள்ளனர், மேலும்  விண்ணப்பங்களுக்கான இறுதி தேதி ஓகஸ்ட் 13 ஆம் தேதி இருக்கும் அத்துடன்  விஜயபாகு காலாட் படையணியின் மற்றும் இலங்கை ரைடர்ஸ் அசோசியேஷன் ஆகியவற்றிலிருந்து விண்ணப்பங்களைப் பெறலாம் என்று ஊடக பிரிவினர் தெரிவித்துள்ளனர்.
இந்த சந்திப்பில் பெரும் திரலான  ஊடகவியலாளர்கள்  கலந்து கொண்டனர்.
இந்த கட்டிடம் நிர்மானிப்பதற்காக ஜோஷித அமைப்பின் தலைவர் மதகுரு பானகல உபதிஸ்ஸ தேரர் அவர்கள் அனுசரனைகளை வழங்கி வைத்துள்ளார்.
இந்திய, இந்தோனிசியா, இலங்கை, தாய்லாந்து, வியட்னாம், ஜேமனய, கொரியா மற்றும் மலேசியா நாட்டைச் சேர்ந்த பராஒலிம்பிக் விளையாட்டு வீரர்கள் 100 பேர் கலந்து கொண்டனர்.
இதில் சிறப்பான ஆட்டத்தை மேற்கொண்டு சாஜன் திசாநாயக வெள்ளிப் பதக்கத்தை பெற்றுக் கொண்டார்.
சமூகவேறுபாடின்றி ஆயிரக்கணக்கான  பக்தர்களை கவரும் மிகப் பெரிய ஒரு கத்தோலிக்க நிகழ்வாகும் பெண்கள் மற்றும் ஆண்கள் இலங்கை வரலாற்றை உற்று நோக்கும் போது இலங்கை இராணுவமானது எப்பொழுதும் சமயங்களை பாதுகாப்பதற்காக செயற்படுகின்றன அது புத்த மதமாக கிருஸ்தவ இந்து அல்லது இஸ்லாம் போன்ற மதங்களாக இருக்கலாம்.
நாட்டினது நிறந்தர சமாதானத்திற்காக சமய சமரச மற்றும் நல்லுறவை மேம்படுதல் முக்கியமாக கானப்படுவதால் நாங்கள் எப்பொழுதும் அனைத்து சமய விழாக்களுக்கான  எங்களது உதவிக் கரங்களை வழங்குகின்றௌம்.
மேலும் எதிர்காலத்தில் பயங்கரவாதம் மற்றும்  தீவிரமயமாதலை தடுக்குமுகமாக நாங்கள் சிவில் இராணுவ உறவூகளை மேம்படுத்த முயற்சிக்கிறௌம்.
