இவை ஏற்றுக்கொள்ளப்படாவிட்டால், சஜித் பிரேமதாச தலைமையிலான பெரும்பான்மை ஐக்கிய தேசியக் கட்சி அணியினரும், அனைத்து பங்காளிக்கட்சிகளும் இணைந்து பொதுத்தேர்தலை எதிர்கொள்ளவுள்ளதாக மனோ கணேசன் குறிப்பிட்டுள்ளார்.
அதற்காக ஏற்கனவே பதிவு செய்யப்பட்டுள்ள கூட்டணியின் இதயம் சின்னத்தில் தேர்தலை எதிர்கொள்ளவுள்ளதாக அவர் சுட்டிக்காட்டியுள்ளார்.
ராகமை புனித பீற்றர் தேவாலயத்தில் ஆரம்பமான பேரணி ராகமை பெசிலிக்கா வித்தியாலய மைதானத்தில் நிறைவு பெற்றது.
இதனை தவிர முன்னாள் அமைச்சரின் கடவுச் சீட்டை கடுவளை நீதவான் நீதிமன்றத்தின் பொறுப்பில் வைக்குமாறு கொழும்பு மேல் நீதிமன்றம் உத்தரவிட்டுள்ளது.
ஐக்கிய தேசியக் கட்சியினால் அரசாங்கத்திற்கு எதிராக கொண்டுவரப்பட்ட நம்பிக்கையில்லா பிரேரணை மீதான இரண்டாம் நாள் விவாதம் தற்போது பாராளுமன்றத்தில்  இடம்பெற்று வருகிறது.
வாக்கெடுப்பு இன்று மாலை 6.30க்கு பாராளுமன்றத்தில் இடம்பெறவுள்ளது.
நேற்று இடம்பெற்ற தீபாவளி நிகழ்வில் கலந்துகொண்டிருந்த போதே அவர் இதனைக் கூறினார்.
அதனைத்தொடர்ந்து மோதல் மீண்டும் வலுப்பெற்றுள்ளதாகவும், அதனால் பாதுகாப்பு கடமைகளில் படையினர் ஈடுபடுத்தப்பட்டுள்ளதாகவும் பொலிஸார் தெரிவித்தனர்.
இந்தத் தடவை, ஜனாதிபதி சட்டத்தரணி காலிங்க இந்திரதிஸ்ஸ மற்றும் சட்டத்தரணி மஹிந்த லொக்குகே ஆகியோர் இலங்கை சட்டத்தரணிகள் சங்கத்தின் தலைவர் பதவிக்காக போட்டியிடுகின்றனர்.
அதேநேரம், செயலாளர் பதவிக்காக, சட்டத்தரணிகளான கௌஷல்ய நவரத்ன மற்றும் சமன் வெலியங்க ஆகியோர் போட்டியிடுகின்றமை குறிப்பிடத்தக்கது.
சம்பவம் தொடர்பில் அக்கரைப்பற்று பொலிஸார் மேலதிக விசாரணைகளை ஆரம்பித்துள்ளனர்.
ஏப்ரல் 21 தாக்குதலின் பின்னர் பயங்கரவாத செயற்பாடுகளை ஒழிப்பது குறித்த இலங்கை அரசாங்கத்தின் துரித நடவடிக்கைகள் தொடர்பில், டோகோ ஜனாதிபதி பாராட்டுத் தெரிவித்துள்ளதாக ஜனாதிபதி ஊடகப்பிரிவு தெரிவித்துள்ளது.
இன்றைய தினம் நாட்டிலுள்ள முன்னணி வர்த்தகர்களுடன் கலந்துரையாடலில் ஈடுபடவுள்ளதாக டோகோ ஜனாதிபதி தெரிவித்துள்ளார்.
மேலும், நாளை மறுதினம் ஆரம்பமாகவுள்ள சர்வதேச பயங்கரவாதம் தொடர்பிலான சம்மேளனத்தில் இலங்கை அடைந்துள்ள முன்னேற்றம் தொடர்பில் தௌிவுபடுத்தவுள்ளதாகவும் அவர் கூறியுள்ளார்.
உலக சம்பியன் பட்டம் , பயங்கரவாத தாக்குதல் என இரு வேறுபட்ட அனுவங்களை லாகூரில் பெற்றுள்ள இலங்கை அணி மூன்றாவது இருபதுக்கு இருபது போட்டியில் பாகிஸ்தானை எதிர்த்தாடவுள்ளது.
லாகூர் சென்றுள்ள இலங்கை அணியுடன் விளையாட்டுத்துறை அமைச்சர் தயாசிறி ஜயசேகர , கிரிக்கெட் நிறுவனத்தலைவர் திலங்க சுமதிபால ஆகியோரும் சென்றுள்ளனர்.
கோட்டாபய ராஜபக்ஸ தவிர்ந்த சந்தேகநபர்களாக பிரசாத் ஹர்ஷான் டி சில்வா, உதுலாவதீ கமலதாச, கேமிந்த ஆட்டிகல, சமன் குமார கலப்பதி, தேவக மகிந்த சாலிய, ஶ்ரீமதி மல்லிகா குமார சேனாதீர ஆகியோர் வழக்கின் சந்தேகநபர்களாக குறிப்பிடப்பட்டுள்ளனர்.
பொதுமக்களால் வழங்கப்பட்ட தகவலுக்கு அமைய, இன்று பகல் சடலம் மீட்கப்பட்டதாக பொலிஸார் தெரிவித்தனர்.
நீதவான் விசாரணைகளை அடுத்து சடலம் கிளிநொச்சி வைத்தியசாலையில் வைக்கப்பட்டுள்ளது.
இந்த நிகழ்வு தாய்லாந்து தலைநகர் பாங்கொக்கில் இடம்பெற்றது.
ஆசிய பாராளுமன்ற முன்னணி, இலங்கை சார்பாக கலந்துக்கொள்வதற்காக பாராளுமன்ற உறுப்பினர் ஜே.ஶ்ரீரங்காவை அழைத்திருந்தது.
பங்களாதேஷுக்கு எதிரான 2 போட்டிகள் கொண்ட டெஸ்ட் தொடரை இந்தியா முழுமையாகக் கைப்பற்றியுள்ளது.
இன்று நிறைவுக்கு வந்த இரண்டாவதும் இறுதியுமான டெஸ்ட் போட்டியில் இந்தியா இன்னிங்ஸ் மற்றும் 46 ஓட்டங்களால் வெற்றியீட்டியுள்ளது.
இந்தியா முதல் இன்னிங்ஸில் 9 விக்கெட் இழப்புக்கு 347 ஓட்டங்களை குவித்து ஆட்டத்தை நிறுத்துவதாக அறிவித்தது.
இன்றைய மூன்றாம் நாளில் 59 ஓட்டங்களுடன் களமிறங்கிய முஸ்பிகுர் ரஹீம் 74 ஓட்டங்களுடன் வெளியேறினார்.
போட்டியில் இன்னிங்ஸ் மற்றும் 46 ஓட்டங்களால் வெற்றியீட்டிய இந்தியா தொடரை முழுமையாக கைப்பற்றியது.
இதன்மூலம் தொடர்ச்சியாக 4 டெஸ்ட் போட்டிகளில் இன்னிங்ஸ் வெற்றியை ஈட்டிய முதல் அணியாக இந்தியா பதிவானது.
சர்வதேச கிரிக்கெட் பேரவையின் டெஸ்ட் சம்பியன்ஷிப்பில் இந்தியா 360 புள்ளிகளுடன் முதலிடத்தில் நீடிக்கிறது.
இது அவருக்கு 5 ஆவது உலகக்கிண்ண போட்டியாகும்.
கிழக்குப் பல்கலைக்கழக வந்தாறுமூளை வளாகத்தின் முதலாம் மற்றும் மூன்றாம் வருட மாணவர்களுக்கான கல்வி  நடவடிக்கைகள் நாளை ஆரம்பிக்கப்படும் என பல்கலைகழக உபவேந்தர் கிட்ணர் கோபிந்தராஜ் தெரிவித்தார்.
ஈழத்தின் வடமேற்புலத்தில் எழுந்தருளியுள்ள ஸ்ரீ வடிவாம்பிகா சமேத ஸ்ரீ முன்னைநாதஸ்வாமி ஆலயம் பழமையும் தொன்மையும் மிகுந்த ஆலயமாகும்.
மூர்த்தி, தலம், தீர்த்தம் மூன்றும் ஒருங்கமைத்து சிறந்து விளங்கும் தலங்களில் ஒன்றாக இந்த ஆலயம் விளங்குகின்றது.
இந்த நிகழ்வில் அமைச்சர் சஜித் பிரேமதாச, வட மாகாண சபை உறுப்பினர்கள் உள்ளிட்ட பலர் கலந்து கொண்டிருந்தனர் .
உயிரிழந்த சிறுமிகளின் சடலங்கள் பதுளை வைத்தியசாலையில் வைக்கப்பட்டுள்ளதாக பொலிஸார் மேலும் கூறியுள்ளனர்.
1992ஆம் ஆண்டு ஐக்கிய நாடுகள் சபையின் பொதுச் செயலாளரக அவர் பதவியேற்றப்போது, உலக நாடுகள் முதலாவது வளைகுடா போரை சந்திந்திருந்தன.
பொஸ்னியா மீதான நேட்டோவின் வெடிகுண்டுத் தாக்குதல்களுக்கு எதிர்ப்பு தெரிவித்திருந்தால், அவர் அமெரிக்காவின் கோபத்திற்கும் உள்ளானார்.
உண்ணாவிதப் போராட்டத்தை கைவிடுமாறு இந்த கைதிகளிடம் கோரிக்கை விடுக்கப்பட்டபோதிலும் அவர்கள் அதனை நிராகரித்ததாக சிறைச்சாலைகள் ஊடகப் பேச்சாளர் தெரிவித்தார்.
எவ்வாறாயினும், இந்த கைதிகள் மீது தொடரப்பட்டுள்ள வழக்கின் ஆவணங்களை சட்ட மாஅதிபர் திணைக்களத்திற்கு அனுப்பிவைத்துள்ளதாக சிறைச்சாலைகள் ஊடகப் பேச்சாளர் துஷார உபுல்தெனிய மேலும் கூறினார்.
இந்த விபத்து நேற்று மாலை இடம்பெற்றுள்ளதாக பொலிஸ் ஊடகப் பிரிவு குறிப்பிடுகின்றது.
கப்பல் விபத்துக்குள்ளான போது   மூன்றாம் நிலை கெப்டனே   கப்பலை செலுத்தியுள்ளதாக தெரிவிக்கப்படுகிறது .
கெப்டன் மற்றும்  இரண்டாம் நிலைக் கெப்டன் ஆகியோர்  கப்பலில் இருந்த போதும் கப்பல் மூழ்கும் சந்தர்ப்பத்திலும் அதனை தடுப்பதற்கான நடவடிக்கையில் அவர்கள் ஈடுபடவில்லை  என  குற்றம் சுமத்தப்பட்டுள்ளது.
இந்த சம்பவம் நேற்று மாலை இடம்பெற்றுள்ளதாக பொலிஸார் குறிப்பிடுகின்றனர்.
குறிப்பிட்ட நபரிடமிருந்த மிருகவெடி தவறுதலாக வெடித்துள்ளதுடன், பலத்த காயங்களுக்குள்ளான அவர் முருங்கன் வைத்தியசாலையில் அனுமதிக்கப்பட்ட பின்னர் உயிரிழந்ததாகவும் பொலிஸார் தெரிவிக்கின்றனர்.
நாளை மறுதினம் தாயகம் திரும்பவுள்ளவர்களில் 24 ஆண்களும் 19 பெண்களும் அடங்குகின்றனர்.
இந்த நிலையில், அவர்கள் அமெரிக்காவிற்குள் நுழைவதைத் தடுக்க அந்நாட்டு இராணுவத்தினர் எல்லைப்பகுதியில் பாதுகாப்பைப் பலப்படுத்தியுள்ளனர்.
ஐக்கிய தேசியக் கட்சியின் ஜனாதிபதி வேட்பாளருக்கு பொதுஜன பெரமுனவின் பாராளுமன்ற குழுவொன்றின் ஒத்துழைப்பு கிடைத்துள்ளதாக போக்குவரத்து இராஜாங்க அமைச்சர் அசோக் அபேசிங்க தெரிவித்தார்.
குருநாகலில் நடைபெற்ற நிகழ்வின் பின்னரே அவர் இன்று இதனைக் கூறினார்.
பெரும்பான்மை கட்சிகள் எம்முடன் இணைவதற்காக கைச்சாத்திட்டுள்ளன.
வேட்பாளரைத் தெரிவு செய்யும் போது, இரகசிய வாக்கெடுப்பு இடம்பெறுமா என ஊடகவியலாளர்கள் கேள்வி எழுப்பினர்.
BBC தொலைக்காட்சிக்கு வழங்கிய செவ்வியொன்றிலேயே அவர் இதுபற்றி கூறியுள்ளார்.
உலகில் உள்ள கண்டங்களுக்கு இடையேயான நேர வேறுபாட்டால் இந்த சம்பவம் நிகழ்ந்துள்ளது.
தலவாக்கலை ரயில் நிலையத்திற்கு அருகில் மேல்கொத்மலை நீர்த்தேக்க பகுதியில் மிதந்துகொண்டிருந்த நிலையில் இன்று பிற்பகல் சடலம் மீட்கப்பட்டதாக பொலிஸார் தெரிவித்துள்ளனர்.
தமிழகத்தின் நாகை மற்றும் காரைக்கால் மீனவர்களால் இந்த வேலைநிறுத்தப் போராட்டம் முன்னெடுக்கப்படுவதாக இந்திய ஊடகங்கள் செய்தி வெளியிட்டுள்ளன.
நாகை மாவட்டத்தில் 64 மீனவ கிராமங்கள் இந்த போராட்டத்தில் இணைந்துகொண்டுள்ளதாக தெரிவிக்கப்படுகின்றது.
இந்த கிரகங்கள் வியாழன் கிரகத்தை விட 2.4 முதல் 5.5 சதவீதம் வரை நிறை அதிகம் உடையவையாக உள்ளன.
மேலும், இந்த புதிய கிரகங்கள் 2 முதல் 4 பூமி ஆண்டு கணக்கில் நட்சத்திரங்களை சுற்றிவருவதும் தெரிய வந்துள்ளது.
இந்த கிரகங்கள் சுற்றிவரும் நட்சத்திரங்கள் ஒவ்வொன்றும் சூரியனை விட மிகப்பெரியவையாக இருக்கின்றன.
தாய்லாந்து பிரதமர் ஜெனரல் பியுன் ஷான் ஓஷாவின் அழைப்பின் பேரில் ஜனாதிபதியின் இந்த விஜயம் அமைந்துள்ளது.
குறிப்பாக இருநாட்டு பொருளாதார பேச்சுவார்த்தைகளிலும் ஜனாதிபதி மைத்திரிபால சிறிசேன ஈடுபடவுள்ளார்.
நாட்டிலிருந்து கச்சத்தீவிற்கு செல்லும் பக்தர்களுக்காக விசேட படகு சேவை ஒன்றும் முன்னெடுக்கப்படவுள்ளது.
இவ்வாறு சதம் பெற்ற இரண்டாவது வீரர் இவர் என்பது குறிப்பிடத்தக்கது.
சர்வதேச மலேரியா தினம் இன்று அனுஷ்ட்டிக்கப்படுகின்றது.
நன்னீரில் உற்பத்தியாகும் ‘அனோபிலிஸ்’ வகை பெண் நுளம்பு மூலம் மனிதனுக்கு பரவுகின்றது.
தினம் உலக சுகாதார தாபனம் முன்வைத்துள்ளது.
எவ்வாறாயினும் அந்த தொகையில் 4 45,000 மலேரியா நோயாளிகள் உயிரிழந்துள்ளனர்.
மலேரியாவினால் ஒவ்வொரு 2 நிமிடத்திற்கு ஒரு முறையும் 5 வயதுக்குட்பட்ட குழந்தைகள் உயிரிழப்பதாக உலக சுகாதார தாபனம் குறிப்பிடுகின்றது.
விபத்துடன் தொடர்புடைய பஸ்ஸின் சாரதி குறித்து இதுவரை தமது அறிக்கை கிடைக்கவில்லை எனவும் அவர் கூறியுள்ளார்.
நேற்று மாலை சிரச FM இல் ஒலிபரப்பான நிகழ்ச்சியொன்றில் கலந்துகொண்டபோதே அவர் இதனைக் குறிப்பிட்டுள்ளார்.
இலங்கை மனித உரிமைகள் ஆணைக்குழு அங்கத்தர்களுடன் மதியபோசன விருந்தில் கலந்துகொள்ளும் ஹுசேய்ன், மனித உரிமை விவகாரங்கள் குறித்து ஆணைக்குழுவினருடன் கலந்துரையாடலிலும் .
தற்போது இலஞ்ச – ஊழல் ஆணைக்குழுவின் செயற்பாடு தொடர்பில் விவாத நிலையொன்று தோன்றியுள்ளது.
கடற்படையினர் இதனைத் தெரிவித்துள்ளனர்.
அவர்கள் காங்கேசன்துறை துறைமுகத்துக்கு அழைத்துவரப்;பட்டுள்ளனர்.
அதேநேரம், மன்னார் கடற்பரப்பில் அத்துமீறி மீன்பிடியில் ஈடுபட்டிருந்த 15 தமிழக மீனவர்கள் நான்கு படகுகளுடன் கைது செய்யப்பட்டுள்ளதாகவும் தெரிவிக்கப்படுகிறது.
அதேநேரம் இந்தியாவில் தடுத்து வைக்கப்பட்டுள்ள இரண்டு இலங்கை மீனவர்களும் விடுவிக்கப்படுவார்கள் என்று நேற்று அறிவிக்கப்பட்டிருந்த போதும், 29 இலங்கை மீனவர்கள் லட்சத்தீவு பகுதியில் கைது செய்யப்பட்டிருந்தமை குறிப்பிடத்தக்கது.
இது தொடர்பாக புகழ் பெற்ற நேச்சர் சஞ்சிகை மூலம் தகவல் உறுதிப்படுத்தப்பட்டுள்ளதுடன், பிரித்தானியாவின் டேலி மேல் உள்ளிட்ட ஊடகங்கள் இந்த செய்தியை பரவலாக பிரசுரித்துள்ளமை குறிப்பிடத்தக்கது.
கடந்த 24 ஆம் திகதி குறித்த பெண்ணின் வீட்டிலிருந்து 100 மீற்றர் தொலைவிலுள்ள பாழடைந்த வீடொன்றிலிருந்து அவரது சடலம் கண்டுபிடிக்கப்பட்ட து. .
வழக்குகளில் சிக்காமல் இருப்பதற்காக தலைமறைவானார்.
தென் ஆப்பிரிக்காவுக்கு எதிரான கிரிக்கெட் தொடர் தொடங்குவதற்கு முன்பாக, இந்திய வீரர்கள் பெங்களூரில் பயிற்சி முகாமில் பங்கேற்றிருந்தனர்.
இந்நிலையில் மிஸ்ரா மீதான முறைப்பாட்டை அவரது பெண் நண்பர் திரும்பப் பெற்றதாக செய்திகள் வெளியாகின.
இந்த சம்வம் புளத்சிங்கள பேரகஸ்கொடல்ல பகுதியில் இடம்பெற்றுள்ளது.
ஹங்குராகெத்த – ஹேவாஹெட்ட ருக்குட் பகுதியில் இன்று முற்பகல் 10 மணியளவில் இந்த சம்பவம் இடம்பெற்றுள்ளது.
களுத்துரை தியகம பகுதியில் ஈருருளி ஒன்று பாதையின் ஓரத்தில் இருந்த மின்கம்பத்தில் மோதி இவ்வாறு விபத்து இடம்பெற்றுள்ளது.
