கொலம்பசு கேனரித் தீவுகளிலிருந்து சப்பான் 2,700 மைல்கள் இருப்பதாகத் தீர்மானித்தார்.
என்பது தொலைதூரத்தில் இருப்பதாகத் தயங்கி வந்தனர்.
எனவே இவை மேற்கத்திய வரலாற்றில்  குறிப்பிடத்தக்க  நிகழ்வுகளாகும்.
பிற ஐரோப்பிய சுற்றுலாப்பயணிகளாலும் விவரிக்கப்பட்ட ஆசியாவைச் சேர்ந்தவை என்றே உறுதியாக இருந்தார்.
ஆனால் அரசரின் நிபுணர்கள் கொலம்பசின் வழி கொலம்பசு நினைப்பதை விடப் பெரியது என நம்பினர்.
அதனால்  அவர்கள் அதற்கு மறுப்பு தெரிவித்தனர்.
அவர்கள் பயணத்திற்கான செலவை ஏற்றுக்கொள்வதாகத் தெரிவித்தனர்.
செலவில் பாதியைத் தனியாரிடமிருந்து பெற்றுக்கொள்வதற்கு ஏற்கெனவே கொலம்பசு திட்டம் வகுத்திருந்தார்.
அங்கே ஒரு மாதம் தங்கினார்.
அவர் அங்கிருந்த அமெரிக்கப் பழங்குடிகளை எதிர்கொண்டார்.
தரை தட்டியதால், அதை அவர் கைவிட வேண்டியதாயிற்று.
-இல் அவர் நாடு திரும்பப் பயணப்பட்டார்.ஆனால், புயல் காரணமாக அவர் போர்ச்சுகல்லில் இறங்க வேண்டியதாயிற்று.
அங்கே அவர் தான் கொண்டு வந்த தங்கம் மற்றும் கொண்டு வந்த அமெரிக்கப்பழங்குடிகள் ஆகியவற்றை அரசவையில் ஒப்படைத்தார்.
அங்கே அவர் ஒரு மாவீரராக வரவேற்கப்பட்டார்.
அவர் தனது இரண்டாம் பயணத்தை (1493–1496)-இல் .
இந்த முறை அவர் முன்னைவிட தெற்காகச் சென்றார்.
கிராம மக்கள் கூட என்னிடம் பல கோரிக்கைகளை முன்வைத்துள்ளனர்.
அவர்கள் ஏதும் செய்தால் நல்லது நடக்கலாம்' என விரக்தியுடன் கூறினார் அவர்.
குறைந்த பட்சம் தமிழ் மக்களின் அபிவிருத்தியைக் கூட செய்ய முடியாதவர்களாகவே தமிழ்த் தலைவர்களுள்ளனர்.
அலுகோசு பதவிக்காக  அமெரிக்க பிரஜை ஒருவர் உட்பட பெண்கள் இருவருடன் 102 பேர் விண்ணப்பித்திருந்தனர்.
அரசுக்கு சொந்தமான சவூதி அரம்கோ எண்ணெய் நிலைகள் இரண்டின் மீது கடந்த சனிக்கிழமை இடம்பெற்ற ஆளில்லா விமானத் தாக்குதல், பாரிய தீயை ஏற்படுத்தியதோடு சர்வதேச எரிபொருள் விநியோகத்திலும் இடையூறை ஏற்படுத்தியுள்ளது.
இந்த ஆளில்லா விமானத் தாக்குதலை அடுத்து சவூதியின் பாதுகாப்பு குறித்து ஒத்துழைப்புடன் செயற்பட அமெரிக்கா தனது தயார் நிலையை முடிக்குரிய இளவரசரிடம் குறிப்பிட்டதாக அமெரிக்காவுக்கான சவூதி தூதரகம் தெரிவித்துள்ளது.
சவூதி விமானப் படை மற்றும் சவூதி தலைமையிலான கூட்டுப்படை அண்மைய ஆண்டுகளாக யெமனில் ஹூத்தி கிளர்ச்சியாளர்களுக்கு எதிராக வான் தாக்குதல்களை நடத்தி வருகிறது.
சவூதி அரசு யெமன் ஜனாதிபதிக்கு ஆதரவளிக்கிறது.
மத்திய வங்கி பிணைமுறி மோசடி வழக்கில் மத்திய வங்கியின் முன்னாள் ஆளுநர் அர்ஜுன் மகேந்திரனை நாடு கடத்துவது தொடர்பான கோரிக்கையை சிங்கப்பூர் அரசாங்கத்திற்கு இலங்கை தூதரகம் ஊடாக வெளிநாட்டு அமைச்சு அண்மையில் முறையாக அனுப்பி வைத்திருந்தது.
அவர் 212 பந்துகளில் 200 ஓட்டங்கள் குவித்தார்.
நிக்கோலஸ் சதம் அடித்தார்.
கன்னட நடிகர் ராஜ்குமாரை வீரப்பன் சிறைப்பிடித்த காலத்தில் உச்ச நீதிமன்றத்தில் நீதிபதிகளாக இருந்தவர்கள், அரசு தனது கடமையை சரிவர செய்யத் தவறி விட்டது என்று கருத்துத் தெரிவித்திருந்தனர்.
அடுத்த கட்சி, ஆட்சிக்கு வந்த போதும் அதே சவாலை எதிர்கொள்ள நேர்ந்தது.
அதிரடிப்படைத் தலைவர் என்ற முறையில் எனக்கு வழங்கப்பட்ட பணி, எங்களுக்குக் கொடுக்கப்பட்ட நோக்கம், நாங்கள் சந்தித்த தடைகள், அவற்றை எவ்வாறு எதிர்கொண்டோம் என்பது பற்றிதான் நான் கவனம் செலுத்தினேன்.
அவர்கள் அட்டூழியம் செய்தார்கள் என்பது போன்ற தோற்றம் ஊடகத்தால் ஏற்படுத்தப்பட்டது.
எனது செல்போன் அணைக்கப்பட்டிருந்தது.
நான் கூறும் விஷயத்தை கேட்டால் அவர் எழுந்து மிகவும் மகிழ்ச்சி அடைவார் என்று நான் கூறினேன்.
எங்கள் இருவரிடையே மிகவும் சுருக்கமாகவே உரையாடல் நடைபெற்றது.
பின்னர் நிகழ்வுகள் உறுதிப்படுத்தப்பட்டதும், தமிழக அதிரடிப்படையினர் மட்டுமின்றி கர்நாடக அதிரடிப்படையினருக்கும் சேர்த்து முதல்வர் ஜெயலலிதா வாழ்த்துத் தெரிவித்தார்.
நாங்கள் இரண்டு குழுக்களாகவும் அவர்கள் வெவ்வேறு இடங்களில் மூன்று குழுக்களாகவும் பிரிந்து அன்றைய இரவு காத்திருந்ேதாம்.
அரசியல் எனக்கு தெரிந்த பணி அல்ல.
இலங்கை மற்றும் இந்திய அணிகளுக்கிடையில் கொல்கத்தாவின் ஈடன் காடன் மைதானத்தில் இடம்பெறும் முதலாவது டெஸ்ட் போட்டியின் இறுதி நாளான இன்று (20) இலங்கை அணிக்கு 231 ஓட்டங்கள் வெற்றி இலக்கு நிர்ணயிக்கப்பட்டுள்ளது.
கடும் வரட்சியான காலநிலையுடன் மின்சாரத்திற்கான கேள்வி 15 வீதத்தினால் உயர்ந்துள்ளது.மின்வெட்டு தற்காலிகமாக முன்னெடுக்கப்பட்டாலும் ஏப்ரல் நடுப்பகுதியாகும் போது நிலைமை சீராகும் என மின்சக்தி எரிசக்தி அமைச்சர் ரவி கருணாநாயக்க தெரிவித்தார்.
மின்சாரத் துறையில் சில சவால்கள் ஏற்பட்டுள்ளன.
கொழும்பில் நடைபெற்ற நிகழ்வொன்றிலே அவர் மேற்கண்டவாறு தெரிவித்தார்.
இதில் பி பிரிவில் பத்து அணிகள் விளையாடியதோடு அதன் அரையிறுதியில் அமானா வங்கி, டயலொக் அணியை வீழ்த்தியதோடு மற்ற அரையிறுதிப் போட்டியில் கொமர்சியல் கிரடிட் அணி டி.எப்.சி.சி வங்கி அணியை 11–03 என்ற கோல் கணக்கில் வீழ்த்தியது.
எந்தவொரு நபரும், கடைகள், பொது உணவகங்கள், ஹோட்டல்கள், பொது பொழுதுபோக்கு இடங்கள் மற்றும் பொது இடங்களுக்குள் நுழைவதற்கான கட்டுப்பாடு, அணுகல் தொடர்பான எந்தவொரு இயலாமை, பொறுப்பு, கட்டுப்பாடு இனம், மதம், மொழி, சாதி, பாலினம் காரணமான வேறுபாடுகள் அல்லது உடல் ஊனம், இயலாமை, பொறுப்புடைமை, கட்டுப்பாடு அல்லது நிபந்தனைக்கு உட்படுத்தப்பட மாட்டார்கள்.
அந்நிய செலாவணி மோசடி வழக்கில் குறுக்கு விசாரணைக்காக வழக்கை தள்ளி வைக்க வேண்டும் என டிடிவி தினகரன் தரப்பில் விடுக்கப்பட்ட கோரிக்கையை நிராகரித்த நீதிபதி நேற்று முன்தினமே குறுக்கு விசாரணையை நடத்த உத்தரவிட்டார்.
அதன்பின் ஒரு மணி நேரம் ஜானகிராமனிடம் தினகரன் தரப்பு வழக்கறிஞர் குறுக்கு விசாரணை நடத்தினார்.
பின்னர் வழக்கை எதிர்வரும் 1ம் திகதிக்கு தள்ளிவைத்து நீதிபதி உத்தரவிட்டார்.
சர்வதேச ஊடகங்கள் கூட இலங்கைப் பாராளுமன்றத்தில் நடந்துள்ள சம்பவங்களுக்கு முன்னுரிமை அளித்திருந்தன.
அவர்கள் எதிரும்புதிருமாகப் போயுள்ளனர்.
அது போன்றதே மக்களின் எண்ணமும் ஆகும்.
மக்களின் ஆணைக்கே முன்னுரிமை அளிக்கப்பட வேண்டும்.
ஜனநாயக ஆட்சியென்பது அரசியல்வாதிகளுக்கிடையிலான பலப்பரீட்சையின் பெறுபேற்றின் மூலம் நிறுவப்படுவதல்ல...
இன்றைய சூழலில் அரசாங்க அதிகாரிகள் அனைவரும் தங்களது கடமைப் பொறுப்புகளில் இருந்து தவறி விடாது உரியபடி பணியாற்ற வேண்டுமென ஜனாதிபதி மைத்திரிபால சிறிசேன கேட்டுக் கொண்டிருக்கிறார்.
அவர்கள் மக்கள் பணிக்காகவே பதவியைப் பொறுப்பேற்றுக் கொண்டவர்கள்.
இன்றைய அரசியல் நெருக்கடி எவ்வாறாக இருந்த போதிலும், நாட்டின் நிர்வாக இயந்திரம் சற்றேனும் தளம்பலடைவதற்கு அரசாங்க அதிகாரிகள் இடமளிக்கலாகாது.
அந்த வான்கோழி பரிசை அமெரிக்க ஜனாதிபதி, தனது குடும்பத்தோடு சமைத்து உண்ணும் பழக்கம் என்பது 70 ஆண்டுகளுக்கு முன்பு அப்போதைய ஜனாதிபதி ட்ரூமேனால் ஆரம்பிக்கப்பட்டது.
அது இன்றைய ட்ரம்ப் வரை தொடர்கிறது.
இப்போது தேங்க்ஸ் கிவ்விங் நிகழ்வில், இவர் என்ன செய்யப்போகிறாரோ?' என அனைவரும் ஆர்வமாகக் காத்திருந்தனர்.
ஆனால், ட்ரம்ப்போ, ''போன முறை ​ேடாட்டர் மற்றும் டாட் வான்கோழிகள் எப்படி திரும்ப அனுப்பப்பட்டதோ அதேபோல், இந்த வருடமும் ட்ரம்ஸ்டிக் மற்றும் விஷ்போன் பெயர்கொண்ட வான்கோழிகள் திரும்ப அனுப்பப்படும்.
இதற்கு பதிலளித்த அமைச்சர், இந்த கேள்விக்கு பதிலளித்தால் நிச்சயம் ஒழுக்காற்று விசாரணைக்கு முகங்கொடுக்க நேரிடும் எனக் கூறிய அவர், எவ்வாறாயினும் ஜனாதிபதி வேட்பாளர் குறித்து கட்சி இதுவரை எவ்வித உத்தியோகபூர்வ முடிவையும் எடுக்கவில்லை எனக் கூறினார்.
இந்த நிகழ்வின் முன்னால் மாகான சபை அங்கத்தவர்கள், கேகாலை நகரசபை, மாவனல்லை, அரனாயக்க, ரம்புக்கன பிரதேச சபை உறுப்பினர்கள் உட்பட பெருந்திரளானோர் கலந்து கொண்டனர்.
தான் அரசியலுக்கு வருவது உறுதி என்று ரஜினிகாந்த் கூறிய பிறகு இது குறித்த விவாதங்கள் அதிகரித்து வந்தன.
அதிகபட்சமாக ஹாரிஸ் சோகைல் 147 ஓட்டங்களும், பாபர் அசாம் ஆட்டம் இழக்காமல் 127 ஓட்டங்களும் எடுத்தனர்.
அதன்பின்னர் ஆடிய நியூசிலாந்து அணி, யாசிர் ஷா பந்து வீச்சில் சிக்கி 90 ஓட்டங்களுக்கு சுருண்டது.
யாசிர் ஷா 8 விக்கெட் வீழ்த்தி சாதனை படைத்தார்.
டொம் லாதம் 44 ஓட்டங்களுடனும், ரோஸ் டெய்லர் 49 ஓட்டங்களுடனும் களத்தில் இருந்தனர்.
டொம் லாதம் அரை சதமடித்து வெளியேறினார்.
அடுத்து இறங்கிய ஹென்றி நிகோலஸ் டெய்லருக்கு ஒத்துழைப்பு கொடுத்தார்.
பாகிஸ்தான் சார்பில் யாசிர் ஷா 6 விக்கெட்டுகளும், ஹசன் அலி 3 விக்கெட்டுகளும் வீழ்த்தினர்.
அந்த அணியின் 14 விக்கெட்டுகள் வீழ்த்திய யாசிர் ஷா ஆட்ட நாயகன் விருது பெற்றார்.
கடந்த வாரம் ஓசன்னா ஜெய தொனியுடன் எருசலேமில் கூடிய மக்கள், பின்னர் எருசலேமில் கூடிய போது, 'இவரை சிலுவையில் அறையும்' என்று கூக்குரல் இட்டனர்.
அவர் போதித்த விதமாகவே "பிதாவே, இவர்களை மன்னியும், தாங்கள் செய்வது இன்னதென்று அறியாதிருக்கிறார்கள்" (லூக். 23:34) என்றார்.
யூத மத தலைவர்களின் திட்டத்தின்படி இயேசு சிலுவையில் அறையப்பட்டார்.
ஆனால் அவருக்கு எதிராக செயற்பட்ட அனைவரையும் மன்னிக்கும்படி பிதாவை நோக்கி இயேசு கிறிஸ்து வேண்டினார்.
அவருக்கு எதிராக செயற்பட்டவர்களுக்கு மட்டுமன்றி எமக்கும் மன்னிப்பை அருளினார்.
அவ்வார்த்தைக்கு செயலுருவம் கொடுத்தார்.
மற்றவர்களை மன்னித்து இயேசு கிறிஸ்துவின் அன்பைப் பகிர்ந்து கொள்வோம்.
சரயு நதிக்கரையில் 151 மீட்டர் உயர பிரமாண்ட ராமர் சிலை நிறுவவும் திட்டமிடப்பட்டுள்ளது.
இந்நிலையில் மெரினா கடற்கரையில் ஜெயலலிதா நினைவிடம் கட்டுவதை எதிர்த்து தொடரப்பட்ட வழக்கு நேற்று சென்னை உயர் நீதிமன்றத்தில் விசாரணைக்கு வந்தது.
வவுனியாவில் புதிய விடயங்களையும், வவுனியா மக்களையும் முன்னேற்றும் வகையில் புதிய திட்டங்களை உருவாக்கும் திட்டங்களை நாங்கள் முன்னெடுக்க ஆரம்பித்திருக்கிறோம்.
இந்த நீச்சல் அக்கடமியை உருவாக்கிய விமல் மற்றும் சபேசன்ஆகியோருக்கு விளையாட்டுதுறை சார்ந்தவர்கள் சார்பாக நன்றிகளை தெரிவித்து கொள்கிறேன்'
இந்தியா இரண்டாவது இடத்தில் இருந்தது.
அதன்பின் இந்தியா - இங்கிலாந்து இடையிலான ஆட்டத்தில் இங்கிலாந்து வெற்றி பெற்றதும் மீண்டும் முதல் இடத்திற்கு முன்னேறியது.
இந்தியா 122 புள்ளிகளுடன் 2-வது இடத்தில் நீடிக்கிறது.
2012 இல் ஐ.சி.சி இன் விதிமுறைகளுக்கு முரணாக முறையற்ற விதத்தில் பந்துவீசுவதாக சச்சித்ர சேனநாயக்க குற்றம் சுமத்தப்பட்டார்.
எனினும், அந்த தடையிலிருந்து அவர் மீண்டும் திரும்பி இலங்கை அணிக்காக விளையாடினார்.
இதேநேரம், 2014 இல் இங்கிலாந்துடன் நடைபெற்ற ஒருநாள் போட்டியில் ஜோஸ் பட்லரை மேன்கட் முறையில் வீழ்த்தி சச்சித்ர சேனநாயக்க சர்ச்சையை ஏற்படுத்தியருந்தார்.
அதற்கமைய, இத்திருத்த சட்டமூலத்தின் மூன்றாம் வாக்கெடுப்பில், அச்சட்டமூலத்திற்கு ஆதரவாக 95 வாக்குகளும், எதிராக 31 வாக்குகளும் வழங்கப்பட்டதற்கமைய, 64 மேலதிக வாக்குகளால் நிறைவேற்றப்பட்டுள்ளமை குறிப்பிடத்தக்கது.
பதில்: மனிதர்கள் மற்றும் யானைகள் என்ற இரண்டு தரப்பும் பாதிக்கப்படுவதன் காரணமாகவே இது யானைகள்-_ மனிதர்கள் மோதல் என்று சொல்லப்படுகிறது.
பயிர்ச் செய்கை மற்றும் அவர்களது வீடுகள் ஆகியவை சேதமாக்கி அழிக்கப்படுவதுடன், உடல் ரீதியான இம்சை மற்றும் மனஉளைச்சல் ஆகிய பாதிப்புக்களை விவசாய சமூகம் எதிர்கொள்ள வேண்டியுள்ளது.
அதேநேரம் சிறிய ஆண் யானைகள் தங்களது கூட்டத்தை விட்டு விலகிச் செல்வதை வழக்கமாகக் கொண்டுள்ளன.
அவ்வாறு விலகும் போது அவை தனித்துச் செல்ல நேரிடுகிறது.
அது மின்சார வேலிக்குள் யானைகளை சிறைப்படுத்துவதாகும்.
