பாராளுமன்றத்தின் பொதுச் செயலாளர் தம்மிக்க தஸாநாயக்க, பிரதி பொதுச் செயலாளர் நீல் இட்டவெல ஆகியோரும் இந்நிகழ்வில் உடனிருந்தனர்.
2018 ஆம் ஆண்டு ஒக்டோபர் மாதத்திற்கு பின்னர் பாதுகாப்பு பேரவைக்கு வருமாறு தமக்கு அழைப்பு கிடைக்கவில்லை என்றும் பிரதமர் கூறினார்.
இது புற்றுநோய்போல ஓரிடத்துடன் முடிந்துவிடாது.
நாடு புதியதொரு பயங்கரவாதத்துக்கு முகங்கொடுத்துள்ளது.
நாடு புதிய பயங்கரவாதத்துக்கு முகங்கொடுத்துள்ளது.
எமது புலனாய்வுப் பிரிவினர் அந்த இடத்தையே அடையாளம் காணவேண்டும்.
எனினும் நாம் உலகத்துடன் உள்ள விடயங்களுடன் இணைவதற்கு முன்வரவேண்டும்.
தலைமன்னார் ஊறுமலை பகுதியில் பாதுகாப்பு நடவடிக்கையில் ஈடுபட்டிருந்த வடமத்தி கடற்படை வீரர்களினால் இவர்கள் பொறுப்பேற்கப்பட்டனர்.
ஆயினும் எதிர்வரும் பத்து நாட்களுக்குள், பிரதேச செயலாளர்கள், வனபரிபாலன திணைக்கள், மற்றும் யுனொப் உத்தியோகத்தர்களும் இணைந்து தெரிவை மேற்கொள்ளுமாறு அரசாங்க அதிபர் பணிப்புரை விடுத்தார்.
அத்தினத்திலேயே ஐ.நாவின் மனித சுற்றாடல் மாநாடு ஆரம்பமானது.
புத்தளத்திலிருந்து கொழும்பு , காலி ஊடாக ஹம்பாந்தோட்டை வரையான கடற்பிரதேசங்களின் பல பகுதிகளில் மழை அல்லது இடியுடன் கூடிய மழை பெய்யும்.
மின்னலிலிருந்து பொதுமக்கள் அவதானமாக செயற்படுமாறு திணைக்களம் அதன் அறிக்கையில் மேலும் குறிப்பிட்டுள்ளது.
இந்த நிகழ்வில் சுற்றுலா அபிவிருத்தி மற்றும் கிறிஸ்த்தவ மத அலுவல்கள் அமைச்சர் ஜோன் அமரதுங்க, அமைச்சர்கள், அரசியல் பிரமுகர்கள், மத தலைவர்கள், அரச அதிகாரிகள் உட்பட பலர் கலந்து கொள்ளவுள்ளனர்.
நீண்டகாலமாக வீதி புனரமைக்கப்படாமையால், வீதியால் பயணிப்போர் பல்வேறு சிரமங்களை எதிர்கொண்டிருந்தனர்.
அணிவகுப்பு மரியாதையினைத் தொடர்ந்து இரண்டு நாடுகளினதும் தேசிய கீதங்கள் இசைக்கப்பட்டது.
இதனைத் தொடர்ந்து இரண்டு நாடுகளின் தலைவர்களுக்கிடையில் இருதரப்பு பேச்சுவார்த்தைகள் இடம்பெற்றது.
இரு தரப்பு பேச்சுவார்த்தையின் பின்னர் அரச தலைவர்கள் ஒன்றிணைந்த ஊடக சந்திப்பொன்றிலும் கலந்து கொண்டனர்.
பயங்கரவாதிகள் வட மாகாண மக்களின் காணியை கொள்ளையடித்தனர்.
யாழ்ப்பாணம் சென்று தமிழ் மக்களுக்கு ஒன்று சொல்லும் சுமந்திரன் கொழும்பில் வேறொன்றை சொல்கின்றார்.
இராணுவத்தினர் பொலிஸார் மற்றும் பிரதேச மக்கள் பெரும்பாலானவர்கள் .
கடுல்ல- மின்னேரிய மற்றும் கிரிதல ஆகிய திட்டங்களில் பயிர்ச்செய்கை நடவடிக்கை எதிர்வரும் நவம்பர் மாதம் மழைவீழ்ச்சியின் பின்னர் ஆரம்பிக்க நடவடிக்கை மேற்கொள்ளப்பட்டுள்ளது என நீர்பாசன பணிப்பாளர் நாயகம் ஆர்.எம்.பி.கருணாரத்ன தெரிவித்தார்.
இதற்கான நடவடிக்கையை தெங்கு உற்பத்தி சபை முன்னெடுத்துள்ளது.
இலங்கைக்கான பிரதி இந்திய தூதுவர் தலைமையில் நடைபெறவுள்ள இந்த நிகழ்வில் சம்பந்தப்பட்ட அனைத்து தரப்பினரும் பங்குகொள்ளமுடியும் என்று தூதரகம் தெரிவித்துள்ளது.
ஊட்டுவள்ளி, டயகம ஈஸ்ட், சந்திகாமம் தோட்டங்களில் தொழிலாளர்கள் நீண்டகாலமாக எதிர்நோக்கும் பிரச்சனைகளுக்கு உரிய தீர்வின்றி அவதியுறும் நிலையில் காணப்பட்டார்கள்.
தற்போது மீட்புப்பணிகள் ஆரம்பமாகியுள்ளன என்று அங்கிருந்து வரும் செய்திகள் தெரிவிக்கின்றன.
இந்நிலையிலேயே இவ்விமானத்தின் பாதமாக கருதப்படும் வால்ப்பகுதி இனங்காணப்பட்டுள்ளதாக இந்தோனேசிய அதிகாரிகள் தெரிவித்துள்ளனர்.
இதற்கான கடன் உடன்பாட்டுப் பேச்சுவார்த்தையை நடத்துவதற்கும் கடன் உடன்படிக்கையை எட்டுவதற்கும் நிதி மற்றும் ஊடகத்துறைஅமைச்சர் மங்களசமரவீரஅவர்களினால் சமர்ப்பிக்கப்பட்ட ஆவணத்திற்குஅமைச்சரவை அங்கீகாரம்  வழங்கியுள்ளது.
இந் நிகழ்வை நினைவு கூறுமுகமாக பட்டயம்பெற்ற பொருள் வளங்கள் மற்றும் போக்குவரத்து நிறுவனத்தின் இலங்கை பிரதானி நிரால் கடவத்தாரச்சி அவர்கள் செயலாளருக்கு நினைவுச் சின்னமொன்றையும் வழங்கிவைத்தார்.
புதுக்குடியிருப்பு மத்திய மகாவித்தியாலய கேட்போர் கூடத்தில் அண்மையில் இடம்பெற்ற இந்த நிகழ்வில் அனுபவம் வாய்ந்த விரிவுரையாளர் குழுவினர் கலந்துகொண்டனர்.
உள்ளுர் மாணவ சமூகத்தின் கல்வித் தரத்தினை மேம்படுத்தும் நோக்குடன் இந்த சமூக நலத்திட்டம் முன்னெடுக்கப்பட்டது.
கொழும்பு துறைமுகத்தில் காணப்படுகின்ற மிகவும் ஆழமான முனையம் CICT நிறுவணத்திற்கு சொந்தமானதாகும்.
ஸ்ரீ மாமாங்கப்பிள்ளையார் பாதயாத்திரை சங்கத்தின் ஏற்பாட்டில் இவ்வருட கதிர்காம யாத்திரையானது முதலாம் கட்டம் இன்று 02 ஆம் திகதி மட்டக்களப்பு ஸ்ரீ மாமாங்கப்பிள்ளையார் பேராலயத்தில் இருந்து கால்நடையாகப் புறப்பட்டது.
மூன்றாம் கட்டமாக 06 ஆம் திகதி திங்கட்கிழமை ஸ்ரீ மாமாங்கப்பிள்ளையார் ஆலயத்தில் தங்கி 07-07-2015 காலை 7.00 மணிக்கு பஸ் மூலம் புறப்பட்டு திருக்கோயில் ஸ்ரீ சித்திரவேலாயுத சுவாமி ஆலயம் செல்ல தீர்மானிக்கப்பட்டுள்ளது.
மூர்த்தி, தலம், தீர்த்தம் ஆகிய முச் சிறப்புக்களுமுடைய தாய்ப் புராண வரலாற்றுச் சிறப்புக்கள் கொண்டமைந்தது.
தரையானது அம்பாந்தோட்டைப் பகுதியில் கடல் சார்ந்த நெய்தல் நில சம தரையாகவும் மேலே செல்லச் செல்ல காடு சார்ந்த முல்லை நிலமாகவும்,  வடக்கே செல்ல மலைசார்ந்த குறிஞ்சி நிலமாகவும் காட்சியளிக்கிறது.
குறிஞ்சி நிலப்பாங்கும்,  குமரவேல் உறை குன்றும் “சேயோன் மேயமைவரை உலகமும்” எனப் பழந்தமிழ் நூலாம் தொல்காப்பியம் கூறும் இலக்கணத்திற்கமைந்து விளங்குவது கதிர்காமத்தலமாகும்.
பிறப்பிடம் மட்டிக்கழியாய் இருந்தும் அமைதி தேடி திராய்மடுக்காட்டுக்குள் குடிசையமைத்து வாழலானார்.
நாளுக்கு நாள் அவர் செயற்பாடுகள் இறை சிந்தனையில் மேன்மையடைதல் கண்டு அடியார் கூட்டம் இவர் இருப்பிடம் நோக்கிப் புறப்பட்டார்கள்.
அவர்களின் ஒருவர்தான் இன்று யாத்திரையை முன்னெடுத்துச் செல்லும் சி. விஜயசிங்கம் அப்பாஜி அவர்கள் ஆவார்.
அவ்வமயம் அப்பாஜி அவர்கள் சிறுவனாய் கொட்டிலை அண்டிய தூரம் விறகெடுத்துக் கொண்டிருந்தார்.
% வீதமானோர் பயிற்சி இன்றியும் சாதாரண பயிற்சியுடனும் சென்றவர்களாவர் என்பதை சுட்டிக்காட்டிய அமைச்சர் ,எதிர்காலத்தில் இவர்கள் மூலம் கிடைக்கும் வெளிநாட்டு செலாவணியை மேலும் அதிகரிப்பதற்கு நடவடிக்கை எடுக்கப்படும் என .
நேற்று (25) பிற்பகல் காலி வித்தியாலோக மகா பிரிவெனாவில் இடம்பெற்ற புண்ணிய நிகழ்வில் கலந்து கொண்டு உரையாற்றிய ஜனாதிபதி, பொதுமக்களின் விருப்பத்திற்கு அமைவாகவே அன்றி அதற்குப் புறம்பான எந்தவொரு நடவடிக்கையினையும் மேற்கொள்வதற்கு அரசாங்கம் தயாரில்லையென வலியுறுத்தினார்.
புதிய அரசியலமைப்பு மாத்திரமன்றி அரசின் அனைத்து நடவடிக்கைகள் தொடர்பாகவும் ஊடகங்களில் பல்வேறு கருத்துக்கள் வெளியாவதாக குறிப்பிட்ட ஜனாதிபதி, சில நேரங்களில் அவை விசித்திரமாகவுள்ளதெனவும், நாட்டின் நன்மைக்காக அன்றி நாட்டின் அழிவுக்காக இணையதளம் உள்ளிட்ட பல்வேறு ஊடகங்களைப் பயன்படுத்தக் கூடாதெனவும் குறிப்பிட்டார்.
காலி வித்தியாலோக பிரிவெனா விகாரையில் புதிதாக நிர்மாணிக்கப்பட்ட அக்குரட்டிய நந்தசார ஞாபார்த்த நூலக கட்டிடத்தை திறந்து வைத்தல் மற்றும் பிக்குகள் தங்குமிடத்திற்கான அடிக்கல் நாட்டும் புண்ணிய நிகழ்வு ஆகியன ஜனாதிபதி தலைமையில் இடம்பெற்றது.
குறைப்பாவனையுடைய பழக் கன்று நடுவதை முன்னிட்டு விகாரை வளவில் ஜனாதிபதி நெல்லி கன்றினை நட்டு வைத்தார்.
சோமாவதி ரஜமகா விகாராதிபதி சங்கைக்குரிய பஹமுனே ஸ்ரீ சுமங்கல நாயக்க தேரர், கலாநிதி பலாங்கொடை சோபித நாயக்க தேரர், பேராசிரியர் பெல்லன்வில விமலரதன தேரர், அக்கமகா பண்டிதர் சங்கைக்குரிய பல்லத்தர சுமனஜோதி நாயக்க தேரர், சங்கைக்குரிய திவியாசே யசஸ்ஸி தேரர் உள்ளிட்ட மகாசங்கத்தினர், தென்மாகாண ஆளுனர் ஹேமகுமார நானாயக்கார, அமைச்சர்களான வஜிர அபேவர்தன, கயந்த கருணாதிலக்க, சந்திம வீரக்கொடி, பிரதி அமைச்சர் மனுஷ நானாயக்கார, பாராளுமன்ற உறுப்பினர் பந்துல பண்டாரிகொட ஆகியோர் உள்ளிட்ட அமைச்சர்கள் மற்றும் பாராளுமன்ற உறுப்பினர்கள் இதில் கலந்து கொண்டனர்.
,தீயணைப்பு சேவைகள் திணைக்களத்தினர் தமது கட்டுப்பாட்டுக்குள் கொண்டு வந்துள்ளனர்.
இந்த சம்பவம் குறித்து தகவல் அறிந்ததும் வடமத்திய மாகாண முதலமைச்சர் எஸ்.எம்.ரஞ்சித் சமரகோன் அவ்விடத்துக்கு விரைந்து நிலைமைகளை நேரில் கண்டறிந்தார்.தீயினால் சேதமடைந்த ஸ்கேன் இயந்திரத்தை மீண்டும் திருத்தியமைத்து இந்த வைத்தியசாலையின் பாவனைக்கு விடுமாறு சம்பந்தப்பட்ட அதிகாரிகளுக்கு பணிப்புரை விடுத்தார்.
இன்று முதல் எதிர்வரும் 18ம் திகதி வரை இது தொடர்பாக மக்களுக்கு விளக்கம் அளிக்கும் நடவடிக்கை மேற்கொள்ளப்படவுள்ளதாக சுகாதார சேவைகள் பணிப்பாளர் தெரிவித்தார்.
வருடாந்தம் வீதி விபத்துகளால் 37 ஆயிரம் பேர் பாதிக்கப்படுவதுடன், வருடாந்தம் இரண்டாயிரத்து 500 மரணங்கள் சம்பவிக்கின்றன.
வீதி சமிக்ஞையை பின்பற்றாமை, சாரதிகளும் - பாதசாரிகளும் கவனயீனமாக வீதியை பயன்படுத்துவது, கைபேசி பயன்பாடு, வாகனங்களின் தரம் ஆகியவை வீதி விபத்துகளுக்கு காரணமாக அமைகின்றன.
நாளை புதன்கிழமை தொழில் ஸ்தாபனங்கள் பராமரிப்பு தினமாகவும், வியாழக்கிழமை வீடுகளை பராமரிக்கும் தினமாகவும் பெயரிடப்பட்டுள்ளது.
வருகை தரவுள்ள இராஜாங்க அமைச்சர் நாட்டின் ஜனாதிபதி , பிரதமர், வௌிவிவகார அமைச்சர், தமிழ் தேசிய கூட்டமைப்பின் தலைவர் இரா.சம்பந்தன் மற்றும் அரசியல் பிரமுகர்கள் பலருடன் கலந்துரையாடலில் ஈடுபடுவார்.
அதனைத் தொடர்ந்து மறுநாளான 03 ஆம் திகதி பிற்பகல் இலங்கையிலிருந்து அவர் புறப்படவுள்ளார் என்பது குறிப்பிடத்தக்கது.
தனது மனசாட்சிக்கு ஏற்ப நேர்மையாக செயற்பட்டு நாட்டை கட்டியெழுப்பும் சவாலை வெற்றிகொள்வதற்கு அனைவரும் ஒன்றுபட வேண்டுமென்றும் ஜனாதிபதி அவர்கள் தெரிவித்தார்.
நோய்வாய்ப்பட்டு கண்டி பொது வைத்தியசாலையில் சிகிச்சை பெற்றுவரும் ராமாஞ்ய மகா நிக்காயவின் மகா நாயக்க தேரர் சங்கைக்குரிய நாபான பேமசிறி நாயக்க தேரரை சந்தித்து ஜனாதிபதி  அவரது சுகதுக்கங்களை கேட்டறிந்ததுடன், அவர் விரைவில் குணமடைய பிரார்த்தனை செய்தார்.
மத்திய மாகாண முதலமைச்சர் சரத் ஏக்கநாயக்க, முன்னாள் அமைச்சர் எஸ்.பி.திசாநாயக்க ஆகியோரும் ஜனாதிபதி அவர்களுடன் இவ்விஜயத்தில் இணைந்துகொண்டனர்.
இநத அதிகாரிகள் மாதாந்தம் உரிய குடும்ப உறுப்பினர்களின் விபரங்களை வெளிநாட்டு வேலைவாய்ப்பு அமைச்சுக்கு அனுப்புவது அவசியமாகும்.
கோட்டே ஸ்ரீ கல்யாணி சாமஸ்ரீ தர்ம மகா சங்க சபையின் தலைவர் சங்கைக்குரிய இத்தேபானே தம்மாலங்கார தலைமை தேரர் தலைமையிலான மகாசங்கத்தினர், முன்னாள் ஜனாதிபதி சந்திரிகா பண்டாநாயக குமாரதுங்க, அமைச்சர்களான ரவி கருணாநாயக, அர்ஜுன ரணதுங்க, முன்னாள் அமைச்சர் அதாவுத செனவிரத்ன ஆகியோரும் இந்நிகழ்வில் கலந்துகொண்டனர்.
2 ஹெக்டேர் நிலங்கள் தண்ணீரில் மூழ்கியுள்ளன.
மேலும் அப்பகுதி மக்களின் அன்றாட வாழ்வு பெரிதும் பாதிக்கப்பட்டுள்ளது.
சுகாதாரம் போசாக்கு மற்றும் சுதேச வைத்தியத்துறை அமைச்சர் டொக்டர் ராஜித சேனாரட்ண மற்றும் மின்சக்தி எரிசக்தி மற்றும் வர்த்தக அபிவிருத்தி அமைச்சர் ரவி கருணாநாயக்க ஆகியோர் இதற்கான அடிகல்லை நாட்டி வைத்துள்ளனர்.
இந்த தொழிற்சாலைகளில் தயாரிக்கப்படும் வைத்திய உபகரணங்கள் வைத்திய உபகரணங்களின் பாகங்கள் ஜேர்மனிக்கு ஏற்றுமதி செய்யப்பட்டுள்ளது.
த்தோடு நீண்ட காலத்துக்கு இலங்கைக்கு வெளிநாட்டு வருமானம் கிடைக்கவுள்ளது.
அண்மையில் கண்டி பிரதேசத்தில் இடம்பெற்ற சம்பவங்கள் போன்று இனிமேல் ஏற்படுவதற்கு அரசாங்கம் இடமளிக்காது என்று பிரதமர் நம்பிக்கை தெரிவித்தார்.
