முதலாளித்துவத்தையே முதன்மையாகக் கொண்ட அதன் பொருளாதாரம், உலகில் நான்காவது இடத்தை வகிப்பதாகும்.
மேற்கொண்டு அரசுடைமையைப் பெரிதும் குறைத்துக் கொண்டுள்ளது.
(welfare state) வெகுவாகக் கட்டுப்படுத்தி வந்திருக்கிறது.
சேவைகளே நிகர உள்நாட்டு உற்பத்தியின் பெரும் பங்கை வகிக்கின்றன.
தொழில்த்துறையின் முக்கியத்துவம் நாளுக்கு நாள் குறைந்து வந்தாலும், ஐ. இ இன்னும் சாலை வாகனங்கள், போராயுதங்கள், பெட்ரோலியப் பொருட்கள், கணினிகள், தொலைக்காட்சிப் பெட்டிகள் மற்றும் கைபேசிகள் ஆகியவற்றுக்கு ஐரோப்பாவின் முன்னணி உற்பத்தியாளராகத் திகழ்கிறது.
பாதிப்பு இருந்து வந்திருக்கிறது.
உலகிலேயே மிகவும் புகழ் வாய்ந்த பல்கலைக் கழகங்களில் இரண்டை ஐக்கிய இராச்சியம் கொண்டுள்ளது.
ஆகிய குழுக்கள் சர்வதேசப் புகழ் அடைந்தன.
வகை இசையிலும் ஐ. இ முன்னிடம் வகிக்கிறது.
<references group="lower-alpha"/>
இம்மாற்றம் வேதி வினையின் முடிவில் ஒன்று அல்லது அதற்கு மேற்பட்ட புதிய பொருட்கள் விளைகின்றன.
வேதிச்சமநிலையை அடையும் வரை அல்லது வினை நிறைவடையும் வரை வேதிவினைகள் முன்னோக்கியோ அல்லது பின்னோக்கியோ நிகழ்கின்றன.
மின்கலனுக்கு மின்னேற்ற அதையொரு மின் ஆற்றல் மூலத்துடன் இணைப்பது அல்லது ஒளிச்சேர்க்கை மூலம் மின்காந்த கதிரியக்கத்தை சூரிய ஒளி வடிவில் ஈர்த்துக் கொள்வதும் உதாரணமாகும்.
பொருட்களின்  உருமாற்றம் பற்றிய தொடக்கநிலைக்  கோட்பாடுகள் கிரேக்க தத்துவவாதிகளால் உருவாக்கப்பட்டன, அனைத்துப் பொருட்களும் தீ, நீர், காற்று மற்றும் மண் ஆகிய நான்கு கூறுகளால் ஆனவை என்று சாக்ரடீசுக்கு முற்பட்ட தத்துவ அறிஞரான எம்பெடோக்களசு என்பவர் தன்னுடைய  நான்கு-உறுப்புக் கோட்பாட்டின் மூலம் விளக்கினார்.
இரசாயன வினைகள் தொழிற்துறையில் படிப்படியாக நடைமுறைக்கு கொண்டுவரப்பட்டன.
கந்தக அமிலத் தயாரித்தல் தொழில்நுட்பம் மேலும் ஏற்புடையதாக மாறியதால் 1880 களில் தொடுகைச் செயல்முறை தோன்றியது .
அது எரியும்போது வெளியிடப்படுகிறது என்பதை அக்கோட்பாடு முன்மொழிந்தது.
யோசப் இலூயிசு கே லூசக் 1808 இல் வாயுக்கள் ஒன்றுடன் ஒன்று வினைபுரியும் போதெல்லாம் அவற்றுக்கிடையே ஒரு குறிப்பிட்ட வகையான தொடர்புகள் இருப்பதைக் கண்டறிந்தார்.
வேதி வாய்ப்பாடு அல்லது வேதிக் கட்டமைப்பு மூலம் வினைபடும் பொருட்கள் இடது புறத்திலும், வினை விளை பொருட்கள்  வலது புறத்திலும் காட்டப்படுகின்றன .
கீட்டோன்கள் இவ்வினையில் எசுத்தர்களாக மாற்றப்படுகின்றன.
இங்கே விளைபொருட்களிலிருந்து பகுப்பாய்வு  தொடங்குகிறது, உதாரணமாக  தேர்ந்தெடுக்கப்பட்ட வேதிப்பிணைப்புகளை பிரிப்பதன் மூலமாக  நம்பத்தகுந்த தொடக்க வினைப்பொருட்களை அறியலாம்.
கவனிக்கப்பட்ட பெரும்பாலான வினைகள் அடிப்படை வினைகளுக்கு  இணையாக அல்லது அவற்றின் தொடர்ச்சியாகவே  நிகழ்கின்றன.
எளிய அடிப்படை வினையில் ஒன்று அல்லது இரண்டு மூலக்கூறுகள் பங்கேற்கின்றன.
இவ்வகை வினைகளுக்குக் கூடுதலாக வெப்பம் அல்லது ஆற்றல் சூரிய ஒளி அல்லது வெப்பம் மூலம் தேவைப்படுகிறது.
இப்பிளவு ஒரேவகை அல்லது பல்வகைப் பிளவு என்பனவற்றில் ஒன்றாக இருக்கலாம்.
எனவே அம்மூலக்கூறு நடுநிலை இயங்குறுப்பாக மாறுகிறது.
இருமூலக்கூறு வினைகளில் இரண்டு மூலக்கூறுகள் ஒன்றுடன் ஒன்று மோதி வினைபுரிந்து ஒன்றாக இணைகின்றன.
இவ்விணைப்பு வேதியியலில் வேதித் தொகுப்பு அல்லது கூட்டு வினை எனப்படுகிறது.
(புலத்தி நகர்) தலைநகரை மாற்றிக்கொண்டான்.
தக்கிண தேசத்து மன்னர்களான மானாபரண மன்னன் அவரது தம்பிமாரான ஸ்ரீ வல்லப மன்னன் மற்றும் கீர்த்தி ஸ்ரீ மேகன் போன்றோர்களுக்கும் மற்றும் உருகுணை மன்னர்களுக்கும் இராசரட்டையின் அரியணையைப் பிடிப்பதில் போட்டியிருந்தது.
Ancient Ceylon: An Account of the Aborigines and of Part of the Early Civilisation .
347 ஆம் நாளாகும்.
இன்றும் இது ஒரு பொதுவான வார்த்தையாக மட்டுமே இருக்கிறது.
இது போன்ற சைபீரியன் ட்ராப்ஸ் பகுதிகளிலும் இந்த எரிமலை வாயின் சுவடுகள் அறியப்பட்டுள்ளன.
முடிவாக அமைந்துள்ள்ளது.
இந்த அளவீடின்படிக்கு எரிமலை வெடிப்பின் வீரியம் அளவுகோளிடப்படுகிறது.
இவை போன்ற பெரிய நிகழ்வுகளில் எரிமலை வெடிப்புகள் குறைந்தது 1000 கன கிலோமீட்டர்களை உள்ளடக்கும்.
அதுவே அவரை ஒரு பிரபலமான நடிகையாக நிலைநாட்டியது.
அவரது தந்தை பாரெய்லியில் வசிக்கும் .
காத்ரி சமூகத்திலிருந்து வந்தவர்.
வசிக்கும் மலையாளக் குடும்பத்திலிருந்து வந்தவர்.
உள்ள லா மார்டினியரி பெண்கள் பள்ளியிலும் பயின்றார்.
பிறகு இந்தியா வந்த அவர் பாரெய்லியில் உள்ள ராணுவப் பள்ளியில் அவரது உயர்நிலைப் பள்ளிப்படிப்பை முடித்தார்.
அவரின் அடுத்த சில திரைப்படங்கள் பாக்ஸ் ஆபிஸில் மோசமாக ஓடிய படங்களாக இருந்தன.
அது அவரின் முதல் "எதிர்மறை" பாத்திரம், அதில் அவர் வில்லியாக நடித்தார்.
உள்ளிட்ட பாலிவுட் நடிகர்களுடன் கலந்துகொண்டார்.
கண்டுபிடிப்பாளரும், தொழிலதிபரும் ஆவார்.
தாமஸ் ஆல்வா எடிசன் 1847 ஆம் ஆண்டு பிப்ரவரி 11 ஆம் நாள் ஓஹையோவில் உள்ள மிலான் என்னும் ஊரில் பிறந்தார்.
பின்னர் எடிசனின் குடும்பம் மிச்சிகனிலுள்ள ஊரோன் துறைமுகப் பகுதிக்கு இடம்பெயர்ந்தது.
1840 இல் தந்தை சாமுவெல் எடிசன் மிலானில் ஒரு சாதாரண மர வியாபாரத்தைத் தொடங்கினார்.
செய்தித்தாளில் இருந்த 'மின்சக்தியின் பயிற்சி ஆராய்ச்சிகள் ' பகுதியை ஒருவரி விடாது ஆழ்ந்து படித்து முடித்தார்.
இவை அவரது வாழ்க்கையில் ஒரு பெருத்த மாறுதலை உண்டாக்கியது!
கணித அறிவும் அறிவியல்இயற்பாடு  எதுவும் முறையாகக் கற்காத எடிசன், சோதனைகள் மூலம் மட்டிலுமே திரும்பத் திரும்ப முயன்று, பல அரிய தொழில்நுட்பக் கருவிகளைப்  படைத்தார்.
சில காலம் பன்றி வெட்டினார்; காய்கறி வணிகம் செய்தார்.
அந்த ஆராய்ச்சி விளைவில், மின்சாரப் பேனா (Electric Pen), பிரதி எடுப்பி (Mimeograph) போன்ற சாதனங்கள் உருவாகின.
அப்போதுதான் விஞ்ஞானிகள் 'மின்வீச்சு விளக்கு ' தொடர்பாக பல ஆய்வுகள் செய்து வந்தனர்.
1878 ஜூலை மாதம் 29 ஆம் தேதி சூரிய கிரகணத்தின் போது, ராக்கி மலைத்தொடர் மீது சில ஆராய்ச்சிகள் செய்ய பல அமெரிக்க விஞ்ஞானிகள் சென்றிருந்தனர்.
எடிசனின் மின்விளக்கு குறித்த ஆய்வுகளுக்கு, 'எடிசன் மின்சார விளக்குக் கம்பெனியை ' துவங்கிய ஜெ.பி. மார்கன் குழுவினர் முன் பணமாக 30,000 டாலர் தொகையை அளித்தார்கள்.
1878 டிசம்பரில், பிரின்ஸ்டன் பல்கலைக் கழக அறிவியல் பட்டதாரி, 26 வயதான ஃபிரான்சிஸ் அப்டன் (Francis Upton) எடிசன் ஆய்வுக் குழுவில் சேர்ந்தார்.
மின்தடை  மிகுதியாய் உள்ள உலோகக் கம்பி ஒன்றை மின்விளக்கிற்கு எடிசன் முதலில் உபயோகித்தார்.
1881 ஜனவரியில் முதல் 'மின் விளக்கொளி அமைப்பு ' வணிகமாக்கும் துறை ஏற்பாடு, நியூ யார்க் 'ஹிந்த் & கெட்சம் ' அச்சக மாளிகையில் நடந்தது.
அது 1882 செப்டம்பர் முதல் இயங்க ஆரம்பித்தது.
பின்னர் மின்விளக்கு அமைப்பு வளர்ச்சி அடைந்து, பின் பெரிய உணவு விடுதிகள், அரங்க மேடைகள், வாணிபத் துறைகள், கடைகள் என அனைத்து இடங்களிலும் மின்குமிழி ஒளி வீச, ஆக்க மேதை எடிசனின் புகழ் உலகெங்கும் பரவியது.
இதுவும் அவரது முதல் சாதனை ஆகும்.
அதன் பின்னரே அறிவியலறிஞர்கள் எடிசன் விளைவுக்கு விளக்கம் தந்தனர்.
விஞ்ஞானிகள் எடிசனுக்கு எதிராகத் தங்கள் கருத்துகள் மூன்றை ஆணித்தரமாகக் கூறினர்.
அக்காலகட்டத்தில் அறிவியல் அந்த அளவே வளர்ந்திருந்ததால் அவர்கள் கூறியதில் உண்மை இருந்தது.
கடைசியில் அவர் கனவு நனவாகியது.
பத்திரிகையாளர்களும் விஞ்ஞானிகளும் அவரைப் பாராட்ட ஓடோடிச் சென்றபோது அவர் தமது ஆராய்ச்சிக்கூடத்தில் வேறோர் ஆராய்ச்சியை ஆரம்பித்திருந்தார்.
இந்த எண்ணம் எடிசனுக்கு பத்தாண்டுகளாக இருந்திருக்கிறது.
'கற்பனையில் எனக்கு இது முன்பே உதயமானதுதான்.
ஆனால் படம் யாவும் அதில் சற்று மங்கலாகத்தான் தெரிந்தன.
பிராட்வே விளக்குகள், வீதியில் பயணப் போக்கு விளக்குகளைத் தவிர மற்ற எல்லா விளக்குகளும் ஒளியிழந்தன.
கூட்டுகளின் ஒளி பிரிதலால் ஏற்படும் .
ஓசோன் குறைபாடுகள் க்லோரோப்லூரோகார்பன்கள் வெளி தள்ளப்படுவதினாலும், ஆலோன்கள் அதிகரிப்பதினாலும் ஏற்படுகின்றன.
குறைபாடு போன்ற பாதிப்புக்கள் புற ஊதா கதிர்கள் நேரடியாக புவியை வந்து அடைவதால் ஏற்படுகின்றன.
இது ஓசோன் குறைபாட்டினால் நடக்கிறது.
இதனை இலங்கையில் உள்ள ரஷ்ய தூதரகம் ஏற்பாடு செய்திருந்தது.
எனினும் இந்த போராட்டம் நேற்றுடன் இன்றும் வெற்றிகரமாக இடம்பெற்று வருவதாக அந்த சங்கத்தின் தலைவர் முறுதெட்டுவே ஆனந்த தேரர் எமது செய்தி பிரிவிடம் கூறியுள்ளார்.
எனினும் லோட்டஸ் சுற்றுவட்டத்தில் காவல்துறையினர் வீதித்தடையை ஏற்படுத்தி இருந்தனர்.
அதனை தாண்டி செல்ல மாணவர்கள் முற்பட்ட நிலையில் தண்ணீர் மற்றும் கண்ணீர் புகை பிரயோகம் மேற்கொள்ளப்பட்டது.
இந்த சம்பவம் இரத்தினபுரி – கிரியெல்ல – பஹலகம பிரதேசத்தில் இடம்பெற்றுள்ளது.
எனினும் காவற்துறை வந்து குறித்த நபரை காப்பாற்றி மருத்துவமனையில் அனுமதிக்கப்பட்ட போதும், அவர் உயிரிழந்துள்ளதாக காவற்துறை தலைமையகம் குறிப்பிட்டுள்ளது.
இன்று இலங்கை வரும் அவர் மூன்று தினங்களுக்கு இலங்கையில் தங்கி இருப்பார்.
இரண்டு நாடுகளுக்கும் இடையிலான ராஜதந்திர உறவுகளின் 40 ஆண்டு பூர்த்தியை முன்னிட்டு இந்த விஜயம் இடம்பெறவுள்ளது.
இதனால் அன்பில் திளைத்திருக்கும் புலிக்குட்டிகள் நாயின் மீது ஏறி அமர்ந்து விளையாடி மகிழ்கின்றன.
பின்னர் உந்துருளி மற்றும் கைப்பற்றப்பட்ட பொருட்கள் சம்மாந்துறை காவற்துறையிடம் ஒப்படைக்கப்பட்டுள்ளது.
கும்புறுபிட்டிய பிரதேசத்தில் இருந்து கொழும்பு நோக்கி உந்துருளியில் பயணித்த கொண்டிருந்த போதே அவர்கள் இந்த அனர்த்தத்திற்கு முகம் கொடுத்துள்ளனர்.
இதேவேளை, நேற்று முன்தினம்  மீகாஹதென்ன - அகலவத்தை பாதையில் இடம்பெற்ற உந்துருளி விபத்தில் இளம் காதல் ஜோடி ஒன்று உயிரிழந்துள்ளமை குறிப்பிடத்தக்கது.
இந்து சமுத்திரத்தில் வைத்து சோமாலிய கடல்கொள்ளையர்களால் குறித்த கப்பல் கடத்தப்பட்டுள்ளது.
குறித்த கப்பலில் இருந்து உதவிக்கான சமிக்ஞை விடுக்கப்பட்டுள்ளதுடன், கண்காணிப்பு தொகுதி நிறுத்தப்பட்டுள்ளதாக வெளிநாட்டு செய்திகள் தெரிவிக்கின்றன.
டுபாயிக்கு சொந்தமான 'ARIS-13' என்ற குறித்த கப்பல் எரிபொருள்களை கொண்டு சென்றுள்ள போதே கடத்தப்பட்டுள்ளதாக வெளிநாட்டு செய்திகள் மேலும் குறிப்பிட்டுள்ளன.
கடந்த சில காலங்களாக சோமாலிய கடற்கொள்ளையர்களின் கடத்தல் நடவடிக்கை வெகுவாக குறைந்திருந்தது.
கப்பல்கள் கொள்ளையர்களின் பிரசன்னம் அதிகமிருந்த பகுதிகளை தவிர்த்தமை, சர்வதேச கடற்படைகளின் அதிகரித்த பிரசன்னம் ஆகியன இதற்கான காரணிகளாக இருந்தன.
சொகுசு மோட்டார் வாகனம் ஒன்று இவர்கள் பயணித்த உந்துருளியில் மோதி இந்த விபத்து இடம்பெற்றுள்ளது.
குறித்த முச்சக்கர வண்டி, மீபே திசை நோக்கி பயணித்த பாரவூர்தியில் மோதி இந்த விபத்து இடம்பெற்றுள்ளது.
இலங்கை இந்திய கடற்பரப்பில் தமிழக கடற்றொழிலாளர்கள் எதிர்கொள்ளும் பிரச்சினைகள் தொடர்பில் இந்திய வெளிவிவகார அமைச்சின் அதிகாரிகளுடன் தமிழக கடற்றொழிலாளர்களின் பிரதிநிதிகள் பேச்சுவார்த்தை நடத்தவுள்ளனர்.
கடந்த வாரம் தமிழக மீனவர் ஒருவர் இலங்கை கடற்படையினரின் துப்பாக்கிப் பிரயோகித்தில் உயிரிழந்ததாக குற்றச்சாட்டுகள் முன்வைக்கப்பட்டிருந்தன.
மேல்மாகாணத்தின் தனியார் பேரூந்துகளின் பயணம் செய்யும் பயணிகளுக்கு பிரயாண சீட்டு கட்டாயமாக்கப்படுள்ளமை தொடர்பில் பேரூந்து சங்கங்கள் பல்வேறு கருத்துக்களை வெளியிட்டுள்ளன.
ஜெனீவா யோசனை தொடர்பில் வடமாகாண சபையின் விசேட அமர்வு ஒன்று தற்சயம் நடைபெற்று வருகின்றது.
இந்த நிலையில், இலங்கைக்கு கால அவகாசம் வழங்க கூடாது என தெரிவித்து மாகாண சபை உறுப்பினர் எம்.கே. சிவாஜிலிங்கம் பிரேரணை ஒன்றை கடந்த அமர்வின் போது முன்மொழிந்தார்.
