இதேவேளை, இம்முறை ஜனாதிபதித் தேர்தல் 2014 ஆம் ஆண்டுக்கான வாக்காளர் இடாப்பிற்கு அமைய நடைபெறவுள்ளதாக தேர்தல்கள் செயலகம் அறிவித்துள்ளது.
காணாமற்போனோர் தொடர்பிலான முறைப்பாடுகளை விசாரணை செய்யும் ஜனாதிபதி ஆணைக்குழுவின் சாட்சி விசாரணைகள் வவுனியாவில் நாளைய தினமும் இடம்பெறவுள்ளது.
ACSA, SOFA மற்றும் Millennium Challenge போன்ற ஏனைய நாடுகளுடன் கைச்சாத்திடப்படும் எச்தவொரு உடன்படிக்கைக்கும் பாராளுமன்றத்தின் அனுமதி பெறப்பட வேண்டும் என எதிர்க்கட்சி இன்று பாராளுமன்றத்தில் தெரிவித்தது.
சார்க் நாடுகளின் தலைவர்களுக்கு அழைப்பு விடுத்தமை சரியான தருணத்தில் மேற்கொண்ட சரியான தீர்மானம் என அவர் சுட்டிக்காட்டியுள்ளார்.
தனது இந்த முக்கிய முதலாவது வெளிநாட்டு கொள்கை மூலம் இந்தியாவின் பலத்தை உலகிற்கு எடுத்துரைத்துள்ளதாக அவர் கூறியுள்ளார்.
தமது அரசாங்கம் குறித்து மக்கள் மிகுந்த எதிர்பார்ப்பு வைத்துள்ளதாகவும் அவர்களின் அபிலாஷைகளை துரிதமாக நிறைவேற்றுவதே தனது கடமை எனவும் அவர் கூறியுள்ளார்.
இந்தத் தீர்மானம் தொடர்பிலான உடன்படிக்கையிலும் தாம் கைச்சாத்திடவுள்ளதாகவும் அவர் கூறியுள்ளார்.
பாதுகாவலர்களிடமிருந்து பிரிக்கப்பட்டு காப்பகங்களில் தடுத்து வைக்கப்பட்டுள்ளனர்.
ட்ரம்ப்பின் இந்த அதிரடி நடவடிக்கை மனிதநேயமற்ற செயல் என உலகளாவிய ரீதியில் எதிர்ப்பு வௌியிடப்பட்டமை குறிப்பிடத்தக்கது.
புதிய திட்டத்தை நியூயோர்க்கை  மையமாக கொண்ட முதலீட்டு நிதியம் ஒன்று அறிமுகப்படுத்தவுள்ளது.
இந்த குறையை போக்கும் வகையில் அனைத்து நாட்டினரும் எளிதாக இணையத்தின் சேவையை பெற வசதியாக ‘அவுட்டர்நெட்’ என்ற புதிய திட்டம் ஒன்று செயல்படுத்தப்படவுள்ளது.
உலகில் இதுவரைகாலம் இணையச் சேவையை பெற முடியமல் உள்ள சைபீரியா, அமெரிக்காவின் மேற்குப் பகுதி மற்றும் ஆப்பிரிக்க கண்டத்தில் உள்ள நாடுகளின் கிராமப்புறங்கள், உலகின் பல்வேறு தீவுகளில் வசிக்கும் மக்கள் பயனடையும் வகையில் இந்த திட்டம் செயல்படுத்தப்படவுள்ளது.
இந்த விடயம் சுற்றுலா, கைத்தொழில் மற்றும் மீன்பிடித் தொழிலுக்கு என்பனவற்றுக்கு பாரிய அச்சுறுத்தலாக அமையுமெனவும் அவர் சுட்டிக்காட்டியுள்ளார்.
விடுதலை செய்யப்படும் கைதிகளில் 4 பெண்களும் அடங்குவதாக சிறைச்சாலைகள் திணைக்களம் மேலும் தெரிவித்துள்ளது.
பல்கலைக்கழக வளாகத்தில் ஆலய கட்டுமானப் பணிகள் இடம்பெற்று வரும் நிலையில், சுற்றுமதிலை நிர்மாணிப்பதற்காக நிலம் தோண்டப்பட்டுள்ளது.
1.35 பில்லியன் ரூபா செலவில் நிர்மாணிக்கப்பட்ட நுரைச்சோலை அனல் மின்நிலையத்தில் இருந்து முதற்கட்டமாக 300 மெகாவட் மின்சாரம் 2011 ஆம் ஆண்டு மார்ச் 22 ஆம் திகதி தேசிய மின் கட்டமைப்புடன் இணைக்கப்பட்டது.
1979 ஆம் ஆண்டு சட்டத்தரணியாக சேவையில் இணைந்த வனசுந்தர விஜயதிலக்க, 1980 ஆம் ஆண்டு அரசாங்கத்தின் வழக்கறிஞராக சட்ட மாஅதிபர்கள் திணைக்களத்தில் இணைந்தார்.
அதற்கமைய, பேராயர் சார்பில் இன்று சட்டத்தரணி ஒருவர் மன்றுக்கு ஆஜராகியிருந்தார்.
ஆறு ஒப்பந்த நிறுவனங்கள் நிர்மாணப் பணிகளை முன்னெடுப்பதாக திட்டத்திற்கான பணிப்பாளர் குறிப்பிட்டார்.
இந்த வீதி பொதுஹர பகுதியின் ஊடாக திரும்பி, ரம்புக்கனை, கலகெதர, கன்னொருவ ஊடாகக் கண்டிக்கு செல்லவுள்ளது.
சீன அரசாங்கம் மற்றும் இலங்கை திறைசேரியின் நிதி ஒதுக்கீட்டின் கீழ் நிர்மாணப் பணிகள் முன்னெடுக்கப்படவுள்ளன.
தேசிய அரசாங்கமொன்றை ஸ்தாபித்து அமைச்சர்கள், பிரதி அமைச்சர்கள் மற்றும் இராஜாங்க அமைச்சர்களின் எண்ணிக்கையை அதிகரிப்பது தொடர்பிலான பிரேரணை மீதான விவாதத்தை, ஏனைய கட்சிகளின் கருத்தை பொருட்படுத்தாது முன்னெடுக்க ஐக்கிய தேசியக் கட்சி தீர்மானித்துள்ளதாக  மக்கள் விடுதலை முன்னணியின் தலைவர் அனுரகுமார திசாநாயக்க தெரிவித்தார்.
இன்று நடைபெற்ற கட்சித்தலைவர்கள் கூட்டத்தில் இந்த தீர்மானம் எடுக்கப்பட்டதாக அவர் கூறினார்.
இவரது நடிப்பில் உருவாகியிருக்கும் ‘நெஞ்சம் மறப்பதில்லை’ படம் விரைவில் திரைக்கு வரவிருக்கிறது.
சில வேளைகளில் தென் கிழக்கு திசையில் காற்று வீசும்போது ஹம்பாந்தோட்டை பிரதேசத்திற்கும் அதிக மழைவீழ்ச்சி ஏற்படும் என வளிமண்டலவியல் திணைக்களத்தின் பணிப்பாளர் எஸ். ஆர். ஜயசேகர மேலும் குறிப்பிட்டார்.
உயிர்த்த ஞாயிறன்று நடத்தப்பட்ட தற்கொலைக் குண்டுத்தாக்குதலின் போது, குண்டுகளைக் கொண்டு செல்ல பயன்படுத்தப்பட்டதாக சந்தேகிக்கப்படும் லொறி ஒன்று வத்தளை – நாயகந்த பகுதியில் கைப்பற்றப்பட்டுள்ளது.
நாயகந்த பகுதியில் உள்ள வீடொன்றில் மறைத்து வைக்கப்பட்டிருந்த போதே லொறி கைப்பற்றப்பட்டதாக பொலிஸ் ஊடகப் பிரிவு தெரிவித்துள்ளது.
இப்படத்தில் இவருடைய நடிப்பு அனைவராலும் ஈர்க்கப்பட்டது.
இது குறித்து கூறிய ஷாலினி பாண்டே, “தமிழ் கலாச்சாரம் மிகவும் பிடித்திருக்கிறது.
மக்களின் அழைப்பின் பேரில் இன்று காலை திருகோணமலை மாவட்டத்தின் மேன்கமம் மற்றும் பாலத்தோப்பு ஆகிய பகுதிகளுக்கு விஜயம் செய்த நியூஸ்பெஸ்ட் குழாத்தினர் அங்கு மக்கள் அணியை உருவாக்கினர்.
நேற்று முன்தினம் (17) மதியம் 1.28 மணியளவில் இந்த சம்பவம் பதிவாகியுள்ளது.
தோட்டத்திற்கான மின்சாரமும் துண்டிக்கப்பட்டுள்ளது.
இதேவேளை, நாட்டிற்கு முக்கியத்துவம் வாய்ந்த விடயமாக இது இருப்பதால், ஐவர் அடங்கிய உயர் நீதிமன்ற நீதியரசர்கள் குழாம் முன்னிலையில் இந்த வழக்கு விசாரணைக்கு உட்படுத்தப்பட வேண்டும் என ஜனாதிபதி சட்டத்தரணி கனக ஈஸ்வரன் இங்கு சுட்டிக்காட்டினார்.
மஹிந்த ராஜபக்ஸ பிரதமராக செயற்படுவதைத் தடுத்தும், அமைச்சரவை செயற்படுவதை தடுக்கும் வகையிலும் கடந்த 3 ஆம் திகதி மேன்முறையீட்டு நீதிமன்றம் இடைக்கால தடையுத்தரவொன்றை பிறப்பித்திருந்தது.
இதேவேளை, உயர்நீதிமன்றம் மற்றும் அதனை சூழவுள்ள பகுதிகளில் பாதுகாப்பு பலப்படுத்தப்பட்டுள்ளது.
இதுவரை மதிப்பிடப்பட்டதன் பிரகாரம் சூறாவளியினால் ஐயாயிரத்து 209 பேர் உயிரிழந்துள்ளனர்.
கடந்த மாதம் 26 ஆம் திகதி நடைபெற்ற வட மாகாண சபை அமர்வில் அரசியல் தீர்வுத் திட்டத்தினை தயாரிப்பதற்கான 19 பேர் கொண்ட குழு அமைக்கப்பட்டது.
அந்த குழுவின் முதல் அமர்வு வட மாகாண முதலமைச்சர் சி.வி.விக்னேஸ்வரன் மற்றும் வட மாகாண சபை அவைத்தலைவர் சி.வி.கே.சிவஞானம் ஆகியோரின் இணைத்தலைமையில் முதலமைச்சர் அலுவலகத்தில் இன்று நடைபெற்றது.
இந்த கப்பலில் இருந்த பெரும்பாலானவர்கள் வட அமெரிக்காவிற்கு செல்பவர்களாகவே இருந்தனர்.
தற்போது, அவர் நடிக்கும் இன்னொரு வேடமும் வெளியாகியுள்ளது, அதாவது கிராமத்து ஊர் தலைவராக விஜய் இப்படத்தில் நடிப்பதாக செய்திகள் வெளியாகியுள்ளது.
அதில், விஜய் மானுரை என்ற கிராமத்தை சேர்ந்த ஊர் தலைவராக நடித்தாராம்.
கதைப்படி ஊர் மக்களிடம் பெரும் செல்வாக்கு வைத்திருக்கும் விஜய், அவர்களுக்கு இலவசமாக பள்ளி, மருத்துவமனைகள் கட்டிக்கொடுப்பபது போலவும் காட்சிகள் படமாக்கப்பட்டதாக கூறப்படுகிறது.
இப்படத்தை ஸ்ரீதேனாண்டாள் பிலிம்ஸ் நிறுவனம் தனது 100 ஆவது படமாக இதை தயாரித்து வருகிறது.
இந்த விடயம் தொடர்பில் எதிர்கட்சியின் பிரதம கொறடா அநுர குமார திசாநாயக்க அண்மையில் பாராளுமன்றத்திலும் கேள்வி எழுப்பியிருந்தார்.
இந்த விடயம் தொடர்பில் விசாரணைகளை மேற்கொண்டு அறிக்கை ஒன்றை சமர்பிக்குமாறு ஐ.சி.டி.ஏ நிறுவனத்திற்கு பணிப்பதாக பிரதி அமைச்சர் ஹர்ஷ டி சில்வா பாராளுமன்றத்தில் பதில் வழங்கியிருந்தார்.
தமிழ் தேசியக் கூட்டமைப்பின் தலைவருக்கு அனுப்பியுள்ள கடிதத்திலேயே அவர் இந்த விடயத்தை குறிப்பிட்டுள்ளார்.
[quote] மற்றைய போனஸ் ஆசனம் நல்லாட்சிக்கான மக்கள் இயக்கத்தின் முஸ்லிம் ஒருவருக்கு வழங்குவதாகக் கூறப்பட்டிருந்தாலும், பதவியைப் பெற்றுக்கொண்ட அஸ்மின் அவர்கள் தமிழரசுக் கட்சி அங்கத்தவர் போன்றே செயற்பட்டார்.
இறுதியாக நடைபெற்ற தமிழரசுக் கட்சியின் இளைஞரணி மாநாட்டில் கலந்துகொண்டு தொடர்ந்து தமிழரசுக் கட்சி அங்கத்தவராக செயற்படுகின்றார்.
பதவிக்காலத்தின் ஒரு வருட முடிவில் தற்போது மாகாண சபை உறுப்பினர் செ. மயூரனை பதவி நீக்கும் விடயத்தில் காட்டும் தீவிரத்தை மேரி கமலாவை பதவி நீக்குவதில் தமிழரசுக் கட்சி காட்டியிருக்கவில்லை.
தொடர்ந்து சிறப்பாக துடுப்பெடுத்தாடிவரும் டில்சான் 77 ஓட்டங்களைப் பெற்றுக்கொண்டுள்ளதுடன் இலங்கை அணி 1 விக்கெட் இழப்பிற்கு 142ஓட்டங்களைப் பெற்றுக்ெகாண்டுள்ளது.
நரி கான்ட்ராக்டர் .
நிஷா கிருஷ்ணன், கணேஷ் வெங்கட்ராமின்  காதலுக்கு பெற்றோர் சம்மதம் தெரிவித்ததால்  நிச்சயதார்த்தம் நடந்துள்ளது.
குறித்த பகுதியிலிருந்து மக்கள் வௌியேற்றப்படும் சந்தர்ப்பத்தில் இத்தகைய தாக்குதல்கள் நடத்தப்படுவதாக கண்காணிப்பு அமைப்புகள் தெரிவிக்கின்றன.
இந்த விமானம் திட்டமிட்ட பயணப் பாதையிலிருந்து திரும்பி, மலாக்கா நீரிணை ஊடாக பயணித்ததாக மலேசிய விமானப் படை நேற்று தெரிவித்திருந்தது.
எனினும் விமானம் காணாமல் போன சம்பவத்திற்கு எந்தவொருவரும் இதுவரை உரிமைக்கோராத நிலையில், அது தொடர்பான மர்மம்  நீடிப்பதாக அவர் சுட்டிக்காட்டினார்.
களவாடப்பட்டதாக கூறப்பட்ட கடவுச் சீட்டில் பயணித்த இரண்டு ஈரான் இளைஞர்களுக்கும் பயங்கரவாத தொடர்புகள் எதுவும் இல்லை என தெரிவிக்கப்பட்டுள்ள பின்னணியில், அவர் இதனைக் கூறியுள்ளார்.
பிரான்ஸ் அணி வீரர்களை வாழ்த்துவதற்காக மில்லியன் கணக்கான மக்கள் பாரிஸ் நகரில் ஒன்றுகூடியதாக சர்வதேச ஊடகங்கள் செய்தி வெளியிட்டுள்ளன.
ஜனாதிபதி இமானுவேல் மெக்ரோன் இதனை அறிவித்துள்ளமை சிறப்பம்சமாகும்.
சந்தேகநபர்களிடமிருந்து துப்பாக்கிகள் மற்றும் கஞ்சா என்பன பறிமுதல் செய்யப்பட்டுள்ளதாக பொலிஸ் ஊடகப் பேச்சாளர் குறிப்பிட்டார்.
நாட்டை ஊடறுத்து குறிப்பாக, மத்திய மலைநாட்டின் மேற்கு சரிவான பிரதேசங்களிலும், தென் மாகாணத்திலும் நாட்டின் தென் பிராந்திய கடற்பகுதிகளிலும் அவ்வப்போது பலத்த காற்று வீசுமென வளிமண்டலவியல் திணைக்களம் குறிப்பிட்டுள்ளது.
சந்தேகநபர்கள் பயன்படுத்திய மோட்டார் சைக்கிள்கள், வாள்கள் உள்ளிட்ட ஆயுதங்களை பொலிஸார் கைப்பற்றியுள்ளனர்.
தோட்ட மக்களுக்களின் ஊழியர் சேமலாப நிதியை குறித்த நிதியத்துக்கு அனுப்பாமல் இருந்தமைக்கு எதிர்ப்பு தெரிவித்தே இந்த ஆர்ப்பாட்டம் முன்னெடுக்கப்பட்டதாக எமது பிராந்திய செய்தியாளர் குறிப்பிட்டார்.
செயற்பாடுகள் குறைவாக உள்ள தொழில் முயற்சிகள் மற்றும் குறைவான பயன்பாட்டையுடைய சொத்துக்களுக்கு புத்துயிர் அளிக்கும் சட்டத்தை நீக்கும் சட்டமூலம் இன்று பாராளுமன்றத்தில் நிறைவேற்றப்பட்டது.
உத்தேச அரசியலமைப்புத் திருத்தம் உள்ளிட்ட பல்வேறு விடயங்கள் தொடர்பில் இந்த சந்திப்பின்போது கலந்ரையாடப்பட்டதாக எதிர்க்கட்சித் தலைவரின் ஊடகப் பிரிவு தெரிவித்துள்ளது.
இதேவேளை, ஐக்கிய தேசிய முன்னணியின் முன்னாள் பாராளுமன்ற உறுப்பினர்கள் சிலர் தேசிய தேர்தல் ஆணைக்குழுவின் தலைவர் மஹிந்த தேசப்பிரியவை இன்று சந்தித்த பின்னர் அவர் ஊடகங்களுக்குக் கருத்துத் தெரிவித்தார்.
இந்த சத்தியப்பிரமாணத்திற்கான ஆசியினை சர்வமதத் தலைவர்கள் இன்று வழங்கினர்.
இதேவேளை “எமது பிள்ளைகளின் மகிழ்ச்சிக்காக” விழிப்புணர்வுத் திட்டத்திற்கு ஆசி பெற்றுக்கொள்ளும் நோக்கில் வரையறுக்கப்பட்ட கெப்பிட்டல் மகாராஜா நிறுவனத்தின் குழுமப் பணிப்பாளர் நீத்ரா வீரசிங்க உள்ளிட்ட குழுவினர் பேராயர் அதி. வணக்கத்திற்குரிய மெல்கம் கர்தினால் ரஞ்சித் ஆண்டகையை சந்தித்தனர்.
சுரங்கப் பாதை அமைக்கப்பட்டது.
, கத்தோலிக்க சிங்களவர்களுக்குமிடையில் கலவரம் வெடித்தது.
படைகள் வெளியேறின. .
சல்யூட் 4 விண்கலம் விண்ணுக்கு அனுப்பப்பட்டது.
300,000 பேர் வரை இறந்தனர்.
நகரில் எண்ணெய்க் குழாய் ஒன்று வெடித்ததில் 260 பேர் உயிரிழந்தனர்.
இது ஆறு மைல்கள் தள்ளித் .
