அடுத்துவரும் திருமணம்  அல்லது வெற்றிக் கட்டத்தில் நடுப்பகல்,கோடைக்காலம்,நாயகன் வானுறையும் தெய்வநிலையாதல்,புனிதமிக்க திருமணம், தேவலோகம் இவை பற்றிய தொன்மங்கள் காணப்படும்.
இன்பியலின் முல்லைநிலக் கவிதைகள் இதன் தொல்படிவமாகும்.
துரோகி,துயரம் பாடும் பாடகர் ஆகியோர் இதன் துணைநிலைமாந்தர்களாக உள்ளனர்.
சிதைவுக் கட்டத்தில் இருள் ,பனிக்காலம்,பேரிடர்கள்,மீீள் வருகை,தலைவனின்  தோல்வி  போன்ற உட்பண்புகள் உள்ளன.இதன்  தொல் படிமமாக எள்ளல் இலக்கியம் காணப்படுகிறது.பேய்,பிசாசு,சூனியக் காரர் ஆகியோர் இதன் துணைமாந்தர்களாக உள்ளனர்.
தொன்மம் ஒரு தலைவனை முன்னிறுத்தி உருவாக்கப்படுகிறது.அத்தலைவன் ஏதேனும் ஒரு புதுமையை நிறுவியவனாக இருப்பது வழக்கம்.பலவகைப்பட்டதாக அது காணப்படும்.
விஸ்வகர்மா, மயன் ஆகியோர் முறையே நிறுவிய புதிய நகரங்களான திரிகூடாசலம்,இந்திரப் பிரஸ்தம் ஆகியவை தொன்மங்களாக ஆக்கப்பட்டுள்ளன.
புத்தாக்க வாழ்க்கை முறைக்கு அடிகோலிய இடம்,சூழல்,மனிதர் ஆகியோர் தொன்ம உருவாக்கத்திற்குக் காரணமாகின்றனர்.
எனவே,கனவுகளோடு தொன்மங்கள் ஒப்பிடப்படுகின்றன.கனவு தனிமனிதனுடையது;தொன்மம் குறிப்பிட்ட சமுதாயக் கனவாகும்.
மனித ஆசையின் படிமங்களும் தொன்மங்களாகின்றன.இதற்கு ஓடிபஸ் தொன்மத்தை(Oedipus Myth) உதாரணமாகக் கொள்ளவியலும்.
பண்டைய தமிழ் மக்களின் இரும்பின் பயன்பாடுகள்(ஆயுதங்களுடைய நடுகற்கள்) .
Centers for Disease Control and Prevention, National Center for Health Statistics (நவம்பர் 2006).
Advocates for Youth (அக்டோபர் 2001).
World Prison Population List .
2007-06-28 அன்று பரணிடப்பட்டது.
Pew Report Finds More than One in 100 Adults are Behind Bars .
Pew Center on the States (2008-02-28).
2007-08-24 அன்று பரணிடப்பட்டது.
Media Statistics > Television Viewing by Country .
TV Fans Spill into Web Sites .
21 April 2012 அன்று பரணிடப்பட்டது.
Defining Life, Explaining Emergence .
20 December 2016 அன்று பரணிடப்பட்டது.
Seeding the Universe with Life: Securing Our Cosmological Future .
இங்கிலாந்தில் பெர்க்சைரில் உள்ள ஒரு மூடுதொட்டி .
எனினும் அவர் மாற்று தினம் ஒன்றை கோரி இருந்தார்.
அதேநேரம் எதிர்வரும் 20ஆம் திகதி யோசித்தவின் பாட்டியாரிடம் குறித்த காணி கொள்வனவுகள் குறித்த மேலதிக வாக்குமூலத்தைப் பெற்றுக்கொள்ள நிதிமோசடி குறித்த காவற்துறை விசாரணைப் பிரிவு நீதிமன்ற அனுமதியைப் பெற்றுள்ளது.
மட்டக்களப்பு – திராய்மடுப் பிரதேசத்தில் தொடரூந்தில் மோதி ஒருவர் உயிரிழந்தார்.
கொழும்பிலிருந்து மட்டக்களப்பு நோக்கி பயணித்த தொடரூந்த ஒன்றில் அவர் மோதுண்டுள்ளதாக காவற்துறையினர் தெரிவித்துள்ளனர்.
சைட்டம் நிறுவனம் தொடர்பில் மேன்முறையீட்டு நீதிமன்றம் வழங்கிய தீர்ப்புக்கு எதிராக மருத்துவ சபை, உயர் நீதிமன்றத்தில் தாக்கல் செய்த மனு இன்று விசாரணைக்கு எடுத்துக்கொண்ட போதே இது அறிவிக்கப்பட்டுள்ளது.
குழந்தை மகளிர் அதிகாரிகளால் மீட்கப்பட்டு அனுராதாபுரம் மருத்துவமனையில் ஒப்படைக்கபட்டுள்ளது.
குழந்தையில் தாய் நிசன்ஸலா கேகாலை பிரதேசத்தை சேர்ந்தவர்.
இவர் தற்போது ஸ்ரீ ஜயவர்தனபுர பல்கலைகழகத்தில் படிப்பதாகவும் அவர் தங்கியிருந்த வீட்டின் உரிமையாளர் தெரிவித்தார்.
கடந்த 2015ம் ஆண்டு ஜூன் மாதத்தில் தெஹிவளை கடற்பரப்பில் இந்த சம்பவம் இடம்பெற்றுள்ளதாக காவற்துறை தெரிவித்துள்ளது.
இந்த சம்பவம் தொடர்பில் தேசிய சிறுவர் பாதுகாப்பு அதிகார சபையின் சிறப்பு காவற்துறை விசாரணைப்பிரிவின் ஊடாக விசாரணைகள் ஆரம்பிக்கப்பட்டுள்ளன.
கொழும்பிலிருந்து மட்டக்களப்பிற்கு ஹெரோயின் போதைப் பொருளை கடத்தி விற்பனை செய்த ஐவர் விளக்கமறியலில் வைக்கப்பட்டுள்ளனர்.
மட்டக்களப்பு நீதவான் நீதிமன்றம் மற்றும் ஏறாவூர் சுற்றுலா நீதிமன்றங்களினால் அவர்கள் விளக்கமறியலில் வைக்கப்பட்டுள்ளனர்.
நுவரெலியா மாவட்டத்தில் 12  பிரதேச சபைகள் உருவாக்கப்பட வேண்டும் என்பதில் உறுதியாக இருப்பதாக தமிழ் முற்போக்கு கூட்டணியின் நாடாளுமன்ற உறுப்பினர் மயில்வாகனம் திலகராஜ் தெரிவித்துள்ளார்.
நுவரெலியா மாவட்டத்தில் உள்ளுராட்சி மன்றங்களை அதிகரிப்பது தொடர்பில் மத்திய மாகாண சபை செயலாளரின் தலைமையில் கலந்துரையாடல் ஒன்று இன்று இடம்பெற்றது.
இதேவேளை, நுவரெலியா மாவட்டத்தில் உள்ளுராட்சி மன்றங்களின் எண்ணிக்கையை அதிகரிப்பது தொடர்பில் தீர்மானங்களை நிறைவேற்றும்போது  தேசிய கொள்கைகளை கவனத்தில் எடுக்கும் அதேவேளை, நுவரெலியா மாவட்டத்தின் மலைப்பாங்கான புவியியல் நிலைமைகளும் கவனத்தில் கொள்ளப்படல் வேண்டும் என திலகராஜ் கோரிக்கை விடுத்துள்ளார்.
இதன் அடிப்படையிலேயே தற்போது அளவீடுகள் மேற்கொள்ளப்படுவதாக பொதுமக்கள் நம்பிக்கை வெளியிட்டுள்ளனர்.
இதன்போது, வவுனியா பேருந்து தரிப்பிட பிரச்சினைக்கு தீர்வுகாண முதலமைச்சர் உறுதியளித்ததாக வட இலங்கை தனியார் பேருந்து உரிமையாளர் சங்கத்தின் பிரதிநிதியொருவர் தெரிவித்தார்.
ஒருசிலர் பெருந்தோட்டங்களில் தொழில் புரியாவிட்டாலும் அவர்கள் பெருந்தோட்ட பகுதியிலேயே வாழ்ந்து வருகின்றார்கள்.
இந்த தீர்மானமானது எதிர்காலத்தில் கல்விமாணிப் பட்டம் வழங்கும் நோக்குத்துடனேயே மேற்கொள்ளப்பட்டுள்ளதாக கல்வி இராஜாங்க அமைச்சர் விளக்கமளித்துள்ளார் .
போர்ப் பயிற்சிக்கு ஜனாதிபதி மைத்திரிபால சிறிசேன வாழ்த்து தெரிவித்துள்ளார்.
இலங்கையின் முப்படையினர் மற்றும் 13 நாடுகளைப் பிரதிநிதித்துவப்படுத்தும் இராணுவத்தினரின் பங்கேற்புடன் இந்த போர்ப்பயிற்சி கடந்த 03 ஆம் திகதி ஆரம்பமானது.
மத்திய வங்கியின் பிணை முறி தொடர்பான விசாரணை ஆணைக்குழுவின் முன்னிலையில் இன்று சாட்சியம் வழங்கிய பெப்பர்ச்சுவல் நிறுவனத்தின் மேலாளர் கசுன் பலிசேன இந்தத் தகவலை வெளியிட்டார்.
மொஹமட் நஷீட் இலங்கையில் கால்பதிப்பாரானால் அவர் கைதுசெய்யப்படுவார் என இலங்கையிலுள்ள மாலைத்தீவிற்கான தூதுவர் மொஹமட் ஹூசைன் ஷரீப் இலங்கையின் ஊடகம் ஒன்றிடம் தெரிவித்திருந்தார்.
மருத்துவ சிகிச்சையின் பின்னர் அவர், பிரித்தானியாவில் அகதி அந்தஸ்த்தை கோரியிருந்தார்.
இந்திய பிரதமர் நரேந்திர மோடியின் பிறப்பிடமான குஜராத்தில் இந்த திட்டம் ஆரம்பித்துவைக்கப்பட்டுள்ளது.
இதற்காக 17 பில்லியன் அமெரிக்க டொலர்களை இந்தியாவிற்கு ஜப்பான் கடனாக வழங்கியுள்ளது.
வடகொரியா மற்றுமொரு ஏவுகணையை சோதித்துள்ளது.
இந்த ஏவுகணை மணிக்கு 770 கிலோமீற்றர் என்ற வேகத்தில் சுமார் 3ஆயிரத்து 700 கிலோமீற்றர் தூரம் வரையில் பயணித்ததாக கூறப்படுகிறது.
கடந்த மாதமும் இந்த தீவுக்கு மேலாக வடகொரியா தமது ஏவுகணை ஒன்றை பயணிக்கச் செய்திருந்தது.
மஹாவெலி அபிவிருத்தி மற்றும் சுற்றாடல் அமைச்சிற்காக புதிய கட்டிட தொகுதி ஒன்றை திறந்து வைக்கும் நிகழ்வில் ஜனாதிபதி இதனைக் குறிப்பிட்டுள்ளார்.
சப்ரகமுவ , மேல் மற்றும் மத்திய மாகாணங்களிலும் காலி மற்றும் மாத்தறை மாவட்டங்களிலும் விட்டு விட்டு மழை பெய்யக்கூடும் என வானிலை அவதான நிலையம் இன்று வௌியிட்ட செய்திக்குறிப்பில் குறிப்பிடப்பட்டுள்ளது.
மாலபே தனியார் மருத்துவ கல்லூரிக்கு எதிர்ப்பு தெரிவித்து சைட்டம் எதிர்ப்பு மக்கள் பேரணி, சகல மாவட்டங்களையும் உள்ளடக்கும் வகையில் ஆரம்பிக்கப்பட்ட வாகன பேரணி இன்று கொழும்பை வந்தடையவுள்ளது.
இதன்படி, இன்றைய தினம் புத்தளம், கம்பஹா, கேகாலை, கொழும்பு மற்றும் களுத்துறை ஆகிய மாவட்டங்களில் இந்த போராட்டம் முன்னெடுக்கப்படவுள்ளது.
அந்த நாட்டின் மருத்துவ சபை இந்த தீர்மானத்தை நேற்று அறிவித்தது.
இதுதொடர்பில் மாலபே தனியார் மருத்துவ கல்லூரி அறிக்கை ஒன்றை வெளியிட்டுள்ளது.
தான் கருவுற்றிருப்பது கூட தெரியாத சிறுமி இருந்திருந்துள்ளார், இதனை அறிந்த பெற்றோர் கருவை கலைக்க வேண்டும் என உச்சநீதிமன்றத்தில் வழக்கு தொடர்ந்தனர்.
இதில் குழந்தையின் டிஎன்ஏ, குற்றவாளியின் டிஎன்ஏவுடன் பொருத்தவில்லை என சோதனையின் மூலம் தெரியவந்துள்ளது.
குற்றவாளி தற்போது சிறையில் இருக்கிறார், நான் தான் இந்த தவறை செய்தேன் என அவர் தனது தரப்பில் ஒத்துக்கொண்டதாக பொலிசார் தெரிவித்துள்ளனர்.
தாங்கள் வேறு யாரையும் சந்தேகப்படவில்லை என்று பாதிக்கப்பட்ட சிறுமியின் தாய் இந்த வழக்கை விசாரிப்போரிடம் தெரிவித்திருக்கும் நிலையில், இந்த வழக்கு மிக வினோதமான திருப்பத்தை சந்தித்திருக்கிறது என்று அந்த அதிகாரி மேலும் கூறியுள்ளார்.
இந்த 10 வயது சிறுமி வயிற்றில் வலி ஏற்பட்டுள்ளதை தெரிவிக்க, பெற்றோர் அவரை மருத்துவமனைக்கு அழைத்துச் சென்றபோது, அவர் கர்ப்பமாக இருந்தது ஜூலை மாதத்தின் நடுவில் கண்டறியப்பட்டது.
கருவை கலைப்பது இந்த சிறுமிக்கு மிகவும் ஆபத்தானது என்று மருத்துவர் அமர்வு ஒன்று பரிந்துரைத்ததை தொடர்ந்து, அவர் கருத்தரித்து அதிக மாதங்கள் ஆகிவிட்டதை அடிப்படையாக வைத்து, கருக்கலைப்பு செய்ய கோரியதை சண்டிகரிலுள்ள உள்ளூர் நீதிமன்றம் ஒன்று மறுத்துவிட்டது.
விரைவில் அது தத்து கொடுக்கப்படும்.
தாக்குதலுக்கு ஐ.எஸ். தீவிரவாதிகள் பொறுப்பேற்றுள்ளனர்.
இதற்கான வர்த்தமானி அறிவிப்பு ஜனாதிபதியின் கைச்சாத்துடன் இந்த வாரம் வெளியாக்கப்பட்டுள்ளது.
இதையடுத்து, அலுவலகங்களை எந்தப் பகுதிகளில் நிறுவுவது என்பது தொடர்பான தீர்மானங்கள் மேற்கொள்ளப்பட்டு, அந்தப் பணிகள் முன்னெடுக்கப்படும் என்றும் அவர் குறிப்பிட்டுள்ளார்.
எனவே, அதில் சர்வதேச பிரதிநிதிகள் எவரும் உள்வாங்கப்பட மாட்டார்கள் என தேசிய கொள்கைகள் மற்றும் நல்லிணக்க அமைச்சின் செயலாளர் சுட்டிக்காட்டினார்.
காணாமல்போனோரை தேடுவதற்கான பொறிமுறையை உருவாக்குதல், அவர்கள் எவ்வாறான சூழ்நிலையில் காணாமல்போனார்கள்,  அவர்கள் தற்போது எந்த இடத்தில் இருக்கின்றனர் என்பது தொடர்பில் ஆராய்தல்,  இதுபோன்ற சம்பவங்களை எதிர்காலத்தில் குறைப்பதற்கான பரிந்துரைகளை முன்வைத்தல் என்பவற்றை அடிப்படையாகக் கொண்டே இந்தப் பணியகம் இயங்கும்.
விபத்தில் காயமடைந்த அதிகாரிகள் தற்போது மருத்துவமனையில் சிகிச்சை பெற்று வருகின்றனர்.
தெரேசா மேயின் யோசனைக்கு, ஆளுங்கட்சியான கன்சர்வேட்டிவ் கட்சியின் உறுப்பினர்கள் பலரும் எதிராக வாக்களிக்கவிருப்பதாக கூறப்படுகிறது.
இதற்காக அவர் ப்ரசல்ஸ் செல்வதற்காக, விமானப்படை விமானம் ஒன்று தயார் செய்யப்பட்டுள்ளதாகவும் கூறப்படுகிறது.
இதேவேளை இன்றையதினம் நாடாளுமன்றில் இடம்பெறும் வாக்கெடுப்பில் தோல்வி ஏற்படும் பட்சத்தில், தெரேசா மே பிரதமர் பதவியில் இருந்து விலகுவதற்கான வாய்ப்புகள் இருப்பதாகவும் தகவல்கள் வெளியாகி இருக்கின்றன.
குறித்த விபத்து பனாகொட இராணுவ முகாமின் முன்னால் இடம்பெற்றுள்ளது.
கடந்த ஆண்டு செப்டம்பர் மாதம் 30ம் திகதி வரையில், ஆயிரத்து 22 வெளிநாட்டவர்கள் அமெரிக்காவிற்குள் பிரவேசித்துள்ளனர்.
பயணிகள் இன்றி குறித்த தொடரூந்து இந்த பயணத்தில் ஈடுபட்டுள்ளது.
சுற்றுலா அபிவிருத்தி அமைச்சு இதனைத் அறிவித்துள்ளது.
அனுமதி சீட்டுகளைப் பெற்றுக் கொள்வதற்காக சரணாலயங்களுக்கு முன்னால் சுற்றுலாப் பயணிகள் அதிக நேரம் காத்திருக்க நேருகின்றது.
குறிப்பாக யாழ சரணாலயத்தை பார்வையிடுவதற்கு, அதிகாலை 4.30ல் இருந்தே வெளிநாட்டு சுற்றுப் பயணிகள் காத்திருந்து வந்துள்ளமை தெரியவந்துள்ளது.
இதேவேளை அனுராதபுரம் பிள்ளையார் கோயின் அருகாமையில் பாரவூர்தி ஒன்று உந்துருளி ஒன்றுடன் மோதுண்டுள்ளது.
மலேரியா நோய் மீண்டும் பரவுவதற்கான அறிகுறிகள் உள்ளதாக சுகாதார அமைச்சு எச்சரித்துள்ளது.
கடந்த டிசெம்பர் மாதம் முதல் வாரக்காலப்பகுதியில் சியம்பலாண்டுவ பிரதேசத்தில் மலேரியா நோய் தொற்றுக்குள்ளான ஒருவர் அடையாளம் காணப்பட்டார்.
பின்னர் அவர் இந்தியாவில் இருந்து இலங்கைக்கு வந்தமை தெரியவந்தது.
நேற்று இடம்பெற்ற அமைச்சரவை கூட்டத்தில் வைத்து ஜனாதிபதி இதனை தெரிவித்ததாக, அமைச்ச மனோ கணேசன் எமது செய்தி பிரிவிடம் தெரிவித்துள்ளார்.
