இதுதவிர சுத்தமான குடிநீர் மற்றும் போதிய உணவு அற்ற நிலையில், தொற்று நோய்கள் பரவுவதற்கான அறிகுறிகள் தென்படுவதாக மருத்துவதரப்பினர் எச்சரித்துள்ளனர்.
குறித்த பிரேரணை இன்றைய தினம் பேரவையில் சமர்ப்பிக்கப்பட்டது.
மனித உரிமைகள், மறுசீரமைப்பு மற்றும் பொறுப்புக்கூறலை விரிவுப்படுத்தல் என்ற தலைப்பிலான இந்த பிரேரணையின் ஊடாக, 2015ம் ஆண்டு ஜெனீவா மனித உரிமைகள் மாநாட்டில் நிறைவேற்றப்பட்ட பிரேரணையின் பரிந்துரைகளை அமுலாக்குவதற்கு இலங்கைக்கு மேலதிக கால அவகாசம் வழங்கப்படுகிறது.
அறிக்கையொன்றை வெளியிட்டு ஜனாதிபதி ஊடகப் பிரிவு இதனை குறிப்பிட்டுள்ளது.
ஆரம்ப கைத்தொழில், சமூக வலுவூட்டல் மற்றும் விஷேட பிரதேசங்களுக்கான அபிவிருத்தி ஆகிய அமைச்சுகள் தொடர்பாக நாடாளுமன்றத்தில் இடம்பெற்ற, பாதீட்டு விவாதத்தில் கலந்து கொண்டு உரையாற்றிய போதே அவர் இதனை குறிப்பிட்டுள்ளார்.
இந்த சந்திப்பில் ஜே வி பி யை அங்கத்துவப்படுத்தும் வகையில் அதன் தலைவர் அநுரகுமார திஸாநாயக்க, நாடாளுமன்ற உறுப்பினர்களான விஜித்த ஹேரத், சுனில் ஹத்துனெத்தி ஆகியோர் கலந்து கொள்ளவுள்ளனர்.
இதற்கமைய உயர் தர மாணவர்களுக்கான தகவல் தொழிநுட்ப பரீட்சை மார்ச் மாதம் 11 ஆம் திகதி தொடக்கம் 18 ஆம் திகதி வரை இரு அமர்வுகள் மூலம் நடத்தப்படவுள்ளதாக அத் திணைக்களம் தெரிவித்துள்ளது.
குறித்த பிரேரணை நேற்றைய தினம் பேரவையில் சமர்ப்பிக்கப்பட்டது.
மனித உரிமைகள், மறுசீரமைப்பு மற்றும் பொறுப்புக்கூறலை விரிவுப்படுத்தல் என்ற தலைப்பிலான இந்த பிரேரணையின் ஊடாக, 2015ம் ஆண்டு ஜெனீவா மனித உரிமைகள் மாநாட்டில் நிறைவேற்றப்பட்ட பிரேரணையின் பரிந்துரைகளை அமுலாக்குவதற்கு இலங்கைக்கு மேலதிக கால அவகாசம் வழங்கப்படுகிறது.
மன்னார் மனித புதைக்குழியில் தொடர்ந்தும் அகழ்வு பணிகளை முன்னெடுப்பதா? அல்லது முற்றாக நிறுத்துவதா? என்பது தொடர்பான இறுதி தீர்மானம் இன்று மேற்கொள்ளப்படவுள்ளது.
இந்த கலந்துரையாடலில் மன்னார் மனித புதைக்குழியில் அகழ்வு பணிகளை மேற்கொண்ட விஷேட மருத்துவர்கள் உள்ளிட்ட பணியாளர்கள் கலந்துக் கொள்ளவுள்ளனர்.
இதுதவிர, காணாமல் ஆக்கப்பட்டோருக்கான அலுவலகத்தின் பணியாளர்கள், காணாமல் ஆக்கப்பட்டவர்களின் உறவினர்கள் இந்த கலந்துரையாடலில் பங்கேற்கவுள்ளனர்.
ஈராக் உள்துறை அமைச்சு இதனை தெரிவித்துள்ளது.
இதுதவிர 55 பேர் மீட்கப்பட்டுள்ளதாகவும் ஈராக் உள்துறை அமைச்சு தெரிவித்துள்ளது.
வெளிநாட்டு ஊடகங்கள் இதனை தெரிவித்துள்ளன.
வெளிநாட்டு ஊடகங்கள் இதனை தெரிவித்துள்ளன.
அவரது உடலில் தீக்காயங்கள் காணப்பட்டதாகவும் தெரிவிக்கப்பட்டுள்ளது.
கடந்த வாரம் இடம்பெற்ற இந்த தீவிரவாதத் தாக்குதலில் 50 பேர் கொல்லப்பட்டதுடன், பலர் காயமடைந்துள்ளனர்.
வெளிநாட்டு ஊடகங்கள் இதனை தெரிவித்துள்ளன.
கொழும்பிலிருந்து போதை பொருள் பைக்கற்றுக்களை பேருந்து மூலம் எடுத்து சென்று கனமுலை பகுதிக்கு விற்பனை செய்தவற்காக முச்சக்கர வண்டி ஒன்றில் சென்றுக்கொணடிருந்த போதே இவர்கள் கைது செய்யப்பட்டுள்ளனர்.
கைது செய்யப்பட்ட குறித்த நபரிடமிருந்து குடு என அழைக்கப்படும் போதை பொருள் 3 கிராம், 5 கிராம் அய்ஸ், ஹஷீஷ் 15 கிராம் மற்றும் டிஜிட்டல் தராசு ஆகியவற்றை காவல் துறையினர் மீட்டுள்ளனர்.
மத்திய மலைநாட்டின் நீரேந்தும் பகுதிகளில் நிலவும் வறட்சியான வானிலை காரணமாக செயற்கை மழையை ஏற்படுத்தும் செயற்திட்டம் இன்று ஆரம்பமாகவுள்ளது.
அந்த விமானம் மூலம் மஸ்கெலியாவை அண்மித்த பகுதியில் இரசாயன பொருட்கள் தூவப்படவுள்ளன.
அவர் இன்றைய தினம் கொழும்பு பிரதான நீதவான் லங்கா ஜயரத்ன முன்னிலையில் பிரசன்னப்படுத்தப்பட்டார்.
இதனை அடுத்து குற்றம் சுமத்தப்பட்டுள்ள அமைச்சர் றிசாட் பதியுதீன் உரையாற்றும் போது, யுத்தம் நிறைவடைந்து மெனிக்ஃபார்மில் தங்கி இருந்த 3 லட்சம் மக்களை மீள்குடியேற்றுவதற்காக காணிகள் கோரப்பட்டதாக கூறினார்.
இதற்காக ஒதுக்கப்பட்ட காணிகளில் உடனடியாக குடியேற்றம் இடம்பெறவில்லை என்றும், அதனால் மரங்கள் வளர்ந்துவிட்ட நிலையில், 2012ம் ஆண்டு அந்த காணிகள் வனவளத்துறைக்கு மாற்றப்பட்டு வர்த்தமானி வெளியிடப்பட்து.
இதன்பின்னர் உரையாற்றிய அமைச்சர் லக்ஷ்மன் கிரியல்ல இடம்பெயர்ந்த முஸ்லிம்களை குடியேற்றுவதற்கான காணி ஒதுக்கக் கோரியபோது அதனை அனுமதித்ததாகவும், ஆனால் முஸ்லிம்களின் எண்ணிக்கை அதிகரித்திருப்பதால், மேலதிகமாக காணிகளை வழங்குமாறு கோரப்பட்டதாகவும், அதனை தாம் நிராகரித்ததாகவும் கூறினார்.
இந்த மனுவை எதிர்வரும் ஜுன் மாதம் 28ம் திகதி விசாரணை செய்வதாக நீதிமன்றம் முடிவு செய்தது.
கொழும்பில் இருந்து குப்பைக் கூளங்களைக் கொண்டுவந்து அருவாக்காட்டில் கொட்டுவதற்கு அரசாங்கம் மேற்கொள்ளும் முயற்சிக்கு தாங்கள் எதிர்ப்பை வெளியிடுவதாக அவர்கள் அறிவித்தனர்.
கண்டியில் இடம்பெற்ற ஊடகவியலாளர் சந்திப்பில் கலந்து கொண்டு உரையாற்றிய போதே அவர் இதனை குறிப்பிட்டுள்ளார்.
இதனிடையே குறுக்கிட்ட அமைச்சர் பீ ஹெரிசன், நெற் களஞ்சியத்திற்கான அனைத்து ஏற்பாடுகளும் செய்யப்பட்டுள்ளதோடு, விலைக்கு நெல் கொள்வனவு செய்வதற்கான முயற்சிகளையும் அரசாங்கம் மேற்கொண்டுள்ளதாக தெரிவித்தார்.
இதற்கமைய அமெரிக்க டொலர் ஒன்றின் விற்பனை பெறுமதி 179 ரூபா 78 சதமாக காணப்பகின்றது.
நாட்டுக்காக ஒன்றாய் இருப்போம் என்ற தொனிப்பொருளில் புத்தளம் மாவட்டத்தில் வேலைத்திட்டத்தை ஆரம்பித்து வைத்து உரையாற்றும் போது அவர் இதனைக் கூறியுள்ளார்.
பில்லியன் கணக்கான பாதீட்டு இடைவெளியை தணிப்பதற்கு நாம் அனைவரும் முக்கியமான விடயங்களை மேற்கொள்ள வேண்டியுள்ளது.
பொதுமக்கள், பாதுகாப்பு தரப்பினர், அரச அதிகாரிகள் என்று பலரும் இந்த விடயத்தில் ஒன்றிணைய வேண்டும் என்று அவர் கூறியுள்ளார்.
இதேவேளை, இன்று இரவு வேளையில் சப்ரகமுவ, மத்திய மற்றும் ஊவா மாகாணங்களில் இடியுடன் கூடிய மழையுடன், மணிக்கு 70 முதல் 80 கிலோ மீற்றர் வரை குறுகிய நேரத்திற்கு காற்று வீசக்கூடும் என வளிமண்டலவியல் திணைக்களம் மேலும் குறிப்பிட்டுள்ளது.
ஏனைய சந்தேக நபர்கள் ஆணமடுவை பகுதியை சேர்ந்த 22, 25 மற்றும் 52 வயதிற்கும் உட்பட்டவர்கள் என தெரியவந்துள்ளது.
கொழும்பில் இன்று இடம்பெற்ற நிகழ்வொன்றில் வைத்து அவர் இதனைக் குறிப்பிட்டுள்ளார்.
இந்தக் கலந்துரையாடலில் ஜே.வி.பியை பிரதிநிதித்துவப்படுத்தி, அதன் தலைவரான நாடாளுமன்ற உறுப்பினர் அநுரகுமார திஸாநாயக்க மற்றும் நாடாளுமன்ற உறுப்பினர் விஜித்த ஹேரத் ஆகியோர் பங்கேற்றுள்ளனர்.
இதற்கமைய, இன்றைய பேச்சுவார்த்தையில், நிறைவேற்று அதிகார ஜனாதிபதி முறைமையை நீக்குவதற்கான நடவடிக்கையில் சாதகமான நிலைமை இருந்ததாவும் அவர் குறிப்பிட்டுள்ளார்.
வரக்காபொலவில் இடம்பெற்ற போதைப்பொருள் வேலைத்திட்டத்தில் கலந்து கொள்வதற்காக சென்ற வேளை, கடந்த 22 ஆம் திகதி சட்டவிரோத மதுபான வர்த்தகரால் அவர் கத்திக்கு உள்ளாகியுள்ளார்.
தம்புள்ளையில் இன்று இடம்பெற்ற நிகழ்வொன்றில் வைத்து அவர் இதனைக் குறிப்பிட்டுள்ளார்.
துப்பாக்கி சூட்டில் காயமடைந்து மருத்துவமனையில் அனுமதிக்கப்பட்டிருந்த பெலியத்த பிரதேச சபையின் எதிர்கட்சி தலைவர் கபில பிரியதர்ஷன அமரகோன் இன்று காலை உயிரிழந்தார்.
கராப்பிட்டி மருத்துவமனையில் சிகிச்சை பெற்று வந்த அவர் இன்று காலை மரணித்திதாக வைத்தியசாலைத் தரப்பினர் தெரிவித்துள்ளனர்.
கடந்த புதன்கிழமை பல்லத்தர - மொரதவான பகுதியில் உள்ள தமது வீட்டில் வைத்து அவர் துப்பாக்கி சூட்டுக்கு இலக்கானார்.
இந்த நிலையில், குறித்த துப்பாக்கி ஊடாக பெலியத்தை பிரதேச சபையின் எதிர்க்கட்சித் தலைவர் தன்னைத் தானே சுட்டுக்கொண்டிருக்கலாம் என காவல்துறையினர் சந்தேகம் வெளியிட்டுள்ளனர்.
குடும்ப முரண்பாடு ஒன்றினால் நீதிமன்றில் உள்ள வழக்கு ஒன்றின் காரணமாக பெலியத்தை பிரதேச சபை எதிர்க்கட்சித் தலைவர், கலக்கம் அடைந்திருந்தார் என விசாரணைகளில் கண்டறியப்பட்டுள்ளதாகவும் காவல்துறையினர் குறிப்பிட்டுள்ளனர்.
இதனை அடுத்து குற்றம் சுமத்தப்பட்டுள்ள அமைச்சர் றிசாட் பதியுதீன் உரையாற்றும் போது, யுத்தம் நிறைவடைந்து மெனிக்ஃபார்மில் தங்கி இருந்த 3 லட்சம் மக்களை மீள்குடியேற்றுவதற்காக காணிகள் கோரப்பட்டதாக கூறினார்.
இதற்காக ஒதுக்கப்பட்ட காணிகளில் உடனடியாக குடியேற்றம் இடம்பெறவில்லை என்றும், அதனால் மரங்கள் வளர்ந்துவிட்ட நிலையில், 2012ம் ஆண்டு அந்த காணிகள் வனவளத்துறைக்கு மாற்றப்பட்டு வர்த்தமானி வெளியிடப்பட்து.
இதன்பின்னர் உரையாற்றிய அமைச்சர் லக்ஷ்மன் கிரியல்ல இடம்பெயர்ந்த முஸ்லிம்களை குடியேற்றுவதற்கான காணி ஒதுக்கக் கோரியபோது அதனை அனுமதித்ததாகவும், ஆனால் முஸ்லிம்களின் எண்ணிக்கை அதிகரித்திருப்பதால், மேலதிகமாக காணிகளை வழங்குமாறு கோரப்பட்டதாகவும், அதனை தாம் நிராகரித்ததாகவும் கூறினார்.
இது தமிழர்களுக்கு கிடைத்த பொற்காலம் ஆகும்.
30 வருட யுத்தத்தில் தமிழர்கள் அரசியல் மீது வெறுப்புற்றிருக்கின்றனர்.
ஆடவர் அணியின் இறுதிப் போட்டி இந்தியா அணியுடன் நடைபெற்றது அதில் இலங்கை அணி வெள்ளி பதக்கத்தை வென்றது.
இந்த விவகாரத்தால் நேற்றுமுன்தினம் பாராளுமன்றம் முடங்கியது.
எதிர்க்கட்சி உறுப்பினர்கள் தொடர் அமளியால் அடுத்தடுத்து அவை ஒத்திவைக்கப்பட்டது.
குறிப்பாக காங்கிரஸ் எம்.எல்.ஏக்கள் கடும் அமளியில் ஈடுபட்டனர்.
இதன்படி அமெரிக்கப் படைகள், பெண்டகன் ஊழியர்கள் மற்றும் அதனுடன் தொடர்புடைய அமைப்புகள், நிறுவனங்கள், தளபதிகள் மற்றும் சுலைமானியின் வீர மரணத்திற்கு உத்தரவிட்டவர்கள் தீவிரவாதிகள் என்று அறிவிக்கப்பட்டுள்ளது.
“இந்தப் படைகளுக்கு இராணுவ, உளவு, நிதி, தொழில்நுட்ப, சேவைகள் மற்றும் ஏற்பாடுகள் உட்பட எந்த ஒரு உதவியையும் வழங்குபவர்கள் தீவிரவாதத்திற்கு உதவுபவர்களாக கருதப்படுவார்கள்” என்று ஈரான் பாராளுமன்றம் குறிப்பிட்டது.
இந்த சட்டமூலம் பாராளுமன்றத்தில் நிறைவேற்றப்பட்டதை அடுத்து எம்.பிக்கள் அனைவரும் “அமெரிக்கா ஒழிக” என்று கோசம் எழுப்பினர்.
சுலைமானி தலைமை வகித்த ஈரானிய புரட்சிக் காவல் படையின் வெளிநாட்டு நடவடிக்கை பிரிவுக்கு 170 மில்லியன் பௌண்ட்கள் நிதி ஒதுக்குவதற்கும் பாராளுமன்றம் ஒப்புதல் அளித்துள்ளது.
அவ்வணி சார்பாக ஆரம்பத்துடுப்பாட்ட வீரர்களாக போர்ன்ஸ் மற்றும் ஜேக்கின்ஸ் ஆகியோர் களமிறங்கினர்.ஜேக்கின்ங்ஸ் ஒரு ஓட்டம் பெற்ற நிலையில் ஆட்டமிழந்து சென்றார்.
ஸ்டோர்க்ஸ் இருவரும் ஆடிய போது ஸ்டோர்க்ஸ் 19 ஓட்டங்களுடன் ஆட்டமிழந்து சென்றார்.
இலங்கை அணியின் தலைவர் தினேஷ் சந்திமால் உபாதை காரணமாக இரண்டு வாரங்களுக்கு அணியில் இருந்து விலகியுள்ள நிலையில், அணித் தலைவராக அனுபவ வேகப்பந்து வீச்சாளர் சுரங்க லக்மால் செயற்படுகிறார்.
இதற்கு அவர் எதிர்ப்பை வெளியிட்டுள்ளார்.
இந்த சட்டமூலத்தில் கைச்சாத்திடுவதா, இல்லையா என்பது குறித்து ஜனாதிபதி இன்னும் முடிவு எடுக்கவில்லை என்று வெள்ளை மாளிகையின் புதிய தகவல்தொடர்பு இயக்குனர் குறிப்பிட்டுள்ளார்.
அமெரிக்க தேர்தலில் ரஷ்யா தலையிட்டதான குற்றச்சாட்டுக்கு தண்டனை வழங்கும் வகையிலேயே இந்த சட்டமூலம் கொண்டுவரப்பட்டுள்ளது.
ரஷ்யா விடயத்தில் டிரம்பின் நிலைப்பாடு எப்படி இருந்தபோதும் ரஷ்யா மீதான கடும் நிலைப்பாட்டை தொடரும் வகையில் புதிய சட்டத்திற்கு அமெரிக்க கொங்கிரஸின் குடியரசு மற்றும் ஜனநாயக கட்சிகளுக்கு இடையில் கடந்த சனிக்கிழமை இணக்கம் ஏற்பட்டது.
இந்த சட்டமூலத்தை ஜனாதிபதியால் நிராகரிக்க அதிகாரம் உள்ளபோதும் அவ்வாறு அவர் நடந்துகொண்டால் ரஷ்யாவுடன் அவரின் தொடர்பு பற்றிய சந்தேகத்தை வலுப்பெறச் செய்யும்.
