(syntax), எவ்வாறு சொற்கள் சேர்ந்து இலக்கணத்துக்குட்பட்ட வசனங்களை உருவாக்குகின்றன என்பதை ஆராயும் துறை; .
(stylistics), மொழியின் பாணிகளை ஆராயும் துறை; .
அமெரிக்கப் பல்கலைக்கழகங்களில், வரலாறல்லாத நோக்கின் கையே ஓங்கியுள்ளதாகத் தெரிகிறது.
அவர் கூறும் வகையில், மத்திய வங்கி விதிக்கும் விதிமுறைகள் மற்றும் ஏனைய விடயங்களை இந்த கொடுக்கல் வாங்கலில் மக்கள் வங்கி பின்பற்றியுள்ளது.
மத்திய வங்கி ஆளுநராக செயற்பட்ட அர்ஜூன மகேந்திரனின் மருமகனின் நிறுவனத்திற்கு நன்மை கிட்டும் வகையில் கொடுக்கல் வாங்கல் இடம்பெற்றதாக ஜனாதிபதி ஆணைக்குழுவில் வௌிக்கொணரப்பட்டது.
எதிர்வரும் ஒக்டோபர் மாதம் மீண்டும் கூட்டு ஒப்பந்தம் கைச்சாத்திடப்பட வேண்டியுள்ளது.
இவ்வாறான பொறுப்பற்ற தீர்மானங்களை மேற்கொள்ளும் முன்னர், நேட்டோ அமைப்பின் முக்கிய உறுப்பினராக நீடிப்பதா அல்லது அதன் நட்பு நாடுகளின் பாதுகாப்புக்கு அச்சுறுத்தலாக விளங்குவதா என்பது குறித்து துருக்கி தீர்மானங்களை மேற்கொள்ள வேண்டும் என அமெரிக்க துணை ஜனாதிபதி மைக் பென்ஸ் தெரிவித்துள்ளார்.
தற்போது கமரா தொழில்நுட்பம் முன்னேற்றம் அடைந்துள்ளது.
இப்போது உயர் தரமான புகைப்படங்களை ப்ளாஷ் இல்லாமல் கூட எடுக்க முடியும் என்ற நிலை உருவாகிவுள்ளது.
இதுமட்டுமன்றி ‘உங்கள் வெள்ளை மாளிகை அனுபவத்தை பகிர்ந்து கொள்ள #WhiteHouseTour to share your experience என்ற ஹேஸ்டேகை பயன்படுத்துமாறும் கேட்டுகொள்ளப்பட்டுள்ளனர்.
இந்திய அணி இந்த தொடரில் தொடர்ச்சியாக இரண்டாவது தோல்வியை சந்தித்துள்ள நிலையில்., இறுதிப் போட்டிக்கு அந்த அணி தகுதி பெறும் வாய்ப்பு கேள்விக்குறியாகியுள்ளது.
டாக்காவில் நடைபெற்ற இந்தப் போட்டியில்  246 ஓட்டங்கள் என்ற வெற்றியிலக்கை நோக்கி பதிலுக்கு துடுப்பெடுத்தாடி  பாகிஸ்தான் அணி 49 தசம் 4 ஒவர்களில் 9 விக்கெட் இழப்பிற்கு 249 ஒட்டங்களைப் பெற்று வெற்றிபெற்றது.
போட்டியில் வெற்றிபெறுவதற்கு இறுதி ஒவரில் 10 ஓட்டங்களைப் பெற வேண்டிய நிலையில், ஒன்பதாவது விக்கெட்டையும் பாகிஸ்தான் இழந்த போதிலும், ஷஹீட் அப்ரிடி அடுத்தடுத்த இரண்டு சிக்ஸர்களை விளாசி அணியின் வெற்றியை உறுதிசெய்தார்.
[quote]என்னுடன் இருக்கும் அனைவரும் இவ்வாறு தாக்கப்படுவார்கள் அல்லது சிறைக்குச் செல்ல நேரிடும் அல்லது FCIDக்கு செல்ல நேரிடும்.
ஊடகங்கள் மஹிந்த ராஜபக்ஸவுடையது என்பது எமக்குத் தெரியும் என கூறுகின்றனர்.
100 கிராம் பெறுமதியான 20 தங்க பிஸ்கட்டுக்கள் சந்தேகநபரிடமிருந்து கைப்பற்றப்பட்டுள்ளதாக பொலிஸார் கூறினர்.
கண்டி தெய்யன்வல பகுதியைச் சேர்ந்த 46 வயதான ஒருவரே கைது செய்யப்பட்டுள்ளதுடன், சுங்கப் பிரிவினர் விசாரணைகளை மேற்கொண்டு வருகின்றனர்.
பக்தாத்தில் உள்ள அமெரிக்க தூதரகத்தின் முன்றலில் 1000 இற்கும் அதிகமானோர் ஆர்ப்பாட்டத்தில் ஈடுபட்டுள்ளனர்.
அமெரிக்கப் படையினர் ஆர்ப்பாட்டக்காரர்கள் மீது கண்ணீர்ப்புகைப் பிரயோகம் மேற்கொண்டுள்ளனர்.
ஈராக் மற்றும் சிரியாவிலுள்ள கட்டைப் ஹெல்புல்லா ஆயுதக்குழுவின் தளங்கள் மீது நேற்று முன்தினம் நடத்தப்பட்ட வான் தாக்குதல்களில் 25 போராளிகள் கொல்லப்பட்டனர்.
அமெரிக்காவின் இந்தத் தாக்குதல் நடவடிக்கையை கண்டித்து இந்த ஆர்ப்பாட்டம் முன்னெடுக்கப்பட்டுள்ளது.
ஈராக்கில் கடந்த வௌ்ளிக்கிழமை நடத்தப்பட்ட தாக்குதலொன்றில் அமெரிக்க சிவில் ஒப்பந்தக்காரர் கொல்லப்பட்டமைக்கு பதிலளிக்கும் வகையில் இந்த வான் தாக்குதல் நடத்தப்பட்டதாக அமெரிக்கா தெரிவித்துள்ளது.
ஈராக்கின் இறைமையைப் பாதிக்கும் வகையில் அமெரிக்காவால் தாக்குதல் நடத்தப்பட்டுள்ளதாகவும் அவர் கூறியுள்ளார்.
இந்த குற்றச்செயல்களுடன் ஐந்து இந்தியர்கள் தொடர்புபட்டுள்ளதுடன் அவர்களுக்கு சிறைதண்டனையும் சாட்டையடி தண்டனையும் விதிக்கப்பட்டுள்ளது.
இந்த வழக்கில் குறுதிப் பணம் வழங்குவதன் மூலம் குற்றவாளிகள் மன்னிப்பு கோர முடியாது என ஐந்து நீதிபதிகள் அடங்கிய நீதிபதிகள் குழாம் தீர்மானித்துள்ளதாகவும் அரபு செய்தி சேவை தெரிவித்துள்ளது .
உண்மையான புள்ளிவிபரங்கள் நாட்டிற்கோ மக்களுக்கோ வெளிக்கொணரப்படாததுடன், இது சிறிது காலமாக வரவு செலவுத் திட்டத்தின் போது இடம்பெறும் விளையாட்டு எனவும் அவர் சுட்டிக்காட்டியுள்ளார்.
எனினும், பாரிய இடைவெளிகளுடன் இவ்வாறான நிலை தோன்றாது எனவும் அவர் சுட்டிக்காட்டியுள்ளார்.
அமைச்சர்கள் மாற்றமடையும் போது, நீக்கப்படும் சில வாகனங்கள் குறைந்தபட்சம் 6, 7 மாதங்களேனும் பயன்படுத்தப்படுவதில்லை எனவும், புதிய வாகனமொன்று புதிய அமைச்சருக்கு கிடைத்தவுடன் பழைய வாகனத்திற்கு என்ன நடந்தது என்பது எவரும் அறியாதவொன்று எனவும் அரச நிதி செயற்குழு இனங்கண்டுள்ளது.
தமிழீழ விடுதலைப் புலிகளின் திருகோணமலை மாவட்ட அரசியல்துறைப் பொறுப்பாளர் எழிலன் எனப்படும் சின்னத்துரை சசிதரன் உள்ளிட்ட 12 பேரும் இராணுவத்திடம் சரணடைந்ததன் பின்னர் காணாமற்போகச் செய்யப்பட்டதாக இந்த ஆட்கொணர்வு மனுவில் தெரிவிக்கப்பட்டுள்ளது.
ஐக்கிய தேசியக் கட்சியைப் பிரதிநிதித்துவப்படுத்தும் பாராளுமன்ற உறுப்பினர்களுக்கு இடையிலான சந்திப்பு இன்று அலரிமாளிகையில் நடைபெறவுள்ளது.
பாராளுமன்றத்தில் பெரும்பான்மை உள்ளதென்பதை மஹிந்த ராஜபக்ஸ நிரூபிக்க வேண்டும் என்பதே ஐக்கிய தேசிய முன்னணியின் ஒரே நிலைப்பாடாகும்.
அவர் புதிதாக பிரதமர் பதவியை ஏற்றவர்.
2016 ஆம் உலக மருத்துவ ஆய்வுகூட தினத்தை முன்னிட்டு ஏற்பாடு செய்யப்பட்டிருந்த நிகழ்வில் கலந்துக் கொண்ட போதே ஜனாதிபதி இந்த விடயத்தை குறிப்பிட்டுள்ளார்.
மக்கள் சக்தி இல்லங்கள் தோறும் செயற்றிட்டம் இன்று வெற்றிகரமாக முன்னெடுக்கப்பட்டது.
கிளிநொச்சி மாவட்டத்தின் பூநகரி பிரதேச செயலகத்திற்குட்பட்ட இரணை மாதா நகர் மற்றும் நாச்சிக்குடா பகுதிகளுக்கும் மக்கள் சக்தி இல்லங்கள் தோறும் குழுவினர் இன்று சென்றிருந்தனர்.
அத்தோடு, இலங்கை தூதரகத்தை புனர்நிர்மாணிப்பதற்கு ஒதுக்கப்பட்ட நிதியை அவர் எடுத்துக்கொண்டமை விசாரணைகளில் கண்டறியப்பட்டுள்ளதாக பொலிஸ் நிதிக்குற்ற விசாரணைப் பிரிவினர் நீதிமன்றத்திற்கு அறிக்கை சமர்ப்பித்துள்ளனர்.
பொது நலனுக்காக அவர்கள் கட்சி வேறுபாடுகளுக்கு அப்பால் ஒன்று சேர்ந்தது மக்களைக் கவர்ந்தது.
இருந்தபோதும், இந்த நிகழ்ச்சியில் பங்கேற்றவர்களுக்கு தன் மனம் நிறைந்த பாராட்டுகளைத் தெரிவித்து செய்தி வெளியிட்டிருந்தார்.
இந்த நிகழ்வில் வடமாகண விவசாய அமைச்சர், மற்றும் மாகாண சபை உறுப்பினர்கள் உள்ளிட்ட பலர் கலந்து கொண்டனர்.
நீர்கொழும்பு பிராந்திய குற்றப்புலனாய்வுப் பிரிவு அதிகாரிகளினால் முன்னெடுக்கப்பட்ட சுற்றிவளைப்பின்போது ஒரு கிலோ 8 கிராம் நிறையுடைய ஹெரோயினுடன் கைது செய்யப்பட்ட ஒருவருக்கு உதவிய குற்றச்சாட்டின் பேரில் இவர் கைது செய்யப்பட்டுள்ளார்.
சீரற்ற வானிலையை அடுத்து கொழும்பு நகர் மற்றும் அதனை அண்மித்த பல பகுதிகளில் வாழும் மக்கள் பாரியளவில் பாதிக்கப்பட்டுள்ளனர்.
அவர்களைத் தேடி மக்கள் சக்தி குழுவினர் இன்றும் பயணித்திருந்தனர்.
வௌ்ளத்தினால் பாதிக்கப்பட்ட சிலர் தற்காலிகமாக தங்கவைக்கப்பட்டுள்ள ஶ்ரீ ஜயவர்தனபுர கோட்டை நகர சபைக்கு சொந்தமான சமுத்திராதேவி மண்டபத்திற்கு மக்கள் சக்தி குழுவினர் இன்று காலை சென்றிருந்தனர்.
இந்த செயற்பாட்டில் மொரட்டுவை பல்கலைக்கழகம் இன்றும் இணைந்துகொண்டிருந்தது.
ஹீன் கால்வாய் பெருக்கெடுத்தமையால் 40 குடும்பங்கள் பாதிக்கப்பட்டுள்ளன.
பிள்ளைகளின் புத்தகங்கள், ஆடைகள் உள்ளிட்ட அனைத்தும் நீரில் மூழ்கியுள்ளன.
களுத்துறையில் இன்று (21) நடைபெற்ற நிகழ்வொன்றிலேயே அவர் இதனைக் கூறினார்.
நீதிமன்ற அவமதிப்பு தொடர்பில் பிரதியமைச்சர் ரஞ்சன் ராமநாயக்கவிற்கு எதிரான வழக்கை எதிர்வரும் டிசம்பர் மாதத்தில் ஐவரடங்கிய நீதிபதிகள் குழாம் முன்னிலையில் விசாரணைக்கு எடுத்துக்கொள்ள உயர் நீதிமன்றம் இன்று தீர்மானித்துள்ளது.
இந்த விடயம் தொடர்பில், ஊடக நிறுவனங்களின் தலைமை அதிகாரிகள் அடங்கிய 14 சாட்சியாளர்கள் உள்ளிட்ட சாட்சியங்களின் ஆவணங்களை சட்ட மா அதிபர் திணைக்களம் இன்று நீதிமன்றுக்கு சமர்ப்பித்தது.
அதிபர் கிம் ஜோங் 40 நாட்களுக்குப் பின்னர் பொது நிகழ்ச்சியில் பங்கேற்றது தொடர்பான செய்தி அந்நாட்டு மக்களின் குழப்பத்திற்கு முடிவைக் கொடுத்துள்ளது.
பாராளுமன்றத்தில் வாய்மூல கேள்வி எழுப்பும் சந்தர்ப்பத்திலேயே அவர் இதனைக் குறிப்பிட்டுள்ளார்.
இலங்கையின் பணவீக்கம் மே மாதத்தை காட்டிலும் ஜூன் மாதத்தில் வீழ்ச்சியடைந்துள்ளது.
கடந்த மே மாதத்தில் 5.0 வீதமாக இருந்த பணவீக்கம் ஜூன் மாதம் 3.8 வீதமாக வீழ்ச்சியடைந்துள்ளதாக சனத்தொகை கணக்கெடுப்பு மற்றும் புள்ளிவிபரவியல் திணைக்களம் தெரிவித்துள்ளது.
இன்டர்போலின் (Interpol) முன்னாள் தலைவர் Meng Hongwei-க்கு 13 1/2 ஆண்டுகள் சிறைத்தண்டனை விதித்து சீன நீதிமன்றம் உத்தரவிட்டுள்ளது.
வீர, வீராங்கனைகள், பயிற்றுநர்கள் மற்றும் அதிகாரிகள் அடங்கலாக 139 பேர் கொண்ட இலங்கை அணி அவுஸ்திரேலியாவிற்கு சென்றுள்ளது.
பட்மிண்டன், பளுதூக்கல், மேசைப்பந்து, குத்துச்சண்டை, சைக்கிள், ஜிம்னாஸ்டிக் உட்பட 15 வகையான போட்டிப் பிரிவுகளில் இலங்கையைப் பிரதிநிதித்துவப்படுத்தி வீர, வீராங்கனைகள் போட்டியிடவுள்ளனர்.
பிரதம நீதியரசர் கே. ஶ்ரீபவன், சிசிர டி ஆப்ரூ மற்றும் உபாலி அபேரத்ன ஆகிய நீதியரசர்கள் குழாம் முன்னிலையில் எடுத்துக்கொள்ளப்பட்ட போதே இந்த அடிப்படை உரிமை மனு நிராகரிக்கப்பட்டது.
அனைத்து கட்சிகளும் இணைந்து உருவாக்கும் ஒரு அரசாங்கமே தேசிய அரசாங்கம் என அரசியலமைப்பில் குறிப்பிடப்பட்டுள்ளதாக மனுதாரர்கள் சார்பில் ஆஜரான ஜனாதிபதி சட்டத்தரணி மனோகர டி சில்வா உயர்நீதிமன்றத்தில் வாதிட்டார்.
நடைமுறையிலுள்ள அரசில் பாராளுமன்றத்தைப் பிரதிநிதித்துவப்படுத்தும் சகல கட்சிகளும் அங்கம் வகிக்கவில்லை என்பதுடன், ஐக்கிய தேசியக் கட்சியும், ஐக்கிய மக்கள் சுதந்திரக் கூட்டமைப்பும் மாத்திரமே அரசாங்கத்தை பிரதிநிதித்துவப்படுத்துவதாக மனுதாரர்கள் சுட்டிக்காட்டியுள்ளனர்.
பாராளுமன்ற உறுப்பினர்கள் 225 பேரில் 143 பேர் அதனை அங்கீகரித்துள்ளதாக ஜனாதிபதி சட்டத்தரணிகள் சுட்டிக்காட்டினர்.
இதனை ஏற்றுக்கொண்ட உயர்நீதிமன்றம் மனுவை நிராகரித்தது.
வரையறுக்கப்பட்ட காலப்பகுதிக்குள் வழக்குகளை தாக்கல் செய்வதற்கு தேவையான திட்டங்களை வகுப்பதற்கும் இதன்போது தீர்மானிக்கப்பட்டதாக ஜனாதிபதி ஊடகப் பிரிவு தெரிவித்துள்ளது.
இந்த நிலநடுக்கத்தால் கட்டிட இடிபாடுகளில் சிக்கி 100 பேர் பலியாகினர்.
11,000 கட்டிடங்கள் வரை முற்றிலுமாக தரைமட்டமாகியுள்ளன.
சிவில் சமூக அமைப்புகளைச் சேர்ந்தோர், வலிந்து காணாமலாக்கப்பட்டோரின் குடும்ப உறவுகள், படுகொலைக்கும் வன்முறைக்கும் உள்ளானோரின் குடும்ப அமைப்பினர் இந்த பேரணியில் கலந்துகொண்டனர்.
கிளிநொச்சி – கந்தசுவாமி ஆலயம் முன்பாக இடம்பெற்ற கவன ஈர்ப்புப் போராட்டத்தில் காணாமற்போனவர்களின் உறவினர்கள், பொது அமைப்புக்களின் பிரதிநிதிகள், காணாமல் போனோர் தொடர்பில் செயற்படும் அமைப்பினர் ஆகியோர் கலந்து கொண்டனர்.
இதன் போது நல்லிணக்கப் பொறிமுறைக்கான செயலணியிடம் காணமற்போனவர்களின் உறவினர்கள் மகஜரையும் கையளித்தனர்.
சர்வதேச காணாமற்போனோர் தினத்தினை முன்னிட்டு மட்டக்களப்பு மாவட்ட காணாமற்போனவர்களின் உறவுகள் மற்றும் மட்டக்களப்பு மாவட்ட தொண்டு நிறுவனங்களின் இணையத்தினர் இணைந்து கவன ஈர்ப்புப் போராட்டத்தை முன்னெடுத்தனர்.
மன்னாரில் காணாமலாக்கப்பட்டவர்களின் உறவுகள் இன்று அமைதிப்போராட்டம் ஒன்றை முன்னெடுத்தனர்.
