ஐந்தாம் ஆண்டு புலமைப் பரிசில் பரீட்சையை எதிர்காலத்தில் நடத்தாமல் இருக்க அரசாங்கம் தீர்மானித்திருப்பதாக, ஜனாதிபதி அண்மையில் கூறி இருந்தார்.
இம்முறை கல்வி பொது தராதர சாதாரண தரப் பரீட்சையில் 9 ஆயிரத்து 413 பேர், ஒன்பது பாடங்களிலும் "ஏ" சித்திகளை பெற்றுள்ளதாக அவர் எமது செய்தி சேவையிடம் தெரிவித்துள்ளார்.
2018 ஆம் ஆண்டு சாதாரண தரப் பரீட்சை கடந்த டிசம்பர் மாதம் 3 ஆம் திகதி முதல் 12 ஆம் திகதி வரையான காலப்பகுதியில் நாடளாவிய ரீதியில் அமைக்கப்பட்டிருந்த 4 ஆயிரத்து 661 பரீட்சை நிலையங்களில் இடம்பெற்றது.
ஆதரவாக 20 வாக்குகளும் எதிராக 38 வாக்குகளும் பிரயோகிக்கப்பட்டுள்ளன.
இதுதொடர்பில் அமெரிக்கா ஆய்வு ஒன்றை நடத்தவுள்ளது.
தமக்கு சொந்தமான செய்மதி ஒன்றை நேற்று ஏவுகணைக் கொண்டு இந்தியா தாக்கி அழித்திருந்தது.
இவ்வாறான சோதனையை மேற்கொண்ட நான்காவது நாடாக இந்தியா பதிவாகியுள்ளதாக அமெரிக்கா தெரிவித்துள்ளது.
இந்த வேலைத்திட்டத்துக்கு கடும் எதிர்ப்பு வெளிப்படுத்தப்பட்டு வருகின்ற போதும், இன்றையதினம் அதனை முன்னெடுக்க தோட்ட நிர்வாகம் முயற்சித்துள்ளது.
இதனை அடுத்து பொதுமக்கள் தோட்ட முகாமையாளரது விடுதியை முற்றுகையிட்டு போரட்டம் நடத்தியுள்ளனர்.
இதேவேளை டிக்கோயா சாஞ்சிமலை தோட்டபகுதியில் இருந்து பிலிங்பொனி பகுதியில் இயங்கும் தனியார் தொழிற்சாலைக்கு அடிப்படை தேவைக்கு பயன்படுத்தும் குடிநீரினை கொண்டு செல்ல அனுமதிக்க முடியாது என தெரிவித்து அட்டன் - சாஞ்சிமலை பிரதான வீதியில் ஆர்ப்பாட்டம் ஒன்றும் முன்னெடுக்கப்பட்டது.
இதுவரை மேற்கொண்ட விசாரணைகளில், மூன்று மனித கொலைகள் மற்றும் 15 பேரை கொலை செய்ய முயற்சி செய்த சம்பவங்களுடன், விஷ போதைப்பொருள் வர்த்தகம் தொடர்பில் அவர் மீது குற்றம்சாட்டப்பட்டுள்ளதாக காவல்துறை ஊடகப் பேச்சாளர், காவல்துறை அத்தியட்சகர் ருவான் குணசேகர தெரிவித்துள்ளார்.
இரண்டாவது இடத்தை மூன்று பேர் தக்கவைத்துக் கொண்டுள்ளனர்.
இதற்கமைய விசாக மகளீர் கல்லூரியின் மாணவி சஜித்தி ஹங்சதியும், கம்பஹா ரத்னாவலி மகளீர் மகா வித்தியாலயத்தின் மாணவி சஞ்சானி திலேக்கா குமாரியும், மாத்தறை சுஜாதா வித்தியாலயத்தின் மாணவி மிந்தி ரெபேக்கா ஆகியோர் இரண்டாவது இடத்தை பெற்றுள்ளனர்.
ஐந்தாவது இடத்தை கேகாலை புனித ஜொசப் கல்லூரியின் மாணவி கயத்ரி ஹர்சிலா லிஹனி கடுவாரச்சி பெற்றுள்ளார்.
ஆறாவது இடத்தை ஐந்து பேர் தக்கவைத்துக் கொண்டுள்ளனர்.
இந்த அறிவுறுத்தலை வளிமண்டலவியல் திணைக்களம் விடுத்துள்ளது.
இது தொடர்பில் அவதானத்துடன் செயற்பட வேண்டும் என அந்த திணைக்களம் பொதுமக்களை கோரியுள்ளது.
இலங்கையில் நாளாந்தம் 2600 மெகாவோட் மின்சாரம் பயன்படுத்தப்படுத்தப்படுகின்றது.
அதில் 30 சதவீதமான மின்சார உற்பத்தி நீர் மின் உற்பத்தி ஊடாக இடம்பெறுகிறது.
எனினும் அது துரிதமாக பரவிச் செல்வதை தடுப்பதற்கான நடவடிக்கைகளை மேற்கொள்ள முடியும் என்பதை அவர் சுட்டிக்காட்டியுள்ளார்.
மேல் மாகாணத்தில் பயணிகள் பேருந்து சேவையில் ஈடுபடும் பேருந்துகள், இளம் நீல நிறத்தில் காணப்பட வேண்டும் என்று நிலவும் சட்டத்தை ஏப்பிரல் முதலாம் திகதி முதல் அமுல்படுத்தவுள்ளதாக மேல் மாகாண வீதிப் போக்குவரத்து அதிகார சபையின் தலைவர் துசித குலரத்ன அண்மையில் தெரிவித்திருந்தார்.
இதற்கமைய விரைவில் அவர்கள் நாடு கடத்தப்படுவார்கள் என தகவல்கள் தெரிவிக்கின்றன.
இதன்போது, கட்டுநாயக்க வானூர்தி தள குற்றவியல் விசாரணை திணைக்கள அதிகாரிகளால் பொறுப்பேற்கப்பட்ட அவர்களிடம் பல மணி நேரம் விசாரணை மேற்கொள்ளப்பட்டது.
கஞ்சிபான இம்ரானுடன் ப்ளை டுபாய் வானூர்தியில் பிரவேசித்த சேபால ரத்நாயக்க அமில சம்பத் ஆகியோர் இலங்கை ஊடாக மாலைத்தீவு நோக்கி பயணிப்பதற்காக வெளிவரும் பயணிகள் பகுதியில் தங்கியிருந்த போது குற்றவியல் விசாரணை திணைக்கள அதிகாரிகள் பொறுப்பேற்றனர்.
பெருந்தோட்ட பாடசாலைகளுக்கு 2 ஏக்கர் காணி பெற்று கொடுத்தல் உள்ளிட்ட பல விடயங்கள் தொடர்பில் நாடாளுமன்ற கட்டிட தொகுதியில் உள்ள குழு அறை இரண்டில் நேற்று கலந்துரையாடல் ஒன்று இடம்பெற்றுள்ளது.
இந்த கலந்துரையாடலில் அமைச்சர் கயன்த கருணாதிலக¸ விசேட பிரதேசங்களுக்கான அபிவிருத்தி அமைச்சர் வேலுசாமி இராதாகிருஸ்ணன்¸பெருந்தோட்ட கைத்தொழில் இராஜாங்க அமைச்சர் வடிவேல் சுரேஸ்¸ நாடாளுமன்ற உறுப்பினர்களான சுஜித் பெரேரா¸ கே.கே.பியதாச¸ வேலுகுமார்¸ 22 பெருந்தோட்ட கம்பனிகளின் பிரதான நிறைவேற்று அதிகாரிகள்¸ அரச பெருந்தோட்டங்களின் தலைவர்கள்¸ உள்ளிட்ட பலர் கலந்து கொண்டனர்.
இதன் போது பெருந்தோட்ட பாடசாலைகளின் அபிவிருத்திக்காக இரண்டு ஏக்கர் காணி பெற்றுக் கொடுக்கப்பட வேண்டியதன் முக்கியத்துவம் தொடர்பாக விரிவாக ஆராயப்பட்டது.
மிக விரைவாக இந்த காணிகளை வழங்குவதற்காக கல்வி அமைச்சு, காணி அமைச்சு, பெருந்தோட்ட கைத்தொழில் அமைச்சு, விசேட பிரதேசங்களுக்கான அபிவிருத்தி அமைச்சு, பெருந்தோட்ட கம்பனிகள் ஆகியன உள்ளடங்கும் வகையில் குழு ஒன்றை அமைப்பதற்கு ஏகமனதாக தீர்மானிக்கப்பட்டது.
இதன் அடிப்படையில் எதிர்வரும் ஜூன் மாதம் ஆரம்ப கட்ட நிகழ்வாக பெருந்தோட்ட பாடசாலைகளுக்கு பிரதமர் ரணில் விக்கிரமசிங்க தமையில் காணிகளை கையளிக்க தீர்மானிக்கப்பட்டதாக பெருந்தோட்ட கைத்தொழில் ராஜாங்க அமைச்சர் வடிவேல் சுரேஷ் ஊடகங்கள் மத்தியில் தெரிவித்தார்.
இதனையடுத்து ஊடகங்கள் மத்தியில் உரையாற்றிய குறித்த திட்டத்தை ஆரம்பித்த விஷேட பிரதேசங்களுக்கான அபிவிருத்தி அமைச்சர் வேலுசாமி ராதாகிருஸ்ணன், எதிர்வரும் மூன்று மாதங்களில் பெருந்தோட்ட பாடசாலைகளுக்கான காணியை வழங்க தீர்மானிக்கப்பட்டதாக குறிப்பிட்டார்.
வத்தளை, மிரிஸ்ஸ, வெல்லம்பிட்டி மற்றும் கொழும்பு - புளுமெண்டல் ஆகிய பகுதிகளில் வைத்து குறித்த சந்தேக நபர்கள் கைது செய்யப்பட்டுள்ளதாக காவல்துறை ஊடகப் பேச்சாளர் அலுவலகம் தெரிவித்துள்ளார்.
இரவு சந்தைக்காக பேருந்து தரிப்பிடம் மற்றும் அதனை அண்டியுள்ள வீதிகளின் இரு புறங்களிலும் அமைக்கப்பட்டுள்ள தற்காலிக வர்த்தக நிலையங்கள் காரணமாக இந்த சிக்கல் நிலை ஏற்பட்டுள்ளதாக பயணிகள் மற்றும் பேருந்து பணியாளர்களும் எமது செய்தி சேவையிடம் தெரிவித்துள்ளனர்.
இதேவேளை புத்தல – பதுகல்லேன வனப்பகுதியில் நேற்று மாலை ஏற்பட்ட தீப்பரவலை அணைப்பதற்காக காவல்துறையினர், பிரதேசவாசிகள் மற்றும் இராணுவ வீரர்களுடன், வன பாதுகாப்பு அதிகாரிகளும் இணைந்து செயற்பட்டதாக காவல்துறை ஊடகப் பேச்சாளர் அலுவலகம் தெரிவித்துள்ளது.
இந்த வருடத்தில் இதுவரையான காலப்பகுதியில் 12 ஆயிரத்து 84 டெங்கு நோயாளர்கள் அடையாளங் காணப்பட்டுள்ளதாக சுகாதார அமைச்சின் தொற்று நோய் பிரிவு தெரிவித்துள்ளது.
இதில் அதிக நோயாளர்கள் மேல் மாகாணத்தில் பதிவாகியுள்ளனர்.
இதனுடன் மார்ச் மாதம் இதுவரை 2 ஆயிரத்து 838 டெங்கு நோயாளர்கள் இனங்காணப்பட்டுள்ளதாக தொற்று நோய் பிரிவு மேலும் குறிப்பிட்டுள்ளது.
கொழும்பில் ஐக்கிய மக்கள் சுதந்திர கூட்டமைப்பு நடத்திய செய்தியாளர் சந்திப்பில் வைத்து அவர் இதனைக் கூறியுள்ளார்.
எவ்வாறாயினும், நிலையான அபிவிருத்தியை ஏற்படுத்த நடவடிக்கை எடுக்கப்படும் என்று ஐக்கிய தேசிய கட்சி தெரிவித்துள்ளது.
கட்சியின் தலைமையகத்தில் இடம்பெற்ற இளைஞர் முன்னணியின் கூட்டம் ஒன்றில் வைத்து அவர் இதனைக் குறிப்பிட்டுள்ளார்.
குருணாகலை - தொடம்கஸ்லந்தயில் இடம்பெற்ற மக்கள் சந்திப்பில் வைத்து அவர் இதனைக் கூறியுள்ளார்.
ஐக்கிய மக்கள் சுதந்திர முன்னணி ஆட்சியின்போது தமிழர்கள் மத்தியில் பயம்பீதி நிலையே தோன்றியிருந்தது.
நாராயன்பிட்டயில் இடம்பெற்ற மக்கள் சந்திப்பில் வைத்து அவர் இதனைக் கூறியுள்ளார்.
இந்த நிலையில் எதிர்வரும் தேர்தலில் சிறிய கட்சிகள் அதிக முக்கியத்துவம் பெறும் என்றும் அவர் குறிப்பிட்டுள்ளார்.
ஹப்புத்தளை கஹகல்ல பிரதேசத்தில் இடம்பெற்ற மக்கள் சந்திப்பில் வைத்து அவர் இந்த கருத்தை வெளியிட்டுள்ளார்.
கூட்டமைப்பின் தலைவர் இரா.சம்பந்தன் தலைமையில் இந்த கூட்டம் நடைபெறவுள்ளது.
ஊர்காவற்றுறை காவற்துறையினர் இதனைத் தெரிவித்துள்ளனர்.
அவுஸ்திரேலிய ஊடகம் ஒன்று இதனைத் தெரிவித்துள்ளது.
அவர்கள் இருவரும் கடந்த 2009ம் ஆண்டு அவுஸ்திரேலியாவுக்கு அகதிகளாக சென்றுள்ளனர்.
தற்போது தமக்கு இருக்கும் 3 வாகனங்களுக்கும் பிரசாரங்களுக்காக வாடகை செலுத்துவதாக அவர் கூறியுள்ளார்.
ஐக்கிய மக்கள் சுதந்திர கூட்டமைப்பு தனித்து பெரும்பான்மையை வெல்லும்.
ஆனால் ஐக்கிய மக்கள் சுதந்திர கூட்டமைப்புக்கு எதிராக போலியான பிரசாரங்களை முன்வைத்து வருவதாக அவர் குற்றம் சுமத்தியுள்ளார்.
மக்களாலேயே நாட்டின் அரசாங்கம் இயங்குவதாகவும் அவர் குறிப்பிட்டுள்ளார் .
வான் தாக்குதல்கள் காரணமாக 100க்கும் அதிகமானவர்கள் காயமடைந்துள்ளனர்.
பரீட்சைகள் திணைக்களம் விடுத்துள்ள அறிக்கையில் இது தொடர்பில் குறிப்பிடப்பட்டுள்ளது.
எமக்கு வலுவான நடுத்தர மக்கள் அவசியமாகவுள்ளனர்.
அரலகங்வில பிரதேசத்தில் நேற்று இ;டம்பெற்ற சமய நிகழ்வொன்றில் கலந்து கொண்டு உரையாற்றிய ஜனாதிபதி இதனை தெரிவித்தார்.
நேற்று சுன்னாகத்தில் இடம்பெற்ற பிரசார நிகழ்வில் அவர் இதனைக்குறிப்பிட்டுள்ளார்.
தமிழ்த்தேசியக்கூட்டமைப்பு தொடர்பில் மக்கள் மத்தியில் அவநம்பிக்கை ஏற்பட்டுள்ளது.
அதேவேளை,அம்பாறை மாவட்ட மக்களின் அரசியல் பிரதிநிதித்துவம் அநாதையாக மாறிவிடக் கூடாது என்பதில் அகில இலங்கை மக்கள் காங்கிரஸ் கரிசனைக்கொண்டிருக்கிறது .
கூட்டமைப்பின் முதலாவது பிரசார நிகழ்வை யாழ்ப்பாணம் மருதனார் மடம் பகுதியில் ஆரம்பித்து வைத்து உரையாற்றிய அவர், தமிழ் மக்களின் போராட்டம் ஒரு நீண்டப்போராட்டமாகும் என்று குறிப்பிட்டார்.
அவர்களை கைது செய்ய நடவடிக்கை எடுக்கப்பட்டுள்ளது.
காவற்துறை ஊடகப் பேச்சாளர் ருவான் குணசேகர இதனைத் தெரிவித்துள்ளார்.
நீதிமன்றத்தின் உத்தரவின் அடிப்படையில் ஒவ்வொரு ஞாயிற்றுக் கிழமையும் அவர் தங்கால்ல காவற்துறைநிலையத்துக்கு சென்று கையொப்பம் இடவேண்டும்.
அவருக்க எதிரான பல்வேறு குற்றச்சாட்டுகளுக்காக இந்த உத்தரவு பிறப்பிக்கப்பட்டுள்ளது.
காவற்துறை ஊடகப் பேச்சாளர் ருவான் குணசேகர இதனைத் தெரிவித்துள்ளார்.
அவர்கள் காவற்துறை பிணையில் விடுவிக்கப்பட்டதுடன், எதிர்வரும் 30ம் திகதி நீதிமன்றத்துக்கு வருமாறு அறிவுறுத்தப்பட்டுள்ளது.
ஐக்கிய தேசிய கட்சியின் வேட்பாளர் ஒருவரது சுவரொட்டிகளுடன் அவர்கள் கைதாகி இருந்தனர்.
ஜனாதிபதி எந்தவித தீர்மானங்களையும் எடுக்க மாட்டார்.
தேர்தல்கள் ஆணையாளர் சட்டங்களை செயற்படுத்துகின்றார்.
முன்னாள் ஜனாதிபதி மஹிந்த ராஜபக்ஷ உள்ளிட்டோர் எங்கும் சென்று பிரச்சினைகளின்றி தேர்தல் பிரசாரங்களில் ஈடுபடலாம்.
முன்னர் நான் வான்வழியாக வந்தேன், வான்வழியாகவே சென்றேன்.
ஆனால் இன்று தரைவழியாக வந்தபோதும், பல பாதைகள் இன்னமும் சீரமைக்கப்பட வேண்டியுள்ளதை அவதானித்தேன்.
அத்தியாவசிய உணவுப் பொருட்களாயினும், பழங்களாயினும் அதனை உரிய முறையில் நுகர்வோரிடம் கொண்டு சேர்க்க முடியாத போக்குவரத்து கட்டமைப்பே செயற்படுகின்றது.
அந்த நாட்டின் 50வது சுதந்திர தின நிகழ்வில் கலந்து கொள்வதற்காக அவர் இந்த விஜயத்தை மேற்கொள்கிறார்.
நுவரெலியாவில் நேற்று இடம்பெற்ற பிரசாரக்கூட்டத்தின் போது அவர் இதனை தெரிவித்துள்ளார்.
ஏனைய துறைகளை போன்று இந்த வேதன உயர்வு அமையும் என்றும் அவர் குறிப்பிட்டுள்ளார்.
அலுத்கம - பேருவளை நகரில் நேற்று மாலை இடம்பெற்ற மக்கள் சந்திப்பில் கலந்து கொண்டு உரையாற்றிய போதே அவர் இந்த கருத்தை வெளியிட்டார்.
