நாட்டில் ஒளிபரப்பப்படும் தொலைக்காட்சி மற்றும் வர்த்தக நிகழ்ச்சிகளுக்கு இலங்கை சப்பிருதாயம் , இலங்கை அடையாளம் மற்றும் நெறிமுறைகள் கண்காணிக்கப்பட்டு, இலங்கை காலாச்சாரம் , கலைத்துறைக்கு ஏற்படும் பாதிப்புக்களை கட்டுபடுத்த நடவடிக்கை மேற்கொள்ளுமாறும் கலைத்துறையினரினால் நிதி மற்றும் ஊடகத்துறை அமைச்சர் மங்கள சமரவீரவிடம் கேட்டுக்கொண்டுள்ளனர்.
இது தொடர்பாக ஊடகத்துறை அமைச்சு விரிவான கட்டணம் அறிக்கை ஒன்றை வெளியிட்டுள்ளது.
பிளாஸ்ரிக் மற்றும் பொலித்தீனுக்கான வரியை 10 வீதத்திலிருந்து 100 வீதம் வரை அதிகரிப்பதற்கும் பிளாஸ்டிக் மற்றும் பொலித்தீன் பாவனை குறித்து தேசிய கொள்கை ஒன்றினை வகுப்பதற்கும் அரசாங்கம் நடவடிக்கை எடுத்துள்ளது.
புதிதாக ரெயில் எஞ்சின்கள், ரெயில் பெட்டிகள் இறக்குமதி செய்யப்பட்ட பின்னர், இது நடைமுறைப்படுத்தப்படவுள்ளது.
இரத்மலானை தொழில் பேட்டை ஊடாக சேவையில் ஈடுபடுத்தப்படாத எஞ்சின்கள் சீரமைக்கப்பட உள்ளன.
நேற்று ஜனாதிபதி மஹிந்த ராஜபக்ஷவை அலரி மாளிகையில் சந்தித்தார்.
வெளிவிவகார அமைச்சர் பேராசிரியர் ஜீ.எல்.பீரிஸ், மக்கள் தொடர்பாடல் மற்றும் ஊடகத்துறை அமைச்சர் கலாநிதி கெஹெலிய ரம்புக்வெல்லை ,ஜனாதிபதியின் செயலாளர் லலித் வீரதுங்க ,வெளிவிவகார அமைச்சின் செயலாளர் ஷேனுகா செனவிரத்ன மற்றும் ஜப்பானிய பிரதிநிதிகள் பலரும் இந்த சந்திப்பில் கலந்துக்கொண்டனர்.
கொழும்பு நகரில் மேற்கொள்ளப்படவுள்ள பாரிய போக்குவரத்து திட்டம் குறித்த அறிக்கையை ஜப்பானிய காணி போக்குவரத்து மற்றும் சுற்றுலாத்துறை உதவி அமைச்சர் இச்சந்திப்பின் போது ஜனாதிபதியிடம் கையளித்தார்.
இதற்கமைய மெதரிகிரி பிரதேசத்தில் இவ்விஞ்ஞான ஆய்வுகூடம் மாணவர் பாவனைக்கு திறந்து வைக்கப்படவுள்ளது.இத்திட்டத்தின் கீழ் பொலன்னறுவை மாவட்டத்தில் 23 தொழில்நுட்ப கூடங்கள் ஆரம்பிக்கப்படவுள்ளன.
அம்பாந்தோட்டை மாவட்டத்தில் அடிப்படை வசதிகளைக் கொண்ட கிராமங்களில் ஆரம்பிக்கப்படும் மாதிரிக் கிராமங்களின் வீட்டு பயனாளிகளுக்கு நகர பொது வசதிகளுக்கு இலகுவாக சென்றடையக்கூடிய வகையில் கட்டுவன, படகஸ்ஸகிரம, ஓய ஊடான பாலம், அந்துகல கிரம ஆற ஊடாக தருன சேவா பாலம், கட்டுவன ஊறுபொக்க ஓய ஊடான கம்மலே கொட்டுபொல பாலம், கோஹாம்போரூவ மற்றும் சியாம்பலாம்முறைய. யாக்கெரேன, துந்தொல ஊடான பாலம், பெலியத்த கிரம ஓய ஊடான அங்குல்மடுவ. அரங்வெல வீதி பாலம், மற்றும் தங்கல்ல கந்துறுபொக்குன வீதி ஊடான பயணிகள் மேம்பாலம் உள்ளிட்ட ஆறு திட்டங்கள் நகமு புரவர வேலைத்திட்டத்தின் கீழ் அமைக்கப்படவுள்ளன.
இதற்காக வீடமைப்பு மற்றும் நிர்மாணத்துறை அமைச்சர் சஜித் பிரேமதாச சமர்ப்பித்த ஆவணத்துக்கு அமைச்சரவை அங்கீகாரம் வழங்கியுள்ளது.
2015ம் ஆண்டில் 4195 கப்பல்கள் துறைமுகத்திற்கு வந்துள்ளன.
வெளிநாடுகளில் பணிபுரியும் இலங்கையர்களின் பிரச்சினைகளுக்கும் மனக்குறைகளுக்கும் தீர்வுகளைப் பெற்றுக்கொடுக்க வேண்டிய பொறுப்புவாய்ந்த சகல நிறுவனங்களும் தமது கடமைகளை புரிந்துணர்வுடனும் மனிதாபிமானத்துடனும் நிறைவேற்றவேண்டியதன் அவசியத்தை ஜனாதிபதி இதன்போது சுட்டிக்காட்டினார்.
ஊவா மாகாண வெளிநாட்டு வேலைவாய்ப்புப் பணியக வள நிலையத்தைத் திறந்து வைக்கும் நிகழ்வில் நேற்று (08) பிற்பகல் கலந்துகொண்டு உரையாற்றும்போதே ஜனாதிபதி இந்த விடயங்களை குறிப்பிட்டார்.
இதன்பொருட்டு தற்போதைய அரசாங்கத்தினாலும் பல வேலைத்திட்டங்கள் முன்னெடுக்கப்பட்டு வருவதுடன்இ வெளிநாடுகளில் பணிபுரியும் இலங்கையர்களின் நலன்புரி தேவைகளை நிறைவேற்றும் சகல நிறுவனங்களும் தமது கடமைகளை உரியவாறு நிறைவேற்றும் அதேவேளை மனிதாபிமானத்தை மதித்து செயற்பட வேண்டும் எனவும் ஜனாதிபதி தெரிவித்தார்.
அமைச்சர் ஹரீன் பெர்னான்டோ இராஜாங்க அமைச்சர் லக்ஷ்மன் செனெவிரத்னஇ பிரதி அமைச்சர் மனுஷ நாணயக்காரஇ ஊவா மாகாண ஆளுநர் ஆரிய பீ. ரெக்கவஇ முதலமைச்சர் சாமர சம்பத் தசநாயக்க முன்னாள் வெளிநாட்டு வேலைவாய்ப்புகள் அமைச்சர் பாராளுமன்ற உறுப்பினர் டிலான் பெரேரா உள்ளிட்ட மக்கள் பிரதிநிதிகளும் இலங்கை வெளிநாட்டு வேலைவாய்ப்பு பணியகத்தின் பொதுமுகாமையாளர் கே.ஓ.டீ.டீ. பெர்னாண்டோ உள்ளிட்ட அதிகாரிகள் இந்த நிகழ்வில் பங்குபற்றினர்.
இந்தியா 113 ஆவது இடத்திலும், பங்களாதேஷ் 130 ஆவது இடத்திலும் பாகிஸ்தான் 149 ஆவது இடத்திலும் உள்ளன.
தொழிலுக்காக வெளிநாடு செல்லும் பெற்றோரின் பிள்ளைகள் மிகவும் ஓரங்கட்டப்பட்ட குழுவாக மாறியுள்ளார்கள் எனவும் சேவ் த சில்ரன் அமைப்பு சுட்டிக்காட்டியுள்ளது.
அவ்வாறு கல்வி கற்றவர்கள்தான் இன்று தென்பகுதியில் பெரிய உத்தியோகங்களில் இருக்கின்றார்கள் .அவ்வாறு ஒரு கஷ்டமான காலத்தில் கல்வி முன்னேற்றமாக இருந்தது ஆனால் கடந்த சில காலங்களில் கல்வி பின்னோக்கி சென்றுள்ளது.
அதேபோன்று இங்கே நான் கண்ணால் கண்டேன் பலர் தேசிய மட்டத்தில் பல பதக்கங்களை பெற்றிருக்கின்றார்கள்.
அரசியல் வாதிகள் மக்கள் மத்தியில் பிழையான கருத்துக்களை தெரிவித்து அவர்களை பிளவு படுத்த நினைக்கின்றார்கள்.
அத்துடன் 2016ஆம் ஆண்டு முதல் மூன்று மாத காலப்பகுதியில் மட்டும் 58,726 பேர் வெளிநாட்டு வேலைவாய்ப்பிற்காக சென்றுள்ளனர்.
இம்முறை இந்த தேசிய நிகழ்வு அத்தனகல்ல ரஜமஹா விகாரையில் நடைபெறவுள்ளது.
மேலும் சம்பூர் மத்திய மகா வித்தியால கட்டிடத்தையும் கடற்படையினர் விடுவித்துள்ளனர்.
அவர் தொடர்ந்து தெரிவிக்கையில், எந்தவொரு அரசும் தரமான திட்டங்களை அறிமுகம் செய்தால் அந்த திட்டங்கள் தொடர்ந்தும் முன்னெடுக்கப்படும்.
தகைமை என்பவற்றை மேம்படுத்த வெகுசன ஊடகத்துறை அமைச்சு இத்தகைய புலமைபரிசில்களை வழங்குகிறது.
மோட்டார் சைக்கிள் பெருவதற்கு 2000 ஊடகவியலாளர்கள் தகுதி பெற்றுள்ளனர்.
நிதியமைச்சு, வங்கி மற்றும் மோட்டார் சைக்கிள் நிறுவனங்களுடன் கலந்துரையாடி மாதாந்தம் சிறிய தொகை செலுத்தும் வகையில் மோட்டார் சைக்கிள்களை பெற்றுகொடுக்க நடவடிக்கை எடுத்துள்ளோம்.
இன்னும் ஓரிரு வாரங்களில் இது தொடர்பில் நீங்கள் அறிவீர்கள்.
வீடமைப்பு அமைச்சுடன் இணைந்து பிரதேச ஊடகவியலாளர்களுக்கான வீடுகளை நிர்மாணிப்பது தொடர்பிலும் அமைச்சருடன் கதைத்தோம் என்று அவர் மேலும் என அமைச்சர் மேலும் தெரிவித்தார்.
காலி கோட்டைக்குள் அமைந்துள்ள அனைத்து அரச நிறுவனங்களையும் அங்கிருந்து அகற்ற நடவடிக்கை எடுக்க வேண்டுமென்றும் அவர் கூறியுள்ளார்.
நகர திட்டமிடலுக்கு ஏற்பவே அரச நிறுவனங்களும் அமைக்கப்படவேண்டும்.
ஏதாவது ஒரு பொருள் கழிவுப் பொருள் என இனங்காணப்பட்டு அதனை மற்றுமொரு நாட்டிற்கு அனுப்ப வேண்டுமானால் அந்த நாட்டின் அனுமதியைப் பெறவேண்டும்.
இந்தக் கொள்கலன் தொடர்பில் மத்திய சுற்றாடல் அதிகார சபையினாலும் விசாரணைகளை மேற்கொள்ளப்பட்டுள்ளதா? என்பது குறித்து சுங்கப்பிரிவுக்குத் தெரியாது என்றும் அவர் கூறியுள்ளார்.
2016 ஆம் ஆண்டு ஜனவரி மாதம் ஒரு லட்சத்து 94 ஆயிரத்து 280 சுற்றுலா பயணிகள் இலங்கைக்கு வருகைதந்துள்ளனர்.
இந்த போட்டித் தொடரில் 8 நாடுகளை சேர்ந்த அணிகள் கலந்து கொள்கின்றன.
ஐ.நா. மனித உரிமைகள் பேரவை மற்றும் ஐ.நா. பாதுகாப்புச் சபை ஆகிய வற்றில் இலங்கைக்கு நாம் தொடர்ந்தும் ஆதரவு அளிக்கும் அதேநேரம் இலங்கைக்கு எப்போதும் சீனா நண்பனாக செயற்படும் எனவும் சீனப் பிரதியமைச்சர் தெரிவித்தார்.
இவ்வருடம் ஐ.நா. மனித உரிமைகள் பேரவையில் இலங்கைக்கு வழங்கிய ஆதரவிற்காக ஜனாதிபதி மஹிந்த ராஜபக்ஷ சீனாவிற்கு தனது நன்றிகளைத் தெரிவித்துக் கொண்டார்.
என்றும் ஜனாதிபதி சீன பிரதியமைச்சரிடம் கூறினார்.
“சீன தலைமைத்துவத்துடன் நீங்கள் மிக நெருக்கமான நட்பை நிலை நிறுத்திக் கொண்டுள்ழர்கள்”
மேலும் இலங்கையின் அபிவிருத்திச் செயற்திட்டங்கள், தெற்கு அதிவேக நெடுஞ்சாலை மற்றும் ரயில்வே உள்ளிட்ட உட்கட்டமைப்பு வசதிகளை மேம்படுத்துவதிலும் சீனா அதிக ஆர்வம் கொண்டிருப்பதாக லியு கூறினார்.
"Effects of iron chelators and iron overload on .
என்பதின் ஊடகங்கள் உள்ளன.
319 ஆம் நாளாகும்.
சவான்னா துறைமுகம் நோக்கி நகர்ந்தார்.
குடியரசாக இரண்டாம் பெதுரோ அறிவித்தார்.
கடற்படையுடன் இடம்பெற்ற மோதல்களில் கூட்டுப் படைகள் வெற்றி பெற்றன.
தனிநாடாக பாலத்தீன தேசியப் பேரவையினால் அறிவிக்கப்பட்டது.
எஸ்டிஎஸ்-38 விண்கலத்தை விண்ணுக்குக் கொண்டு சென்றது.
அன்டோனொவ் வானூர்தி ஒன்று வீழ்ந்ததில் 40 பேர் உயிரிழந்தனர்.
இதற்கான மாநாடுகள் பல நிகழ்ந்துள்ளன.
சேர்ந்த ஒரு அரச மரபினர் ஆவர்.
என்னும் பெயருடன் இவன் அரசு கட்டில் ஏறினான்.
தனது 88 வயது வரை வாழ்ந்து ஆட்சி புரிந்ததால், சுமார் 100 ஆண்டுகள் வரை நிலைத்திருந்த இந்த அரச மரபினரின் காலத்தில் பெரும்பகுதி இவன் ஆட்சிக்காலத்துள் அடங்குகிறது.
, விதிகோத்திரர் போன்றோரை வெற்றி கொண்டான்.
இதற்காக 200,000 பேர் கொண்ட காலாட்படை, 2000 தேர்கள், 3000 போர் யானைகள் என்பவை கொண்ட படையைக் கட்டியெழுப்பினர்.
தன நந்தன் காலத்தில் கிரேக்கப் பேரரசர் அலெக்சாண்டர் சிந்து ஆற்றைக் கடந்து இந்தியா மீது படையெடுத்தார்.
Age of the Nandas and Mauryas .
கொண்ட ஒரு மாறுபட்ட  அமைப்பு ஆகும்.
4.5 மில்லியனுக்கும் அதிகமான ஆண்டுகளுக்கு முன்பு அதன் உருவாக்கம் முடிந்தவுடன், மாக்மா கடலின் படிகமயமாக்கலின் விளைவாக இந்த அமைப்பு உருவானதாக நம்பப்படுகிறது.
கோளப்பதையில் புவிவேதியியல் வரைப்படம் நிலவின் மேற்பரப்பு எனபது மாக்மா கடலியல் கருதுகோளுடன் இணக்கமானதாக இருக்கிறது .
"The constitution and structure of the lunar interior" (PDF).
Moon articles in Planetary Science Research Discoveries .
வழியாக இணைக்கப்பட்டு .
நார்க்கஞ்சா செடியின் நாருக்காகவும், நார்க்கஞ்சா எண்ணெய், மருத்துவப் பயன்பாடுகள், மற்றும் பொழுதுபோக்கு போதைப் பொருளாகவும் பல காலமாக பயன்படுத்தப்பட்டு வருகிறது.
இந்த டிஎச்சி ஆனது கஞ்சா செடியின் மலர்களைப் பதப்படுத்தி பெறப்படுகிறது.
இது ரம்பப்பல் வடிவுடனான கைவடிவக் கூட்டிலைகள் கொண்டது.
இது நார்க்கஞ்சா/hemp என்றும் அழைக்கபடும்.
கஞ்சா செடி ஒழுங்கற்ற .
அதே வேளையில், ஓரில்லமுள்ள செடிகள் ஆண் மலர்களையும் பெண் மலர்களையும் ஒரே செடியில் வெவ்வேறு இடங்களில் கொண்டிருக்கும்.
"மிகவும் முந்திய காலகட்டத்திலேயே சீனர்கள் கஞ்சா செடி இருபால் தாவரம் என்று உணர்ந்துள்ளனர்".
சீக்கியப் பேரரசு, தற்கால இந்தியா, பாகிஸ்தான் மற்றும் ஆப்கானிஸ்தானின் பகுதிகளைக் கொண்டது.
சீக்கியர்களுக்கு எதிராக 1845ஆம் ஆண்டில் நடந்த .
Sikhism: A Very Short Introduction .
தண்டாயுத பாணி - தண்டாயுதத்தைக் கரத்தில் ஏந்தியவன்.
வடிவேலன் - அழகுடைய வேலை ஏந்தியவன்.
வேலாயுதன், சிங்கார வேலன் - வேல் என்ற ஆயுதத்தினை உடையவன் .
போன்ற பல பெயர்களால் வழங்கப்படுகிறார்.
இதனால் கோபமடைந்த தாட்சாயிணி அக்னியில் விழுந்து உயிர் துறந்தார்.
பிறகு சிவபெருமான் தியானத்தி்ல் ஈடுபட ஆரம்பித்தார்.
இதனால் கலக்கமடைந்த தேவர்கள் சிவபெருமானின் தியானத்தைக் கலைக்க காமதேவனை அனுப்பினர்.
அப்போது சிவபெருமான் தம் மூன்றாவது கண்ணைத் திறந்தார்.
இது ஆறு குழந்தைகளாக உருப்பெற்றது.
இதனால் அவர்  கார்த்திகேயன் என்று பெயர் பெற்றார்.
முருகன் தம் மயில் வாகனம் கொண்டு உலகைச் சுற்ற புறப்பட்டார்.
மூன்றாவது கை அங்குசத்தினைச் செலுத்துகிறது.
மற்றொரு கை ஆடை உடுத்திய தொடையில் பதிந்திருக்கிறது.
ஐந்து மற்றும் ஆறாவது கைகள் வேலைச் சுழற்றுகின்றன.
ஏழாவது கை முனிவர்களுக்கு அரும் பொருளை உணர்த்துகிறது.
எட்டாவது கை மார்பில் உள்ள மாலையோடு விளங்குகிறது.
ஒன்பதாவது கை வளைகளோடு சுழன்று வேள்வியை ஏற்கிறது.
பத்தாவது கை மணியை ஒலிக்கிறது.
பதினோராவது கை மழையை அருள்கிறது.
பன்னிரண்டாவது கை மணமாலை சூட்டுகிறது.
மாத விசாக நட்சத்திர தினம் இவரது ஜென்ம நட்சத்திர தினமாக கொண்டாடப்படுகிறது.
, முருகப்பெருமானைப் பாட்டுடைத் தலைவனாகக் கொண்டு, அவனது ஆறுபடை வீடுகளையும் பாடும் காவியம் ஆகும்.
போன்ற நூல்களும் முருகனின் பெருமை சொல்வன.
