ஐரோப்பிய ஒன்றியத்தின் அதிகாரிகள் இப்போது அமெரிக்காவிலிருந்து சுதந்திரமான ஒரு ஐரோப்பிய ஒன்றிய இராணுவத்தைக் கட்டியெழுப்புவதற்கான திட்டங்களை அறிவித்துக் கொண்டிருக்கின்றனர், இதன்மூலம் பகிரங்கமான விரோத அறிக்கைகளை விடுவதற்கு பிரிட்டிஷ் அரசாங்கம் சீண்டப்பட்டுக் கொண்டிருக்கிறது.
ஜேர்மனியின் திணறிவருகின்ற டோச்ச வங்கியின் மீது ஒரு பாரிய அபராதத்தை விதித்து அமெரிக்கா பதிலடி கொடுத்தது.
பெல்ஜியத்தின் பிரெஞ்சு மொழி பேசும் வலோனியா பிராந்தியத்தில் இருந்து - கனடாவின் போட்டியில் இருந்து ஐரோப்பிய ஒன்றியத்தின் விவசாயிகளுக்கு கூடுதல்  பாதுகாப்பை இப்பிராந்தியம் கோரியது - எதிர்ப்பு கிளம்பியது.
கனடா ஏமாற்றமடைந்திருக்கிறது, ஆனாலும் இது சாத்தியமில்லை என்றே நான் கருதுகிறேன்.
“ஒரு உறுப்பினர், ஒரு கிளப்பில் இருந்து விலக விரும்புகிறார் என்ற நேரத்தில், அத்தகைய ஒரு உறுப்பினர் அந்த கிளப்பின் எதிர்காலத்தை நிர்ணயம் செய்ய விரும்புவது என்பது இயல்பான ஒன்று அல்ல.
கிட்டத்தட்ட ஏழு ஆண்டுகளுக்கு முன்பு ஒரு சிறிய பிணை மீறல் நடவடிக்கையில் அசான்ஜ் ஈடுபட்டார் என்பதற்காக மே 1 அன்று குரூரமான வகையில் 50 வார கால சிறை தண்டனை அவருக்கு விதிக்கப்பட்டதைத் தொடர்ந்து, அதிகபட்ச பாதுகாப்புள்ள பெல்மார்ஷ் சிறையில் அவர் அடைத்து வைக்கப்பட்டுள்ளார்.
அசான்ஜின் உடைமைகள் சோதனை செய்யப்படுவது மற்றும் கைப்பற்றப்படுவதற்கு சாட்சியாகவும் கண்டனம் தெரிவிக்கவும் நேற்று தூதரகத்திற்கு வெளியே காலை 8 மணியளவில் அசான்ஜின் ஆதரவாளர்கள் ஒன்றுகூட தொடங்கினர்.
ஆர்ப்பாட்டக்காரர்கள் எழுப்பிய வினாக்களுக்கு, “அமைதியாக இருங்கள்” என்பதைத் தவிர எந்தவொரு பதிலையும் அளிப்பதற்கு பொலிஸ் அதிகாரிகள் மறுத்துவிட்டனர்.
தூதரகத்தின் முன்பகுதிக்கு பெருநகர பொலிஸ் நகர்கின்றனர் .
“சிறைக்காவல் சங்கிலி ஏற்கனவே முறிக்கப்பட்டுவிட்டது,” என்று விக்கிலீக்ஸ் வலியுறுத்தியது, அதாவது ஆதாரங்கள் சிதைக்கப்பட்டிருக்கலாம் என்பதுடன் நீதிமன்றம் ஏற்கக்கூடியதாக அவை இருக்காது என்பதாகும்.
“கைப்பற்றப்பட்ட பொருட்களில் அவரது இரண்டு கையெழுத்துப் பிரதிகள், அத்துடன் அவரது சட்ட ஆவணங்கள், மருத்துவ அறிக்கைகள் மற்றும் மின்னணு சாதனங்கள் அடங்கும்.
அந்த வேண்டுகோளை காரணம்காட்ட இயலாத வகையில் ஈக்வடோர் மறுத்துவிட்டது.
என்று விக்கிலீக்ஸ் தலைமை ஆசிரியர் கிறிஸ்டின் ஹ்ராஃப்ஸன் தெரிவித்தார்.
ஜூலியன் அசான்ஜ் மற்றும் விக்கிலீக்ஸின் பாதுகாப்பிற்கான சர்வதேச சட்ட ஒருங்கிணைப்பாளர் பால்டஸார் கார்ஸோன், அசான்ஜின் ஆவணங்கள் “அவருக்கு எதிராக அரசியல் துன்புறுத்தல் செய்யும் முகவரான அமெரிக்காவிடம் ஒப்படைக்கப்பட்டுள்ளன.
என்ற நிலையில், அமெரிக்காவின் அசான்ஜ் ஒப்படைப்பு கோரிக்கைக்கு முரணாக சுவீடனின் நடவடிக்கை இருக்கும் என்பதற்கான ஒரு காரணத்தையும் அவர் கண்டறியவில்லை என்று பெர்சன் வலியுறுத்தினார்.
ஆனால் முன்னாள் பிரிட்டிஷ் தூதரும், மனித உரிமைகள் ஆலோசகருமான கிரேக் முர்ரே, பெர்சனின் கோரிக்கைக்குப் பின்னால் உள்ள சட்டபூர்வமான கருத்தாய்வுகளைப் பற்றிய முக்கிய அவதானிப்புக்களை உருவாக்கினார்.
முர்ரே விவரித்தது போல “ஒரு முற்றிலும் முன்நிகழ்ந்திராத மற்றும் வெளிப்படையான நம்பமுடியாத காரணமாக, லோர்டு [நிக்கோலஸ்] பிலிப்ஸ், EAW உடன்படிக்கையின் ஆங்கில பதிப்பில் “நீதித்துறை அதிகாரம்” சுவீடன் வழக்கறிஞரை உட்படுத்த .
, ஆனால் பிரெஞ்சு பதிப்பில் ‘நீதித்துறை அதிகாரம்’ சுவீடன் வழக்கறிஞரை உட்படுத்த முடியும் என்று நிறைவு செய்திருந்தார்.
இரண்டு பதிப்புகளுமே சம மதிப்பு கொண்டவை, லோர்டு பிலிப்ஸ் ஆங்கில மொழி பதிப்பை காட்டிலும் பிரெஞ்சு மொழி பதிப்பிற்கு முன்னுரிமை வழங்க தீர்மானித்தார் என்பதை இங்கிலாந்து பேச்சுவார்த்தையாளர்கள் ஆங்கில உரை மூலம் வேலை செய்பவர்கள் என்பது ஊகிக்கக் கூடியது என்ற நிலையிலும், இங்கிலாந்து அமைச்சர்களும் பாராளுமன்றமும் அதை உறுதி செய்யக் கூடும் என்ற நிலையிலும் [அசலில் வலியுறுத்துவதாக] ஒரு முற்றிலும் அதிர்ச்சியூட்டும் முடிவாக அது இருந்தது.
கடந்த கால் நூற்றாண்டு அமெரிக்க போர் ஒவ்வொன்றிற்கும் விடாப்பிடியான ஆதரவாளர்களாக இருந்துள்ள இவ்விருவருமே, வரவிருக்கும் குடியரசுக் கட்சி நிர்வாகத்தின் உயர்மட்ட வெளியுறவு கொள்கை பதவிக்கு போட்டியிடுகிறார்கள் என்ற உண்மை, சமீபத்திய அமெரிக்க இராணுவ தலையீடுகளை ஏதோவிதத்தில் அவர் எதிர்க்கிறார் மற்றும் “தேசத்தைக் கட்டமைப்பார்" எனும் முன்னணி பிரச்சாரம் மீதான ட்ரம்ப் இன் பாசாங்குத்தனத்தினது பொய்களை எடுத்துக்காட்டுகிறது.
அவர் ஈராக் போருக்கு எதிராக இருந்ததாக கூறும் ட்ரம்ப் இன் போலிக்கூற்றுகள், அவரது ஜனநாயகக் கட்சி எதிர்ப்பாளர் ஹிலாரி கிளிண்டன் எதனுடன் மிகத் தெளிவாக அடையாளம் காணப்பட்டாரோ அந்த முடிவில்லா அமெரிக்க இராணுவ தலையீடுகள் மீதான மக்கள் எதிர்ப்பை சாதகமாக்கிக் கொள்வதற்காகவே இருந்தன.
வேறு வார்த்தைகளில் கூறுவதானால், வரவிருக்கும் நிர்வாகத்தின் திட்டநிரலில் ஈரான் உடனான ஒரு புதிய அமெரிக்க போர் உள்ளது.
2008 இல் ஜனாதிபதி வேட்பாளர் ஆவதற்கு யூலியானி போட்டியிட்ட போது, ஈரானின் அணுஆயுத திட்டத்திற்கு எதிராக தந்திரோபாய அணுஆயுதங்களை பயன்படுத்துவதை "பரிசீலனையில் இருந்து நீக்கக்கூடாது" என்று இவர் தெரிவித்திருந்தார்.
யூலியானிக்கு எந்தவொரு வெளியுறவு கொள்கை அனுபவமும் இல்லை என்ற போதினும், அவர் ஒரு பிரதான ட்ரம்ப் விசுவாசியும் மற்றும் பொலிஸ் அரசு ஆட்சிமுறைகளின் ஒரு நீண்டகால ஆதரவாளரும் ஆவார்.
நகர முதல்வராக அவர் பதவி வகித்தபோது, ஒரு ஒடுக்குமுறையான "நின்று கைமாற்றி ஒப்படைக்கும்" (stop and frisk) திட்டத்துடன் அடையாளம் காணப்பட்டார் —பின்னர் அத்திட்டம் அரசியலமைப்புக்கு புறம்பானதாக தடுக்கப்பட்டது—
வெளியுறவுத்துறை செயலர் பதவிக்கான அவரது வெளிப்படையான பிரதான போட்டியாளர் ஜோன் போல்டன், ஒவ்வொரு விதத்திலும் அதேயளவிற்கு பிற்போக்குத்தனமானவரும் மற்றும் ஒருதலைபட்சமான அமெரிக்க இராணுவ ஆக்ரோஷத்தின் தீவிர ஆதரவாளரும் ஆவார்.
புஷ் பிரச்சாரத்தின் வெற்றிகரமான நடவடிக்கையில் ஒரு வழக்கறிஞராக சேவையாற்றிய பின்னர், போல்டன் குடியரசு கட்சி வட்டாரங்களில் முக்கிய நபராக உயர்ந்தார்.
அவர் ஈராக்கில் ஆட்சி மாற்றத்திற்கான அமெரிக்க போருக்கு குறைந்தபட்சம் 1998 இல் இருந்து வக்காலத்து வாங்குபவராக இருந்தார்.
சதாம் ஹூசைன் "பேரழிவுகரமான ஆயுதங்களை" தயாரித்து வருகிறார் என்றும், அல் கொய்தாவிடம் அவற்றை ஒப்படைக்க தயாரிப்பு செய்து வருகிறார் என்றும் கூறப்பட்ட பொய்கள் ஊக்குவிக்கப்பட்ட அந்த ஆண்டைத் தொடர்ந்து, ஈராக்கிற்கு எதிரான ஆக்கிரமிப்பு போரைத் தயார் செய்வதில் ஒரு முக்கிய பாத்திரம் வகித்து, 2002 இல், அவர் வெளியுறவுத்துறையின் ஆயுத கட்டுப்பாடு மற்றும் சர்வதேச பாதுகாப்புக்கான துணை செயலராக இருந்தார்.
செவ்வாயன்று மாலை வரை ஒரு நியமன அறிவிப்பு எப்போது வெளியிடப்படும் என்பது தெளிவாக இல்லை என்றாலும், ட்ரம்ப் இன் இடைக்காலக்குழு முற்றிலும் குழப்பத்திலும் மற்றும் கடுமையான உள்கட்சி கருத்து முரண்பாடுகளிலும் குழம்பி போயிருப்பதைக் குறித்து செய்திகள் வெளியாயின.
ஒட்டுமொத்த பதவி நியமன நடவடிக்கையின் தலைவராக இருந்த கிறிஸ் கிறிஸ்டியின் இடத்தில், தேர்ந்தெடுக்கப்பட்டுள்ள துணை ஜனாதிபதி மைக் பென்ஸ் அவசர அவசரமாக பிரதியீடு செய்யப்பட்டார்.
ட்ரம்ப் முகாமிற்குள் நிலவும் இந்த குழப்பம், தேர்ந்தெடுக்கப்பட்ட அந்த பில்லியனிய ஜனாதிபதிக்கு “முற்போக்காளர்களாக" காட்டிக்கொள்ளும் பேர்ணி சாண்டர்ஸ் மற்றும் எலிசபெத் வாரென் உட்பட ஜனாதிபதி ஒபாமா மற்றும் முன்னணி ஜனநாயக கட்சியினர் பணிவாக வளைந்து கொடுப்பதுடன் கூர்மையாக முரண்படுகிறது.
அந்த அறிக்கை, யேமனில் பிரெஞ்சு ஆயுதங்களின் பயன்பாடு குறித்த துல்லியமான தகவலுடன், கடந்தாண்டு செப்டம்பரில் இருந்து ஜனாதிபதி மற்றும் முன்னணி அமைச்சர்களுக்கான ஒரு கசியவிடப்பட்ட இரகசிய உளவுத்துறை செய்தியை உள்ளடங்கி உள்ளது.
பத்தாயிரக் கணக்கான அப்பாவி மக்கள் கொல்லப்பட்டுள்ள அந்த போரில் பிரெஞ்சு ஆயுதங்கள் பயன்படுத்தப்பட்டதற்கான எந்த ஆதாரமும் இல்லை என்று மக்ரோன் அரசாங்கம் கூறுவது பொய்கள் என்பதை அது நிரூபிக்கிறது.
அந்த விசாரணையை உள்நாட்டு உளவுத்துறை முகமையான உள்நாட்டு பாதுகாப்புக்கான பொது இயக்குனரகம் (DGSI) நடத்துகிறது.
இந்த பொலிஸ் விசாரணையானது, பத்திரிகையாளர்களின் ஆதாரநபர்களுக்கு அநாமதேய அடையாளம் தேவைப்படுகின்ற நிலையில், பத்திரிகை சுதந்திரம் மீதான ஒரு தாக்குதலாகும்.
அது யேமனில் ஆயுதங்கள் பயன்படுத்தப்பட்ட இடங்களைக் குறித்த விபரமான தகவல்களை வழங்குகிறது.
ஒபாமா மற்றும் ட்ரம்ப் நிர்வாகங்கள் இரண்டினது உதவியுடனும், பிரிட்டன் மற்றும் பிரெஞ்சு உட்பட ஐரோப்பிய ஏகாதிபத்திய சக்திகளின் உதவியுடனும், 2014 இல் இருந்து சவூதி முடியாட்சி உலகின் மிக வறிய நாடுகளில் ஒன்றான யேமனுக்கு எதிரான போரை நடத்துகிறது.
பத்தாயிரக் கணக்கான அப்பாவி மக்கள் கொல்லப்பட்டுள்ளனர்.
பிரான்சின் நடவடிக்கைகள், ஆயுத விற்பனை மீதான 2014 ஐரோப்பிய உடன்படிக்கை உட்பட சர்வதேச சட்டமீறல் என்பதையும் அந்த அறிக்கை தெளிவுபடுத்துகிறது, போர் குற்றங்கள் நடத்துவதற்காக “ஆயுதங்கள் அல்லது தளவாடங்கள் பயன்படுத்தப்படும் என்பதை ஒப்புதல் அளிக்கும் நேரத்தில் அறிந்திருந்தால்" அந்நாடு ஆயுதங்கள் விற்பதற்குச் சர்வதேச சட்டம் தடை விதிக்கிறது.
அந்த வெளியீடுகள் குறித்து அரசாங்கம் விடையிறுக்க மறுக்கும் அதேவேளையில், பாதுகாப்புத்துறை அமைச்சர் பார்லி ஏப்ரல் 18 இல் Radio Classique இக்கு கூறுகையில், “என் அறிவுக்கு எட்டிய வரையில், இந்த ஆயுதங்கள் யேமன் போரில் அத்துமீறிய விதத்தில் பயன்படுத்தப்படவில்லை மேலும் ... அப்பாவி மக்கள் பாதிக்கப்படுவதற்கு பிரெஞ்சு ஆயுதங்கள் ஆதாரமாக இருந்துள்ளன என்று குறிப்பிட அனுமதிக்கும் எந்த ஆதாரமும் என்னிடம் இல்லை,” என்று கூறி, அந்த வெளியீடுகளின் முக்கியத்துவத்தைக் கடந்த வாரம் குறைத்துக் காட்ட முயன்றார்.
இது விக்கிலீக்ஸ் மற்றும் அதன் பதிப்பாசிரியர் ஜூலியன் அசான்ஜ் மற்றும் செல்சியா மானிங்கைத் தொலைப்படுத்துவதில் அதன் கூர்மையான வெளிப்பாட்டைக் காண்கிறது, ஈராக் மற்றும் ஆப்கானிஸ்தானில் அமெரிக்க போர் குற்றங்களையும் மற்றும் ஏனைய முதலாளித்துவ அரசுகளின் குற்றகரமான நடவடிக்கைகளையும் ஆவண ஆதாரங்களுடன் அம்பலப்படுத்திய அவர்களின் தைரியமான நடவடிக்கைகளே அவர்களின் ஒரே "குற்றமாக" உள்ளது.
அசான்ஜ் மற்றும் மானிங்கை வழக்கில் இருப்பது பத்திரிகையியலைக் குற்றகரமாக்குவதற்கும் மற்றும் அரசு குற்றங்களை வெளிச்சத்திற்குக் கொண்டு வருபவர்களைத் வழக்கில் இழுப்பதற்கும் ஒரு முன்னுதாரணத்தை அமைக்க நோக்கம் கொண்டுள்ளது.
பெருமந்த காலத்தை விவரிக்க 1930களில் முன்வைக்கப்பட்டதும், தற்போதைய நெருக்கடியைக் குறிப்பிட முன்னாள் நிதித்துறை செயலர் லாரன்ஸ் சம்மரால் பயன்படுத்தப்பட்டதுமான "நீடித்த மந்தநிலைமை" என்ற பதத்தை அந்த அறிக்கை, எழுத்துப்பூர்வமாக பிரயோகிக்கவில்லை என்ற போதும், அந்த பகுப்பாய்வின் உள்ளடக்கம் நடைமுறையளவில் அந்த கருத்துருவையே கொண்டிருந்தது.
இது தான் சர்வதேச கொடுக்கல் வாங்கல்களை ஒழுங்கமைக்கும் வங்கி எதை 2008 இன் "மிகப்பெரும் நிதியியல் நெருக்கடி" என்று குறிப்பிடுகிறதோ அதை தூண்டிவிட்டது, மீண்டும் இது எரிந்து போகக்கூடுமென்று அச்சுறுத்துகிறது.
