பெருமளவான மருத்துவக் குணம் கொண்ட இயற்கைப் பொருட்கள் காணப்படுவதால், ஈரவலய மழைக்காடுகள், உலகின் மிகப் பெரிய மருந்துச் சாலைகளாகக் கருதப்படுகின்றன.
உலகின் ஒட்சிசன் உருவாக்கத்தின் 28% பொழிகளினாலேயே ஏற்படுகின்றது.
நிறம் கொண்டதாக மாறுகின்றது.
மழைக் காடுகளின் பெரும்பாலான பகுதிகளில், நிலமட்டத்தில் போதிய அளவு சூரிய ஒளி கிடைக்காமையினால் சிறுதாவர வளர்ச்சி குறைவாகவே காணப்படுகிறது.
இது மனிதரும், விலங்குகளும் காட்டினூடாக இலகுவில் நடந்து செல்வதற்கு வசதியாக அமைகிறது.
இது சில பிரதேசங்களில் 10000mmஐ விட அதிகமாகும்.
பொதுவாக மழைவீழ்ச்சி 1750mm(175 cm) தொடக்கம் 2000mm(200 cm) வரை இருக்கும்.
பகுதியில் காணப்படும் பொழில்கள் ஆகும்.
எனினும் இவை உலகின் சில பகுதிகளில் மட்டுமே காணப்படுகின்றன.
, ஆகிய நாடுகளிலும் மிதவெப்ப மண்டலப் பொழில்கள் காணப்படுகின்றன.
வெப்பமண்டலப் பொழில்கள் பொதுவாக நான்கு அடுக்குகளாகப் பிரிக்கப்படுகின்றன.
சில மதிப்பீடுகளின்படி உலகின் 50% அளவான தாவர வகைகளின் வாழிடம் மரக்கவிகை அடுக்கே எனத் தெரியவருகிறது.
மரக்கவிகை அடுக்குக்கு வளரவுள்ள மரக்கன்றுகள் பலவும் இந்த அடுக்கில் காணப்படும்.
இளஞ்சூடான, ஈரப்பற்றுக்கொண்ட சூழலில் இவை விரைவாகவே சிதைந்து விடுவதால் விரைவாகவே மறைந்து விடுகின்றன.
போன்ற பல்வேறு வகைப்பட்ட விலங்கு வகைகளுக்குப் பொழில்கள் ஆதாரமாக விளங்குகின்றன.
பாலூட்டிகளில் உயர் விலங்கினங்கள், பூனை வகை உயிரினங்கள் போன்ற பல வகைகள் அடங்குகின்றன.
ஆழத்தில் போதிய ஊட்டப் பொருட்கள் இல்லாமையால், பெரும்பாலான மரங்களின் வேர்கள் நில மட்டத்துக்கு அருகிலேயே காணப்படுகின்றன.
அத்துடன், காடுகள் எரிதல், வரட்சி போன்ற மனிதனால் தூண்டப்படுவனவும், அல்லாதனவுமான நிகழ்வுகள் காடுகளில் மரங்கள் அழிவதற்குக் காரணமாகின்றன.
இன்று நமக்குத் தெரிந்த விலங்குகளின் வழிவந்த எதிர்கால விலங்குகள் வரண்ட காலநிலக்குத் தம்மைத் தகவமைத்துக் கொண்டு வாழக்கூடும்.
நேற்றிரவு இந்த சம்பவம் இடம்பெற்றுள்ளதாக காவற்துறையினர் தெரிவித்தனர்.
இதன் போது , கொள்ளையர்கள் அவர்கள் இருவரையும் கூரிய ஆயுதங்களால் தாக்கி வீட்டில் இருந்த தங்க ஆபரணங்களை கொள்ளையிட்டு சென்றுள்ளதாக எமது செய்தியாளர் தெரிவித்தார்.
இன்று காலை தொடக்கம் இந்த போராட்டம் முன்னெடுக்கப்பட்டு வருவதாக எமது செய்தியாளர் தெரிவித்தார்.
இதில் சுமார் நூற்றுக்கணக்கான தோட்டத் தொழிலாளர்கள் கலந்து கொண்டுள்ளனர்.
தோட்டத் தொழிலாளர்களின் அடிப்படை வேதனத்தை 1000 ரூபாவாக அதிகரிக்குமாறு கோரி நேற்று காலிமுகத்திடலில் கொழும்பு வாழ் மலையக இளைஞர் யுவதிகளால் கருப்புச் சட்டை போராட்டம் முன்னெடுக்கப்பட்டது.
பின்னர் , இரவு 7 மணியளவில் காவற்துறையினர் நீர்த்தாரை தாக்குதலை மேற்கொண்டு போராட்டக்காரர்களை கலைத்திருந்தமை குறிப்பிடத்தக்கது.
கூலித்தொழிலாளியான இவர்களுக்கு அருள்ஜோதி மற்றும் ராஜலட்சுமி ஆகிய மகள்கள் இருந்துள்ளனர்.
அப்போது தினேஷ்குமாரின் மனைவி மற்றும் அவரது தம்பி ஆகியோர் அவரை பிடித்து காவல்நிலையத்தில் ஒப்படைத்துள்ளனர்.
தலை வேறு உடல் வேறாக இருந்த சிறுமியின் உடலை கைப்பற்றி பிரேத பரிசோதனைக்காக ஆத்தூர் அரசு மருத்துவமனைக்கு அனுப்பி வைத்தனர்.
பின்னர், மாணவி குறித்து காவற்துறையிற்கு தகவல் வழங்கப்பட்டுள்ள நிலையில், காவற்துறையினர் மாணவியின் தாயாரிடம் இது குறித்து வினவியுள்ளனர்.
இன்று முற்பகல் நாடாளுமன்ற அமர்வு ஆரம்பமான போது சபாநாகயர் இதனை சபைக்கு அறிவித்தார்.
அத்துடன் தீவிரவாத தடுப்பு சட்ட மூலத்துக்கு எதிராக உயர் நீதிமன்றில் முன்வைக்கப்பட்டுள்ள எட்டு மனுக்களின் பிரதிகளும் நாடாளுமன்றுக்கு கிடைக்கப்பெற்றுள்ளதாக அவர் கூறியுள்ளார்.
இன்று முற்பகல் 10.00 மணிக்கு வவுனியாவில் இருந்து மாத்தறை நோக்கி பயணித்த ரஜரட்ட மெனிகே கடுகதி தொடரூந்தில் மோதி குறித்த நபர் உயிரிழந்துள்ளதாக தொடரூந்து கட்டுப்பாட்டு மையம் குறிப்பிட்டுள்ளது.
உயிரிழந்த நபரின் அடையாளம் இதுவரை உறுதிப்படுத்தப்படவில்லை என காவற்துறை தெரிவித்துள்ளது.
ஏற்கனவே நான்கு தினங்கள் அவர் குற்றப் புலனாய்வுத் திணைக்களத்தில் முன்னிலையாகி இருந்தார்.
கடந்த தினம் இடம்பெற்ற அமைச்சரைக் கூட்டத்தில் வைத்து அவர் இதனைக் கூறியுள்ளார்.
குறித்த விசாரணை அறிக்கையின் தமிழ் மற்றும் சிங்கள பிரதிநிதிகளை தாம் கோரியதாலேயே இது குறித்த நடவடிக்கைகள் இன்னும் தாமதித்திருப்பதாக குறித்த செய்தியில் கூறப்பட்டிருந்ததாகவும், எனினும் தாம் அவ்வாறான கோரிக்கை எதனையும் முன்வைக்கவில்லை என்றும் சுமந்திரன் கூறினார்.
இதேவேளை, இன்று முற்பகல் தமது வீட்டுக்கு மேலாக ட்ரோன் விமானம் ஒன்று பறந்ததாகவும், அது குறித்து நாடாளுமன்றம் அவதானம் செலுத்த வேண்டும் என்றும் நாடாளுமன்ற உறுப்பினர் ரவி கருணாநாயக்க சபையில் கோரிக்கை விடுத்தார்.
இந்தநிலையில் ஆப்கானிஸ்தானிய அரசாங்கத்துக்கும் தலிபானிய தீவிரவாதிகளுக்கும் இடையிலான அமைதிப் பேச்சுவார்த்தையின் பொருட்டு அவர் விடுவிக்கப்பட்டிருப்பதாக செய்திகள் தெரிவிக்கின்றன.
அத்துடன் கொட்டகலை நகரின் கடைகளும் மூடப்பட்டு, வர்த்தக சங்கத்தினரும் இந்த போராட்டத்துக்கு ஆதரவை வெளிப்படுத்தியுள்ளனர்.
அதேநேரம் மடுல்கலை - உலுகங்கை தோட்ட மக்களும் இன்று ஆர்ப்பாட்டம் ஒன்றை நடத்தி இருந்தார்கள்.
அதேநேரம் தெல்தொட்டை, முல்லோயா மற்றும் ஹேவாஹெட்ட பகுதிகளில் பல்வேறு தோட்டப் பிரிவுகளைச் சேர்ந்த ஆயிரக் கணக்கான மக்கள் இன்று ஆர்ப்பாட்டம் நடத்தியுள்ளனர்.
இதேவேளை நோர்வுட் நகரில் இன்றையதினம் வர்த்தக நிலையங்கள் மூடப்பட்டு, வர்த்தக சங்கம் மற்றும் சாரதிகள் சங்கம் என்பன இணைந்து போராட்டத்தை நடத்தினார்கள்.
இதற்கிடையில் பெருந்தோட்டத் தொழிலாளர்களுக்கு அடிப்படை வேதனமாக 1000 ரூபாய் வழங்கப்பட வேண்டும் என்று வலியுறுத்தி, கண்டி ரங்கலை நகரில் ஆர்ப்பாட்டம் ஒன்று நடத்தப்பட்டது.
இதற்கு வர்த்தக சங்கத்தினரும் ஆதரவளிக்கும் வகையில் வர்த்தக நிலையங்களை பூட்டி இருந்ததுடன், கண்டி - ரங்கலை - நியு டிவிசன் - பேன்சைட், கல்டூரியா, ஆனப்பழம் உள்ளிட்ட 24 தோட்டங்களைச் சேர்ந்த மக்கள் ஆர்ப்பாட்டத்தில் ஈடுபட்டிருந்தனர்.
இதுதொடர்பில் பல்கலைக்கழக நிர்வாகம் அக்கறைப்பற்று காவற்துறையில் முறைப்பாடுகளை மேற்கொண்டிருந்தது.
மட்டக்களப்பு மாவட்ட செயலகத்துக்கு முன்பாக கிராம சேவகர்கள் மற்றும் அரச நிர்வாக பணியாளர்கள் சங்கத்தினர் உள்ளிட்டவர்கள் ஆர்ப்பாட்டத்தில் ஈடுபட்டுள்ளனர்.
கொழும்பில் உள்ள தேயிலை சபையில் இன்று மதியம் ஊடக சந்திப்பில் பெருந்தோட்ட சம்மேளனம் இந்த அறிவித்தலை வெளியிட்டுள்ளது.
எனினும், தொழிற்சங்கங்கள் அதனை நிராகரித்தன என்றும் அவர் கூறியுள்ளார்.
தொழிலாளர்கள் உட்பட பெருந்தோட்டத் துறையின் எதிர்காலத்தைப் பாதுகாக்கும் திட்டம் ஒன்றுக்கு செல்ல வேண்டும் என்றும் அவர் குறிப்பிட்டுள்ளார்.
இவர்கள் இன்று கைது செய்யப்பட்டதாக காவற்துறை ஊடக பிரிவு இதனை தெரிவித்துள்ளது.
இன்று மதியம் ஹட்டன் நகரில் இது ஆரம்பிக்கப்பட்டதாக எமது செய்தியாளர் தெரிவித்தார்.
இது குறித்து, 6 குற்றச்சாட்டுக்களின் கீழ் அவருக்கு எதிராக வழக்கு தாக்கல் செய்யப்பட்டுள்ளதாக வெளிநாட்டு செய்திகள் தெரிவிக்கின்றன.
இவர்களில் வர்த்தகரொருவரும் மந்திரவாதியொருவரும் அடங்குவதாக காவற்துறை தெரிவித்துள்ளது.
அமெரிக்காவில் பார்டோ பகுதியில் நடுநிலைப்பாடசாலையில் படிக்கும் 2 மாணவிகள் அங்குள்ள கழிவறையில் பதுங்கி இருந்தனர்.
அப்போது அவர்களிடம் கத்தி இருந்தது.
அவர்களிடம் நடத்திய விசாரணையில் சிறுமிகள் மனித ரத்தம் குடிக்க விரும்பினர்.
இதேவேளை, நிலவும் மழையுடனான காலநிலையுடன் கொத்மலை நீர்த்தேக்கத்தின் வான் கதவுகள் திறக்கப்பட்டுள்ளன.
இதனை மதிக்கும் வகையில் இந்த தீர்மானத்தை மேற்கொண்டதாகவும், லெப்டினன் கேர்ணல் கலன அமுனுபுரவின் துல்லியத்தை உறுதிப்படுத்தவும் இராணுவம் செயற்படும் எனவும் இராணுவ பேச்சாளர் பிரிகேடியர் சுமித் அத்தபத்து மேலும் குறிப்பிட்டுள்ளார்.
அரசாங்கத்தில் இருந்து விலகிய ஸ்ரீலங்கா சுதந்திர கட்சியின் 16 பேர் கொண்ட நாடாளுமன்ற குழுவினால் சுதந்திர ஊடக மையத்தில் இன்று ஏற்பாடு செய்யப்பட்டிருந்த செய்தியாளர் சந்திப்பில் வைத்தே அவர் இதனைக் குறிப்பிட்டுள்ளார்.
இன்றைய நாடாளுமன்ற அமர்வின் போது அவர் இந்த கோரிக்கையை முன்வைத்து போது, அமைச்சர் லக்ஸ்மன் கிரியெல்ல மற்றும் நாடாளுமன்ற உறுப்பினர்களான ரவி கருணாநாயக்கவும் விமல் வீரவங்சவும் தலையீட்டு விவாதத்தில் ஈடுபட்டனர்.
காவல்துறை ஊடகப்பேச்சாளர், காவல்துறை அத்தியட்சகர் ருவான் குணசேகர இதனைக் குறிப்பிட்டுள்ளார்.
ஜனாதிபதி மைத்திரிபால சிறிசேன மற்றும் பாதுகாப்பு அமைச்சின் முன்னாள் செயலாளர் கோட்டாபய ராஜபக்ஷ ஆகியோரை கொலை செய்வதற்கு சதிதிட்டம் தீட்டப்பட்டதாக கூறப்படுகின்றமை தொடர்பில் இன்று ஐந்தாவது நாளாகவும் வாக்குமூலம் வழங்குவதற்காக, குற்றப்புலனாய்வுப் பிரிவில் முன்னிலையாகியிருந்த நிலையில் அவர் கைது செய்யப்பட்டுள்ளார்.
ஏற்கனவே நான்கு தினங்கள் அவர் குற்றப் புலனாய்வுத் திணைக்களத்தில் முன்னிலையாகி இருந்தார்.
தமிழ் அரசியல் கைதிகள் விடயம் தொடர்பில் தமிழ்த் தேசியக் கூட்டமைப்பின் பேச்சாளரான நாடாளுமன்ற உறுப்பினர் எம்.ஏ.சுமந்திரனால் முன்வைக்கப்பட்ட சபை ஒத்திவைப்பு வேளை பிரேரணை மீதான விவாதத்தில் உரையாற்றியபோதே அவர் இந்த கோரிக்கையை முன்வைத்துள்ளார்.
முன்னாள் வெளிவிவகார அமைச்சர் லக்ஷ்மன் கதிர்காமர் கொலை தொடர்பில் குற்றம் சுமத்தப்பட்ட இருவரும், பாதுகாப்பு அமைச்சின் முன்னாள் செயலாளர் கோட்டாபய ராஜபக்ஷவை கொலை செய்ய முயற்சித்தமை குறித்து 3 அல்லது 4 பேர் சந்தேகத்துக்குரியவர்களாக உள்ளனர்.
இதேநேரம், வழக்கு நடவடிக்கைகள் உரிய முறையில் இடம்பெற்று தண்டனை அனுபவிக்க சிறைப்படுத்தப்பட்ட 43 கைதிகள் உள்ளனர்.
இதையடுத்து கடந்த செப்டம்பர் மாதம் குறித்த 18 உறுப்பினர்களையும் தகுதி நீக்கம் செய்து சபாநாயகர் மேற்கொண்ட தீர்மானத்தை சென்னை உயர்நீதிமன்றம் இன்று உறுதிப்படுத்தியுள்ளது.
இதன்மூலம், தமிழகத்தில் விரைவில் இடைத்தேர்தல் நடத்தப்படுவதற்கான வாய்ப்புகள் உள்ளதாக தமிழக ஊடகங்கள் தெரிவித்துள்ளன.
கொழும்பில் இன்று இடம்பெற்ற ஊடக சந்திப்பில் வைத்து அதன் உறுப்பினர்கள் இதனைத் தெரிவித்துள்ளனர்.
அவரது அமைச்சில் இன்று நடைபெற்ற செய்தியாளர் சந்திப்பில் வைத்த அவர் இந்தக் கருத்தை தெரிவித்தார்.
இதேவேளை, பெருந்தோட்டத் தொழிலாளர்களின் வேதன அதிகரிப்பு விடயத்தில் அரசாங்கம் உரிய வகையில் செயற்படாவிட்டால், தமிழ் முற்போக்கு கூட்டணி அரசாங்கத்தின் பங்காளிக் கட்சியாக இருப்பது தொடர்பில் மீள்பரிசீலனை செய்ய நேரிடும் என அமைச்சர் மனோ கணேசன் இன்று காலை பிரதமரிடம் கூறியதாக எமது செய்திச் சேவையிடம் தெரிவித்தார்.
இதன்போதே இந்த விளக்கமறியல் உத்தரவு பிறப்பிக்கப்பட்டுள்ளது.
வாக்குமூலம் ஒன்றை வழங்குவதற்காக அவர் இன்று காலை குற்றப்புலனாய்வு திணைக்களத்தில் முன்னிலையானார்.
இதேவேளை , பெருந்தோட்ட தொழிலாளர்களது வேதன அதிகரிப்பு சம்பந்தமான கூட்டம் ஒன்று இன்றையதினம் இடம்பெறவுள்ளது.
இதன்போது பிரதமர் இதற்கான இணக்கத்தை வெளிப்படுத்தி சந்திப்பை மேற்கொண்டு, இன்றைய தினத்துக்குள் பெருந்தோட்டத் தொழிலாளர்களது வேதனம் தொடர்பான தீர்மானத்துக்கு வருவதாக உறுதியளித்திருந்தார்.
